Blog Titles,Blog Content
বার্ড ফ্লু: মানুষের মধ্যে বিরল এক ভাইরাসের প্রথম কেস ধরা পড়লো চীনে,
কোভিড: সীমান্তবর্তী জেলাগুলোয় মানুষের ঘরের বাইরে বের হওয়া বন্ধ করতে চায় কোভিড পরামর্শক কমিটি,
"কোভিড: বিমান চলাচল নিষিদ্ধের তালিকা রদবদল, যেসব দেশে যাওয়া-আসা যাবে না",
ফাঙ্গাস: কোভিড রোগীদের বাড়তি ঝুঁকি ওষুধ প্রতিরোধী প্রাণঘাতী ছত্রাক ও সুপারবাগের সংক্রমণ বৃদ্ধি,
কোভিড: বাংলাদেশে মহামারি মোকাবেলায় স্বাস্থ্যখাতে বরাদ্দের বেশিরভাগ ব্যয় করতে না পারার কারণ কী হতে পারে,
কোভিড: করোনাভাইরাসে শনাক্ত মানুষের সংখ্যা ৮ লাখ ছাড়ালো বাংলাদেশে।,
"এলএসডি: কেউ আসক্ত কি না কীভাবে বুঝবেন, কোন লক্ষণ আছে কী?",
লকডাউন: বিধিনিষেধের সময়সীমা বাড়ানো হলো আরো এক সপ্তাহ,
"ফাঙ্গাস: কোভিড পরবর্তী কালো, সাদা বা হলুদ ছত্রাকের সংক্রমণ সম্পর্কে কী জানা যাচ্ছে",
কোভিড: দুই সপ্তাহের ব্যবধানে আবার বেড়েছে করোনাভাইরাসে মৃত্যু ও শনাক্ত,
"কোভিড-১৯: চাঁপাইনবাবগঞ্জে করোনা সংক্রমণের হার ৫৫%, সাত দিনের লকডাউন",
মেহমেত আজিজ: সাইপ্রাসের যে ম্যালেরিয়া নির্মূলকারী 'বীর'কে সবাই ভুলে গেছে,
করোনা ভাইরাস: ভারতীয় ভ্যারিয়েন্টের বিরুদ্ধে লড়তে সক্ষম ফাইজার ও অ্যাস্ট্রজেনেকার টিকা,
"শিশুদের দৃষ্টিত্রুটি: অভিভাবকরা যেভাবে বুঝবেন, যা করতে পারেন",
"করোনাভাইরাস মহামারিকে কেন্দ্র করে বাংলাদেশের স্বাস্থ্যখাতে দুর্নীতির মহোৎসব, বলছে টিআইবি",
কোভিড আক্রান্ত পিতাকে বাঁচাতে একটি ভারতীয় পরিবারের লড়াই,
"লম্বা সময় কাজে স্বাস্থ্যের হানি, সুস্থ থাকতে যা করতে পারেন",
কোভিড: ২৪ ঘণ্টায় শনাক্ত রোগীর সংখ্যা বেড়েছে প্রায় দ্বিগুণ,
কোভিড: দ্বিতীয় ডোজের টিকা নিশ্চিত করা নিয়ে চিন্তিত বাংলাদেশ সরকার- বলেছেন দেশটির স্বাস্থ্যমন্ত্রী,
কোভিড: ভারতে আটকে পড়া বাংলাদেশিদের ফেরার ব্যবস্থা ঈদের পরেই,
করোনাভাইরাস: ভারতে হিসেবেই ধরা হচ্ছে না যেসব মৃত্যু,
কোভিড: করোনাভাইরাস মহামারির শুরু থেকে রোগীদের সেবা দিয়ে যাচ্ছেন নার্স তেরেসা,
"বিহারে গঙ্গায় ভেসে এল অন্তত ৪০টি লাশ, কোভিড ছড়ানোর আতঙ্ক",
ব্ল্যাক ফাঙ্গাস: বিরল এই ছত্রাক ভারতে কোভিড রোগীদের অন্ধ করে দিচ্ছে,
