Blog Titles,Blog Content
"অমিক্রন: ১৩ই জানুয়রি থেকে উন্মুক্ত স্থানে সামাজিক, ধর্মীয় অনুষ্ঠান এবং সমাবেশ বন্ধ থাকবে",
সোশ্যাল মিডিয়া যেভাবে আসক্ত করে ফেলছে কিশোর-কিশোরীদের,
কোভিড: শিক্ষার্থীদের করোনাভাইরাসের টিকা দেয়ার শর্ত আরো শিথিল করলো সরকার,
অমিক্রন: করোনাভাইরাসের নতুন ভ্যারিয়েন্টে আক্রান্তদের দেহে যেসব উপসর্গ দেখা দেয়,
"বন্ধ্যাত্ব কেন হয়, চিকিৎসা কী, কোথায় যাবেন - নিঃসন্তান দম্পতিরা সমাজে যেভাবে নিগ্রহের শিকার হন",
কোভিড: করোনা ভাইরাস অমিক্রন ভ্যারিয়েন্টকে মৃদু হিসেবে বিবেচনা করা ঠিক হবে না - বিশ্ব স্বাস্থ্য সংস্থার সতর্কতা,
ভারতে যেখানে সেখানে থুতু বা পিক ফেলার অভ্যাস কেন কিছুতেই থামানো যাচ্ছে না,
করোনাভাইরাস: সীমান্তপথে অমিক্রন সংক্রমণ ঠেকাতে কী করছে সরকার?,
বাংলাদেশে ২০ বছর ধরে পেটের মধ্যে কাঁচি নিয়ে ঘুরছেন এক নারী,
করোনাভাইরাস: তিন থেকে ছয় সপ্তাহের মধ্যে সারা দেশে ছড়িয়ে পড়তে পারে অমিক্রন- বলছেন বিজ্ঞানী,
"অমিক্রন: টিকার সনদ ছাড়া রেস্টুরেন্টে প্রবেশ করা যাবে না, বাংলাদেশের স্বাস্থ্যমন্ত্রী",
২০২২ খ্রিস্টাব্দ: নতুন বছরে বাংলাদেশে করোনাভাইরাস সংক্রমণ কোন পথে যেতে পারে,
"ভাত-ঘুম: বদভ্যাস নয়, এর রয়েছে দারুণ সব উপকারিতা",
"তাসনিম জারা: বাংলা ভাষায় স্বাস্থ্য বিষয়ক তথ্য ছড়িয়ে দিচ্ছেন, ট্যাবু নিয়ে তৈরি করছেন ভিডিও কন্টেন্ট",
যৌন এবং প্রজনন স্বাস্থ্য শিক্ষা: বাংলাদেশে মাধ্যমিক স্কুলের এক কোটি শিক্ষার্থীকে কী পড়ানো হবে?,
"ইউরোপ-আমেরিকায় অমিক্রনের ঢেউ, রেকর্ড সংখ্যায় সংক্রমণ",
৬০ শতাংশের বেশি শহুরে কিশোর-কিশোরী মানসিক চাপে ভুগছে: গবেষণা,
"ভাত-ঘুম: বদভ্যাস নয়, এর রয়েছে দারুণ সব উপকারিতা",
"নখ কামড়ালে কী হয়, অভ্যাস দূর করার কিছু টিপস",
ঠোঁটের পরিবর্তন করতে ফটো ফিল্টার কীভাবে তরুণদের লিপ ফিলার নিতে প্রভাবিত করছে?,
"ইউরোপে ছড়াচ্ছে 'বিদ্যুৎ গতিতে', ৮৯টি দেশে অমিক্রনের বিস্তার",
কোভিড: অমিক্রনের জন্ম হলো কীভাবে এবং করোনাভাইরাস মহামারি মোকাবেলায় এই ভ্যারিয়েন্টের অর্থ কী?,
৮৪-বছর বয়সে এখনও নিয়মিত জিম করেন ব্রায়ান,
অমিক্রন: করোনার নতুন ভ্যারিয়েন্টের কারণে আন্তর্জাতিক ভ্রমণে কঠোর হচ্ছে বিধিনিষেধ,
