Blog Titles,Blog Content
জনস্বাস্থ্য ইন্সটিটিউট: পুরুষদের গোড়ালির ওপর পোশাক ও নারীদের হিজাব পরার নির্দেশ বাতিল করে বিজ্ঞপ্তি দিলেন পরিচালক,
"করোনা ভাইরাস: বাংলাদেশে নতুন শনাক্ত ১৬৮১ জন, মৃত্যু ২৫ জনের",
চিংড়ি: জেলি-যুক্ত চিংড়ি চিনবেন কীভাবে? এটা কি স্বাস্থ্যের জন্য ক্ষতিকর?,
"করোনা ভাইরাস: ২৪ ঘণ্টায় প্রায় দেড় হাজার শনাক্ত, ২৩ জনের মৃত্যু",
কোভিড-১৯ এর অ্যান্টিবডি শরীরে 'বেশিদিন থাকে না' - তাহলে টিকায় কতটা কাজ হবে?,
"করোনা ভাইরাস: গত ২৪ ঘণ্টায় মৃত্যু ২০ জনের, নুতন শনাক্ত ১৩৩৫ জন",
করোনা ভাইরাস: 'নো মাস্ক নো সার্ভিস' নির্দেশনা বাস্তবায়ন কতোটা সম্ভব,
করোনা ভাইরাস: বাংলাদেশে কোভিড-১৯ রোগে শনাক্তের সংখ্যা চার লক্ষ ছাড়ালো,
পর্নোগ্রাফির প্রভাব: 'পর্ন আসক্তি জীবনের এক অন্ধকার দিক',
করোনা ভাইরাস: বাংলাদেশে দৈনিক শনাক্তের হার এখন ১০ শতাংশের নিচে,
পাকিস্তানের জোড়া মাথার যমজ শিশু সাফা ও মারওয়া যেভাবে আলাদা হয়ে বাড়ি ফিরলো,
করোনা ভাইরাস: মহামারির এই জীবাণু কেন এত প্রাণঘাতী?,
"করোনা ভাইরাস: বাংলাদেশে নতুন শনাক্ত ১৫৮৬ জন, মৃত্যু ১৪ জনের",
"করোনা ভাইরাস: ব্রাজিলে অক্সফোর্ডের ভ্যাকসিন ট্রায়ালে অংশগ্রহণকারীর মৃত্যু, কোন নিরাপত্তা ঝুঁকি পাওয়া যায়নি",
"মাধ্যমিক শিক্ষা: এ বছর স্কুল খুলবে না, বার্ষিক পরীক্ষা হবে না, মূল্যায়ন হবে যেভাবে",
করোনা ভাইরাস: যে ১০ টি বেসরকারি প্রতিষ্ঠানকে বিদেশগামীদের নমুনা পরীক্ষার অনুমতি দিয়েছে সরকার,
"করোনা ভাইরাস: বাংলাদেশে শনাক্ত আরো ১৩৮০ জন, মারা গেলেন ১৮ জন",
"করোনা ভাইরাস: বয়স্ক লোকদের টিকা দেওয়া যেসব কারণে খুব কঠিন, তাদের দেহে কতোটা কাজ করে এই টিকা?",
"করোনা ভাইরাস: ভারত বাংলাদেশের মধ্যে বিমান চলাচল আবার শুরু হচ্ছে, কী সতর্কতা নিচ্ছে বাংলাদেশের সরকার",
"করোনা ভাইরাস: চব্বিশ ঘণ্টায় ২১ জনের মৃত্যু, শনাক্ত ১৬'শর বেশি",
গ্লোব বায়োটেক করোনা ভ্যাকসিন: ছয় মাসের মধ্যে বাজারে আসতে পারে বাংলাদেশি বিজ্ঞানীদের তৈরি টিকা,
রাগ হলে যেসব উপায়ে নিজেকে নিয়ন্ত্রণ করতে পারেন,
করোনা ভাইরাস: বাংলাদেশে এখন পর্যন্ত শনাক্ত কোভিড রোগীদের প্রায় ৮০ ভাগই সুস্থ হয়েছেন,
উচ্চ রক্তচাপ বা হাই ব্লাড প্রেশার: নীরব এই ঘাতক থেকে বাঁচতে আপনি যা যা করবেন,
