Blog Titles,Blog Content
"ফুসফুসের ক্যান্সার: সবচেয়ে প্রাণঘাতী এই ক্যান্সারের কারণ, লক্ষণ ও চিকিৎসা কী?",
করোনা ভাইরাস: রোজার মাসে বাংলাদেশে কীভাবে চলবে ভ্যাকসিন কার্যক্রম?,
কিডনি জটিলতায় মৃত্যু ২০২০ সালে প্রায় তিনগুণ হয়েছে যে কারণে,
করোনা ভাইরাস: টিকার প্রথম ডোজের পর ‘কম সুরক্ষিত’ থাকেন ক্যান্সার রোগীরা,
"শিশুর খাদ্য: কোন বয়সে কী খাওয়াবেন, কী খাওয়াবেন না?",
করোনা ভাইরাস: ব্রিটেন থেকে আসা ছয় জনের দেহে পাওয়া গেছে নতুন ভ্যারিয়ান্ট,
করোনা ভাইরাসের টিকা: পুরো ডোজ টিকার পর মাস্ক খোলা যাবে বলে মার্কিন নির্দেশনা,
করোনা ভাইরাস: দুই ডোজ টিকার আগে পুরোপুরি নিরাপদ নয়,
করোনা ভ্যাকসিন: টিকার নেয়ার বয়স সীমা এখনই ৪০ বছরের নিচে নামাচ্ছে না সরকার,
যশোরে প্রসূতির মৃত সন্তান প্রসবের চেষ্টা করতে গিয়ে যা ঘটালেন আয়া,
"টেস্টটিউব বেবির অনেক খরচ, তাই যুক্তরাজ্যে কিছু নারী শুক্রাণু দাতা খুঁজে নিচ্ছেন ফেসবুক থেকে",
"করোনা ভাইরাস: শুধু অসুস্থ হওয়া থেকে রক্ষা নয়, সংক্রমণও কমাচ্ছে টিকা- বলছে গবেষণা",
ডায়াবেটিস রোগ প্রতিরোধের ৫টি উপায়: চিকিৎসকরা যা বলছেন,
ক্যান্সার: ওভারিয়ান বা ডিম্বাশয়ের ক্যান্সার সম্পর্কে যা জানা জরুরি,
"ঢাকায় কিউলেক্স মশা বেড়েছে চারগুণ, পদক্ষেপ না নিলে মার্চে ঘনত্ব চরমে পৌঁছাবে",
করোনা ভাইরাস: ভারতে কি সংক্রমণের 'সেকেন্ড ওয়েভ' আঘাত হেনেছে?,
করোনা ভাইরাস: টিকায় 'দারুণভাবে' কাজ হচ্ছে - স্কটল্যান্ডে জরিপের ফল,
"করোনা ভাইরাস: এসেছে টিকার দ্বিতীয় চালান, আরো প্রায় সাত কোটি ডোজের নিশ্চয়তা?",
‘শিক্ষার্থীদের ভ্যাকসিন দেবার পর খুলবে বিশ্ববিদ্যালয়’ বলেছেন বিশ্ববিদ্যালয় মঞ্জুরি কমিশনের সদস্য,
"ক্যান্সার: কোলন ক্যান্সারের ঝুঁকি, লক্ষণ ও চিকিৎসা",
"স্তন ক্যান্সার: নারী-পুরুষ সবারই হতে পারে, এটির ঝুঁকি, লক্ষণ ও চিকিৎসা কী?",
ক্যান্সার: জরায়ুমুখ ক্যান্সারের চিকিৎসায় নিয়মিত পরীক্ষা যে কারণে জরুরি,
করোনা ভাইরাস টিকা: বাংলাদেশে কোভিড-১৯ ভ্যাকসিনে আগ্রহ বাড়ার কয়েকটি কারণ,
খাবারে বিষক্রিয়া কেন হয়? কিভাবে এড়িয়ে চলবেন?,
