Blog Titles,Blog Content
বাংলাদেশে আত্মহত্যার হার ঝিনাইদহে বেশি যে কারণে,
করোনা ভাইরাস: বাংলাদেশে চব্বিশ ঘণ্টায় ৪১ জনের মৃত্যু হলো,
"অজানা রোগে ভুগছেন এই তরুণী, সাত বছরে ৬৬ বার অপারেশন হয়েছে তার",
করোনা ভাইরাস: বাংলাদেশে পরীক্ষা অনুপাতে শনাক্তের হার আজও কম,
করোনা ভাইরাস: প্রথম কোভিড-১৯ শনাক্তের ছয় মাস পর বাংলাদেশের চিকিৎসা সক্ষমতা এখন যে পর্যায়ে,
গায়ে আগুন লাগলে সাথে সাথে যে পাঁচটি কাজ করা জরুরি,
"কাফিল খান: 'ভারতের দুশমন', নাকি রাষ্ট্রীয় নিপীড়নের প্রতীক?",
"নারায়ণগঞ্জের মসজিদে বিস্ফোরণ: ১৭ জন নিহত, বাকীদের অবস্থাও আশঙ্কাজনক",
"করোনা ভাইরাস: বাংলাদেশে কোভিড শনাক্তের হার এখন ১৫ শতাংশের নিচে, মৃত্যুও কমেছে",
"করোনা ভাইরাস: বাংলাদেশে গত ২৪ ঘণ্টায় ৩৫ জনের মৃত্যু, নতুন শনাক্ত ১,৯৫০",
লাইসেন্স ছাড়াই যেভাবে চলছে বেসরকারি হাসপাতাল,
"করোনা ভাইরাস: বাংলাদেশে করোনাভাইরাসে নতুন করে আরো ৩৩ জনের মৃত্যু, শনাক্ত ২,১৭৪ জন",
তরুণদের মধ্যে কি কোলন ক্যান্সারের ঝুঁকি বাড়ছে?,
করোনা ভাইরাস: বাংলাদেশে দুই লাখ মানুষ সেরে উঠেছে কোভিড-১৯ থেকে,
"করোনা ভাইরাস: বাংলাদেশে কোভিড টেস্টের ফি নেয়ায় পরিস্থিতির সঠিক চিত্র পাওয়া যাচ্ছে না, ল্যান্সেট ম্যাগাজিনে প্রতিবেদন",
করোনাভাইরাস: মৃত্যু কমছে কিন্তু নতুন রোগী কেন বাড়ছে?,
"করোনা ভাইরাস: বেক্সিমকোর সঙ্গে ভারতের সেরাম ইনস্টিটিউটের চুক্তি, বাংলাদেশে অক্সফোর্ডের ভ্যাকসিন সরবরাহ হবে অগ্রাধিকার ভিত্তিতে",
করোনা ভাইরাস: বাংলাদেশে এখনি স্কুল না খুলতে যেসব যুক্তি বিশেষজ্ঞদের,
করোনা ভাইরাস: চীনা ভ্যাকসিনের ট্রায়ালের অনুমতি দিলো বাংলাদেশ,
যৌন স্বাস্থ্য: ওরাল সেক্স নারীর যোনিতে ব্যাকটেরিয়াল ভ্যাজিনোসিস রোগ ছড়ায়‍: গবেষণা,
করোনা ভাইরাস:বাংলাদেশে শনাক্তের সংখ্যা তিন লাখ ছাড়ালো,
"করোনা ভাইরাস: অনুমতি পাচ্ছে না 'অ্যান্টিবডি টেস্ট', আসছে 'অ্যান্টিজেন টেস্ট'",
করোনা ভাইরাস: বাংলাদেশে আক্রান্ত ব্যক্তি শনাক্তের সংখ্যা প্রায় তিন লাখ,
হজমশক্তি বাড়ানোর ৫টি উপায় কী কী?,
