Blog Titles,Blog Content
করোনাভাইরাস: সংক্রমণ ঠেকাতে ভারত সরকারের মোবাইল অ্যাপ নিয়ে কীসের এত বিতর্ক?,
N/A,
করোনাভাইরাস: অর্থ সংগ্রহে বাড়ির বাগানে হাঁটছেন ১০০ বছর বয়সী দবিরুল ইসলাম চৌধুরি,
করোনাভাইরাস: হাত ধোয়া জরুরি হলেও অনেকে তা করেন না কেন?,
"করোনাভাইরাস: বাংলাদেশে লকডাউনে কতটা লাভ, কতটা ক্ষতি?",
করোনাভাইরাস: কোভিড-১৯ এর উৎপত্তি চীনের গবেষণাগারে হয়েছে বলে 'বিশ্বাস' ট্রাম্পের,
করোনাভাইরাস: মহামারির মধ্যে ডাক্তারদের শাস্তি নিয়ে প্রশ্ন,
করোনাভাইরাস: ভিড় ঠেকাতে সুইডেনের পার্কে ছড়ানো হচ্ছে মুরগীর বিষ্ঠা,
N/A,
করোনাভাইরাস: লকডাউনে বিপদে বিদেশে চিকিৎসা প্রত্যাশী বাংলাদেশি রোগীরা,
করোনাভাইরাস প্যানডেমিকের মাঝে ৯৮ বছর বয়সেও রোগী দেখছেন যে ডাক্তার,
করোনাভাইরাস: হাসপাতালে রোগী ভর্তিতে অনিয়মের অভিযোগ,
"করোনাভাইরাস: নারায়ণগঞ্জে চিকিৎসকের পরিবারে ১৭ জন কোভিড-১৯ আক্রান্ত, এলাকাবাসীর বিক্ষোভ",
N/A,
"করোনাভাইরাস: ইউনাইটেড হাসপাতালের বিরুদ্ধে ভেন্টিলেশন থেকে রোগী বের করে দেয়ার অভিযোগ, কর্তৃপক্ষের অস্বীকার",
করোনাভাইরাস: নিউ ইয়র্কের এই ডাক্তার আত্মহত্যা করলেন কেন?,
N/A,
দেড় মাস পর প্রথম যখন বাইরে গেল স্পেনের শিশুরা,
N/A,
করোনাভাইরাস টিপস: যেসব ভুয়া স্বাস্থ্য পরামর্শ এড়িয়ে চলবেন,
করোনাভাইরাস: সংক্রমণ রোধে এক দেশের নেয়া পদক্ষেপের সাথে আরেক দেশের পদক্ষেপের তুলনা করা কি সম্ভব?,
"করোনাভাইরাস ভ্যাকসিন আপডেট: টিকা কী, কীভাবে তৈরি হয়?",
করোনাভাইরাস: বিশ্বজুড়ে মৃতের সংখ্যা দুই লাখ ছাড়িয়েছে,
করোনাভাইরাস: ইন্টারনেটে ছড়াচ্ছে যেসব ভুয়া তত্ত্ব,
