Blog Titles,Blog Content
"জাস্টিন বিবার যে র‍্যামজে হান্ট সিনড্রোম রোগে আক্রান্ত হয়েছেন, সেটা সম্পর্কে কী জানা যায়?? বাংলাদেশে কী চিকিৎসা রয়েছে?",
জাস্টিন বিবার: র‍্যামজে হান্ট সিনড্রোম কী ধরনের অসুখ যাতে তার মুখের ডানপাশ অবশ হয়েছে,
বাংলাদেশের হাসপাতালে স্বাস্থ্য ব্যবস্থার বেহাল দশার দায় কার,
ভেজাল প্যারাসিটামল: শিশু মৃত্যুর ঘটনায় প্রতি পরিবারকে ১৫ লাখ টাকা করে ক্ষতিপূরণের নির্দেশ দিয়েছে হাইকোর্ট,
বয়সের ছাপ কতটা ঠেকাতে পারে কসমেটিক বা প্লাস্টিক সার্জারি?,
"ধূমপান: বিড়ি, সিগারেট, তামাক গ্রহণ না করেও যেভাবে ক্ষতির মুখে পড়তে পারেন",
অবৈধ ক্লিনিকের বিরুদ্ধে অভিযান: অপারেশন টেবিলে রোগীকে রেখে পালিয়ে গেলেন ডাক্তার-নার্স,
"মাংকিপক্স: সারা বিশ্বে ছড়িয়ে পড়ছে এই ভাইরাস, বিশ্ব স্বাস্থ্য সংস্থা বলছে নিয়ন্ত্রণ করা সম্ভব",
মাংকিপক্স: বিশ্ব স্বাস্থ্য সংস্থা বলছে এই ভাইরাসের বিস্তার ঠেকানো সম্ভব,
মাংকিপক্স: এই ভাইরাসটি ঠেকাতে কী ব্যবস্থা নিচ্ছে বাংলাদেশ সরকার,
মাংকিপক্স: সংক্রামক এই অসুখটি উদ্বেগের কারণ নাকি অগ্রাহ্য করার মত একটি রোগ?,
মাংকিপক্স: পৃথিবীর ১২টি দেশে ৮০ জনের দেহে সংক্রমণ নিশ্চিত করা হয়েছে,
"মাংকিপক্স: বিরল রোগটির কারণ ও লক্ষণ কী, কীভাবে ছড়ায়?",
অতিরিক্ত মোটা হবার কারণ কি জিনগত ত্রুটি?,
"মাংকিপক্স: যুক্তরাষ্ট্র, ক্যানাডা, ইউরোপে ছড়িয়ে পড়ছে বিরল এই রোগ",
ইতিহাসের সাক্ষী: ইউরোপে সর্বশেষ গুটি বসন্তের প্রাদুর্ভাব যেভাবে নির্মূল করা হয়েছিল,
স্বাস্থ্য: চোখ দেখেই বুঝে নিতে পারেন আপনার কী রোগ হয়েছে,
মানসিক স্বাস্থ্য: আনন্দ আর বিষাদের এক রোগ বাইপোলার ডিসঅর্ডার,
এক সাথে খাওয়া-দাওয়া করার উপকারিতা কী?,
ফ্যাটি লিভার ডিজিজ: মদ্যপান না করেও কেন অনেকে যকৃতের এই মারাত্মক অসুখটিতে আক্রান্ত হচ্ছেন,
কোন খাবারগুলোর কারণে মানুষ বায়ু ত্যাগ করে?,
"চিনি ও মিষ্টি : শরীরের জন্য কতটা ভাল, কতটা খারাপ?",
গরুর মাংস: পুষ্টিগুণ কতোটা? কতোটুকু খাওয়া নিরাপদ?,
ভুয়া ডাক্তারদের খপ্পরে পড়ে মিশরের নারীরা যেভাবে স্বাস্থ্য ঝুঁকিতে পড়ছেন,
