Blog Titles,Blog Content
"উচ্চ রক্তচাপে হার্টঅ্যাটাক-স্ট্রোকের ঝুঁকি বাড়ায়, নিয়ন্ত্রণে কী করবেন?","উচ্চ রক্তচাপ ভয়ঙ্কর পরিণতি ডেকে আনতে পারে। অনেক সময় উচ্চ রক্তচাপের কোনো প্রাথমিক লক্ষণ দেখা যায় না। নীরবে উচ্চ রক্তচাপ শরীরের বিভিন্ন অংশকে ক্ষতিগ্রস্ত করতে পারে। এ জন্যই উচ্চ রক্তচাপকে ‘নীরব ঘাতক’ বলা যেতে পারে। অনিয়ন্ত্রিত ও চিকিৎসাবিহীন উচ্চ রক্তচাপ থেকে মারাত্মক শারীরিক জটিলতা দেখা দিতে পারে।,চিকিৎসকদের মতে, শরীরে রক্তচাপ বাড়ার মূল কারণ অস্বাস্থ্যকর জীবনযাপন। এ ছাড়া খাদ্যতালিকায় অবশ্যই পরিবর্তন আনা প্রয়োজন। আধুনিক জীবনে কাজের চাপ, দুশ্চিন্তা, বিভিন্ন ব্যস্ততার জাঁতাকলে রক্তচাপ হঠাৎ বেড়ে যেতেই পারে।,বর্তমানে বয়স ৩০ পেরোলেই ঝুঁকি বাড়ে উচ্চ রক্তচাপের। উচ্চ রক্তচাপে হার্টঅ্যাটাক-স্ট্রোকের ঝুঁকি বাড়ায়। ,কত থাকলে ভালো?,বিশ্ব স্বাস্থ্য সংস্থা একজন সুস্থ ব্যক্তির রক্তচাপের স্বাভাবিক মাপ হিসেবে ১২০/৮০-কে নির্দিষ্ট করে। পরে জীবনযাপনের সঙ্গে সামঞ্জস্য রেখে এই অঙ্কই তারা বাড়িয়ে ১৩০ করে। ,সম্প্রতি প্রকাশিত আমেরিকান হার্ট অ্যাসোসিয়েশনের নির্দেশিকা অনুযায়ীও এই মাপকে ১৩০ ধরা হয়েছে। 
তবে হৃদরোগ বিশেষজ্ঞদের মতে, ১৪০ পর্যন্ত চাপ উঠলেও শঙ্কার কারণ নেই। তার চেয়ে বেশি থাকলে তবেই তাকে উচ্চ রক্তচাপ বলা যাবে।,কী করবেন?,১. বয়স ৩০ পেরোলেই নিয়ম করে রক্তচাপ মেপে চলুন। বাড়িতে এই যন্ত্রও কিনেও রাখতে পারেন।,২. ধূমপান, অতিরিক্ত মদ্যপান, লাগামছাড়া চা-কফি খাবেন না। ,৩. মাসে এক আধবার ২-৩ টুকরো পাঁঠার মাংসে কোনো ক্ষতি নেই। ,৪. বিরিয়ানির মাংস খেলে ক্ষতি নেই। তবে মাংসের ঝোল খাবেন না। মাংসের ঝোলে মাংসের ফ্যাট মিশে থাকে, আর আমরা মাংস কম খেয়ে ঝোলটুকুই বেশি খাই।,৫. সবুজ শাকসবজি ও ফলমূল খান। জোর দিন পটাশিয়ামসমৃদ্ধ ফলমূলের ওপর।,৬. ব্লাডপ্রেশার বাড়ার সঙ্গে সঙ্গে শরীরের অন্য কোনো সমস্যা বাড়ছে কিনা সে দিতে খেয়াল রাখুন। ,৭. লবণ কম খান। সোডিয়ামসমৃদ্ধ খাবারেও না খাওয়ার অভ্যাস করুন। ,৮. ডায়েট থেকে ফ্যাটও একেবারে বাদ নয়। কারণ শর্করা ও প্রোটিনের পাশাপাশি ফ্যাটও দরকার শরীরে। ,তথ্যসূত্র: আনন্দবাজার পত্রিকা,"
খাওয়ার পরে যে কাজগুলো ভুলেও করবেন না,"সঠিক নিয়ম মেনে সঠিক খাবার খেলে যেমন স্বাস্থ্যের উন্নতি হয়, তেমনই নিয়ম না মেনে ভুলভাল খাদ্যাভ্যাস স্বাস্থ্যের অবনতি ঘটায়।,খাওয়ার পরে আমাদের অনেকেরই ঘুম পায়। খেয়ে উঠেই শুয়ে পড়লে ওজন তো বাড়বেই হজমের সমস্যাও দেখা দেবে। তাই খেয়ে উঠে অন্তত এক ঘণ্টা পরে বিছানায় যান।,ভরা পেটে ফল খাওয়া একেবারেই উচিত নয়। খালি পেটে ফল খেলে তবেই তার খাদ্যগুণ আমাদের শরীরে শোষিত হয়। তাই খাওয়ার বেশ কিছুটা সময় পরে ফল খাওয়া উচিত।,খাওয়ার পর অনেকেই কোমরের বেল্ট একটু হালকা করে নেন। এটিও খারাপ অভ্যেস। কখনোই পেট এতটা ভর্তি করে খাওয়া উচিত নয়, যাতে কোমরের বেল্ট হালকা করতে হয়।,খাবার পরেই অনেকে ধূমপান করেন। ভরা পেটে ধূমপান করলে তা শরীরের বেশি ক্ষতি করে। ভরা পেটে ধূমপান করলে ইনটেসটাইন ক্ষতিগ্রস্ত হয়।,জল খাওয়া শরীরের জন্য অত্যন্ত উপকারী। কিন্তু খেয়ে উঠেই জলপান করবেন না। খাবার খেয়েই জল খেলে তা হজমে সহায়ক গ্যাসট্রিক রসকে হালকা করে দেয়। ফলে খাবার ঠিকমতো হজম হতে চায় না। এর ফলে গ্যাস-অম্বলের সমস্যা দেখা দিতে পারে। খেয়ে উঠেই চা বা কফি খাওয়া ঠিক নয়।,"
শরীরচর্চার আগে কফি পানের ৪ উপকার,"কফির কদর দিন দিন বাড়ছে। কফি পানের উপকার না জেনেও অনেকে এটি খেয়ে থাকে। কফি খেলে দেহমন চাঙা থাকে। রয়েছে নানা উপকার। 
শরীরচর্চার আগে এক কাপ কফি খেতে পরামর্শ দিয়েছেন গবেষকরা। শরীরচর্চার আগে কফি খেলে শরীর থেকে অতিরিক্ত মেদ ঝড়ে। 
 ,‘দ্যা ইন্টারন্যাশনাল জার্নাল অব স্পোর্ট নিউট্রিশন অ্যান্ড এক্সেরসাইজ মেটাবলিজম’য়ে প্রকাশিত গবেষণা থেকে জানা যায়, যেসব খেলোয়ার শরীরচর্চার আগে এক কাপ গরম কফি পান করেন তারা শরীরচর্চার পরে ১৫ শতাংশ বেশি ক্যালরি খরচ করতে সক্ষম হন। ,গবেষণার পর্যবেক্ষণে দেখা গেছে, সকালে কফি খেলে ক্যালরি গ্রহণে নিয়ন্ত্রণ রাখে। যারা ক্যাফেইন গ্রহণ করেন তারা অন্যদের তুলনায় ৭২ ক্যালরি কম গ্রহণ করেন।,আসুন জেনে নেই কফি পানে যত উপকার-,১.সকালে ঘুম থেকে উঠে এক কাপ কফি খেলে ঘুম ঘুম ভাব দূর হয়।ফলে ব্যায়াম করতে সুবিধা হয়। ,২. যুক্তরাষ্ট্রের ‘ইউনিভার্সিটি অফ ইলিনয়েস’য়ের করা এক গবেষণাতে দেখা গেছে, শরীরচর্চার পরে কফি পান করলে পেশির ব্যথা দূর হয়।,৩. শরীরচর্চার সময় ক্লান্ত অবস্থায় গরম এক্সপ্রেসো পান করুন। এতে ক্লান্তি ছাড়াই দীর্ঘক্ষণ শরীরচর্চা করা সম্ভব হয়।,৪. ব্যায়াম করার সময় মনোযোগ ধরে রাখতে খেতে পারেন এক কাপ কফি।এতে আঘাত পাওয়ার ঝুঁকি কমাবে। ,তথ্যসূত্র: রয়টার্স।,"
এমআইএসটিতে চাকরির সুযোগ,"মিলিটারি ইনস্টিটিউট অব সায়েন্স অ্যান্ড টেকনােলজিতে (এমআইএসটি) ছয় পদে ৩৩ জনকে নিয়োগ দেয়া হবে।,পদের নাম: উচ্চমান করণিক
পদসংখ্যা: ৩টি
বেতনস্কেল: ১০,২০০-২৪,৬৮০ টাকা,
পদের নাম: পিএ স্টেনাে
পদসংখ্যা: ৩টি
বেতনস্কেল: ১০,২০০-২৪,৬৮০ টাকা,পদের নাম: এমটি ড্রাইভার (সিভিল)
পদসংখ্যা: ১৩টি
বেতনস্কেল: ৯,৩০০-২২,৪৯০ টাকা,পদের নাম: অফিস সহকারী-কাম-কম্পিউটার মুদ্রাক্ষরিক
পদসংখ্যা: ২টি
বেতনস্কেল: ৯,৩০০-২২,৪৯০ টাকা,পদের নাম: ল্যাবরেটরী সহকারী
পদসংখ্যা: কম্পিউটার সায়েন্স অ্যান্ড ইঞ্জিনিয়ারিং ১টি
ইলেকট্রিক্যাল ইলেকট্রনিক অ্যান্ড কম্যুনিকেশন ইঞ্জিনিয়ারিং ১টি
মেকানিক্যাল ইঞ্জিনিয়ারিং ২টি
অ্যারোনটিক্যাল ইঞ্জিনিয়ারিং ২টি
নেভাল আর্কিটেকচার এন্ড মেরিন ইঞ্জিনিয়ারিং ১টি
বেতনস্কেল: ৯,০০০-২১,৮০০ টাকা,পদের নাম: অফিস সহায়ক
পদসংখ্যা: ৫টি
বেতনস্কেল: ৮,২৫০-২০,০১০ টাকা,আবেদনের ঠিকানা: কমান্ড্যান্ট, এমআইএসটি, মিরপুর সেনানিবাস, ঢাকা-১২১৬।
 ,আবেদনের শেষ তারিখ: ২০ ফেব্রুয়ারি ২০২০।,"
২৫০ কোটি ছাড়াল ফেসবুক ব্যবহারকারী,"ফেসবুক ব্যবহারকারীর সংখ্যা ২৫০ কোটি ছাড়িয়েছে। ২০১৯ সালের শেষ প্রান্তিকে ফেসবুক ব্যবহারকারীর সংখ্যা ২৪৫ থেকে বেড়ে ২৫০ কোটিতে পৌঁছায়। বুধবার এই ঘোষণা দিয়েছে ফেসবুক। খবর আইএনএসের।,২০১৯ সালের ৩১ ডিসেম্বর পর্যন্ত ফেসবুক ব্যবহারকারীর সংখ্যা এবং আয় বেড়েছে। তবে ছয় শতাংশ কমেছে শেয়ারের মূল্য। ,আইএনএস জানায়, যারা রোজ ফেসবুক ব্যবহার করেন তাদের সংখ্যা ১৬২ থেকে বেড়ে ১৬৬ কোটিতে পৌঁছেছে। তবে আগের বছরে এই বৃদ্ধির হার ছিল দুই শতাংশ। ,আর রাজস্ব আগের চেয়ে ২৫ শতাংশ বেড়ে বর্তমানে দুই হাজার ১০৮ কোটি ডলারে পৌঁছেছে। এতে শেয়ার প্রতি গ্রাহকরা আয় করছেন ২ দশমিক ৫৬ ডলার।,কিন্তু নিট আয় মাত্র ৭ শতাংশ বেড়ে ৭৩০ কোটি ডলার হয়েছে যেখানে তার আগের বছর নিট আয় বেড়েছিল ৬১ শতাংশ। 
ফেসবুকের প্রধান নির্বাহী মার্ক জাকারবার্গ সংবাদ সম্মেলনে বলেন, খুব ভালো একটি বছর আমরা পার করেছি। আমাদের ব্যবসা ও কমিউনিটি ক্রমান্বয়ে বাড়ছে।, ,"
মুখের ক্লান্তিভাব দূর হবে এক সেকেন্ডে,"শীতে আবহাওয়া শুষ্ক থাকে। এ কারণে ত্বক কুচকে যায়। চেহারায় দেখা দেয় ক্লান্তিভাব।  এমনিতেই রুক্ষ, শুষ্ক ত্বক আর তার মধ্যে যদি থাকে ক্লান্তভাব তবে তা চিন্তার বিষয় বটে। ,আপনি চাইলে মুখের এই ক্লান্তিভাব দূর করতে পারেন এক সেকেন্ডে। এক সেকেন্ডে মুখের ক্লান্তি দূর করবে ফেসিয়াল মিস্ট। ,একবার স্প্রে করে নিন। মুহূর্তেই ফিরে পাবেন সতেজতা। তবে কৃত্রিম ফেসিয়াল মিস্ট ব্যবহার করতে না চাইলে ঘরে বানিয়ে নিতে পারেন পছন্দের ফেসিয়াল মিস্ট। ঘরে বসে ফেসিয়াল মিস্ট তৈরির উপায় আসুন জেনে নিই-,তিন কাপ পানি ফুটিয়ে আধা কাপ পুদিনাপাতা দিন। তারপর পানি চুলা থেকে নামিয়ে ঠান্ডা করে নিন। এবার একমুঠো গোলাপের পাঁপড়ি যোগ করে আরও ১৫ মিনিট ফুটিয়ে নিন। ,পানি শুকিয়ে অর্ধেক হলে নামিয়ে ঠান্ডা হতে দিন। সবশেষে ছেকে স্প্রে বোতলে ঢেলে আধা চামচ লেবুর রস ও কয়েক ফোঁটা লবঙ্গ তেল মিশিয়ে মুখ বন্ধ করে ঝাঁকিয়ে নিন।,ক্লান্ত লাগলেই একবার স্প্রে করে নিন ফেসিয়াল মিস্ট।,তথ্যসূত্র:  জিনিউজ, ,"
"ডায়াবেটিসে ভুগছেন, খেয়ে দেখুন তালের শাঁস-ওলকচু","মানসিক অবসাদ, অনিয়ন্ত্রিত খাদ্যাভ্যাস ও অনিয়মিত জীবনযাপনসহ নানা কারণে ডায়াবেটিস হতে পারে।,ডায়াবেটিস আক্রান্তদের হৃদরোগ, স্ট্রোক হওয়ার ঝুঁকি বেশি থাকে। এছাড়া কিডনি ক্ষতিগ্রস্ত হওয়া, চোখের রেটিনা ক্ষতিগ্রস্ত হওয়া এবং প্রজনন ক্ষমতা হ্রাস পাওয়া– সর্বোপরি মৃত্যুর ঝুঁকি বেড়ে যাওয়ার আশঙ্কা থাকে এই রোগীর।,ডায়াবেটিস কখনও ভালো হয় না। তবে এই রোগ নিয়ন্ত্রণে রাখলে ভালো থাকা যায়। ,ডায়াবেটিস নিয়ন্ত্রণে কিছু দেশীয় খাবারে আস্থা রাখতে পারেন। খাবার তালিকায় রাখতে পারেন তালের শাঁস-ওলকচু। তাই ডায়াবেটিস নিয়ন্ত্রণে রোগীরা শাঁস- ওলকচু খেতে পারেন। ,তালের রস, কচি তালের শাঁস ও তালের আঁটির ভেতরের সাদা অংশ এবং ওলকচুতে প্রচুর পরিমাণে পুষ্টিগুণ ফাইটোকেমিক্যাল থাকায় উপাদান দু’টি ডায়াবেটিস নিয়ন্ত্রণে কাজ করে।,ভারতের ইসলামী বিশ্ববিদ্যালয়ের একটি গবেষণায় এসব খাবারে ডায়াবেটিস নিয়ন্ত্রণের উপাদান পাওয়া গেছে। 
গবেষণায় দেখা গেছে, কচি তালের শাঁস, পাকা তালের রস এবং তালের আঁটির ভেতরের সাদা শাঁস এশিয়ার অনেক দেশে জনপ্রিয় খাবার। ,ফলটি সুস্বাদু ও পুষ্টিসমৃদ্ধ হলেও অনেক ডায়াবেটিস রোগী পাকা তালের রস অথবা এর শাঁস খাওয়া থেকে বিরত থাকেন।  
তবে কচি তালের শাঁস ও ওলকচুর মধ্যে রয়েছে অনেক পুষ্টিগুণ সমৃদ্ধ ফাইটোকেমিক্যাল। ডায়াবেটিস নিয়ন্ত্রণে  সাহায্য করে। ,স্বাভাবিক খাবারের পাশাপাশি এ দু’টিকে  পরিমিত মাত্রায় প্রয়োগ করলে  নিয়ন্ত্রণে চলে আসবে ডায়াবেটিস।  
তাই খাবার তালিকায় রাখুন ওলকচু ও তাল শাঁস।,তথ্যসূত্র: জিনিউজ, ,"
"কিডনিতে পাথর কেন জমে, কী করবেন?","শরীরের রক্ত পরিশোধনকারী অঙ্গ হচ্ছে কিডনি। আর সেই কিডনিতে সমস্যা দেখা দিলে দেহের বর্জ্য নিষ্কাশন সুচারুরূপে হবে না। সেক্ষেত্রে দেহের অন্যান্য অঙ্গও অকার্যেকর হয়ে পড়বে। তাই শরীর সুস্থ রাখতে হলে কিডনিও ভালো থাকা প্রয়োজন। ,কিডনির মূল সমস্যা হচ্ছে পাথর জমা। কিডনিতে পাথর আক্রান্তের সংখ্যা দিন দিন বেড়েই চলছে।,আসুন জেনে নিই কেন কিডনিতে পাথর হয়? আর কিডনির পাথর দূর করতে কী করবেন সে সম্পর্কে।,১. কাঁচা লবণ খাওয়া স্বাস্থ্যের জন্য খুবই ক্ষতিকর। কারণ লবণে সোডিয়াম খুব সহজে জমা হতে থাকে কিডনিতে। এছাড়া অতিরিক্ত সোডিয়াম সমৃদ্ধ খাবারের কারণেও কিডনিতে পাথর জমার ঝুঁকি বাড়ে।,২. কিডনির কাজ হচ্ছে শরীরের বর্জ্য ছেঁকে শরীরকে টক্সিনমুক্ত করা। আর এই কাজটি কিডনি করে পানির সহায়তায়।তাই প্রচুর পানি পান করতে হবে।চাহিদামত পানি পান না করার কারণে কিডনি সঠিক ভাবে শরীরের বর্জ্য দূর করতে পারে না। ফলে আর ওই বর্জ্য কিডনিতে জমা হতে থাকে পাথর হিসেবে।,কিডনি সুস্থ রাখতে যা করবেন-,১. কিডনিতে পাথর জমার ঝুঁকি এড়াতে চাইলে অবশ্যই পর্যাপ্ত পরিমাণে পানি খেতে হবে। তবে প্রয়োজনের তুলনায় বেশি পানি গ্রহণও কিডনিকে ক্ষতিগ্রস্ত করে বলে জানিয়েছেন বিশেষজ্ঞরা।,২. দীর্ঘক্ষণ প্রসাব চেপে রাখা একেবারেই অনুচিত। বেগ এলেই প্রকৃতির ডাকে সাড়া দেয়াটাই উত্তম।,৩. তবে বারবার প্রসাবের জন্য শৌচাগারে যাওয়াও একটি বড় সমস্যা। এমন অভ্যাস হলে দ্রুত চিকিৎসকের পরামর্শ নেয়া উচিত এবং কিডনিতে সংক্রমণ ঘটেছে কিনা তা পরীক্ষা করা উচিত।,৪. খেতে হবে প্রচুর পরিমাণে ভিটামিন 'সি' যুক্ত খাবার। আমলকী, লেবুর জুস প্রতিদিনই খাদ্য তালিকায় রাখলে কিডনি সমস্যা এড়ানো যাবে।,৫. অতিরিক্ত মাত্রায় দুগ্ধজাত খাবার খাওয়া যাবে না।,৬. চিকৎসকের পরামর্শ ছাড়া কোনো ওষুধ খাবেন না। বিশেষ করে ব্যথানাশক ওষুধ বা কোনো অ্যান্টিবায়োটিক খাবেন না।,৭. আপনার বয়স ৪০ বছরের বেশি হয়ে গেলে নিয়মিত বছরে অন্তত একবার ডায়বেটিস ও ব্লাড প্রেসার পরীক্ষা করান। ,৮. বছরে অন্তত একবার প্রস্রাবের মাইক্রো-এলবুমিন পরীক্ষা করান।,তথ্যসূত্র: জিনিউজ।, ,"
