Blog Titles,Blog Content
"মানবদেহ যেভাবে লড়ছে করোনার বিরুদ্ধে, জানালেন অস্ট্রেলীয় বিজ্ঞানীরা","নতুন করোনাভাইরাস কোভিড ১৯-এর সঙ্গে লড়ছে পুরো বিশ্ব। আর ভয়াবহ এই রোগে মানুষের শরীরের রোগ প্রতিরোধব্যবস্থার লড়াইয়ের কৌশল আবিষ্কারের দাবি করেছেন অস্ট্রেলীয় বিজ্ঞানীরা। ,মঙ্গলবার এ বিষয়ে একটি প্রতিবেদন প্রকাশিত হয়েছে গবেষণা পত্রিকা নেচার মেডিসিনে।,বিবিসি অনলাইনের প্রতিবেদনে বলা হয়, নেচার মেডিসিনে প্রকাশিত প্রবন্ধে বলা হয়েছে, সাধারণ ফ্লু আক্রান্ত হলে মানুষে যেভাবে সুস্থ হয়ে উঠে একই প্রক্রিয়ায় করোনাভাইরাস থেকেও সেরে উঠছে।,আর এই ভাইরাসে শরীরের রোগ প্রতিরোধব্যবস্থার কোনো কোষগুলো সক্রিয় ভূমিকা নেয়, তা খুঁজে পেলে এর প্রতিষেধক তৈরি সহজ হবে। অস্ট্রেলীয় বিজ্ঞানীদের নতুন এ ফল আশ্বস্ত করেছে গবেষণারত অন্য বিজ্ঞানীদের। মেলবোর্নের পিটার ডোহার্টি ইনস্টিটিউট ফর ইনফেকশন অ্যান্ড ইমিউনিটি পরিচালিত এ,গবেষণাকে অনেকেই ‘ব্রেক–থ্রু’ হিসেবে বর্ণনা করছেন। এই গবেষণা আরও এগিয়ে নিতে প্রতিষ্ঠানটিকে নতুন করে আর্থিক তহবিল দিয়েছেন অস্ট্রেলীয় সরকার ও চীনের ধনকুবের জ্যাক মা।,গবেষক দলটির অন্যতম সদস্য অধ্যাপক ক্যাথেরিন কেডজিয়েরস্কা বলেন, আবিষ্কারটি খুবই গুরুত্বপূর্ণ। এ গবেষণার মাধ্যমে আমরা বুঝতে শুরু করেছি শরীর করোনাভাইরাসের সঙ্গে কীভাবে লড়াই করে।,বৈশ্বিকভাবে ছড়িয়ে পড়া এই ভাইরাসে এখন পর্যন্ত বিশ্বের ১৬৫ দেশের ১ লাখ ৭০ হাজারের বেশি মানুষ আক্রান্ত হয়েছে। মারা গেছে সাত হাজারের বেশি মানুষ। আক্রান্ত মানুষের একটি বড় অংশই সেরে উঠছে। ,প্রথমবারের মতো বিজ্ঞানীরা শরীরের চারটি প্রহরী কোষকে শনাক্ত করেছেন, যা নতুন করোনাভাইরাসের সঙ্গে লড়াই করে। এই কোষগুলোকে শনাক্তের জন্য বিজ্ঞানীরা মাঝারি মাত্রায় আক্রান্ত এক ব্যক্তিকে পর্যবেক্ষণ করেন।,যার আগে অন্য কোনো রোগে আক্রান্ত হওয়ার ইতিহাস নেই। অস্ট্রেলিয়ার এক হাসপাতালে চিকিৎসা নেয়া চীনের উহানের ৪৭ বছর বয়সী ওই আক্রান্ত নারী ১৪ দিনের মধ্যেই সুস্থ হয়ে ওঠেন।
গবেষকরা জানান, চিকিৎসাকালে সংশ্লিষ্ট বিজ্ঞানীদের পুরো দল ওই রোগীর শরীরের রোগ প্রতিরোধব্যবস্থা কীভাবে সাড়া দিচ্ছে, তা পর্যবেক্ষণ করেন। ,ওই নারীর শরীরের উন্নতি হতে শুরু করার তিন দিন আগে থেকে তার রক্তে বিশেষ কিছু কোষের উপস্থিতি দেখা যায়। ইনফ্লুয়েঞ্জায় আক্রান্ত রোগীর ক্ষেত্রেও সেরে ওঠার আগে আগে একই ধরনের কোষের আবির্ভাব দেখা যায়।,অধ্যাপক ক্যাথেরিন কেডজিয়েরস্কা বিবিসি অনলাইনকে বলেন,  ‘পর্যবেক্ষণের এই ফল আমাদের ভীষণভাবে আবেগাপ্লুত করে। চার সপ্তাহ ধরে আমরা একটানা কাজ করেছি।’,সোয়াইনবার্ন ইউনিভার্সিটি অব টেকনোলজির স্বাস্থ্য বিজ্ঞানের ডিন ব্রুস থমসন বলেন, ‘ভাইরাসটি মোকাবেলায় শরীরের প্রহরী কোষের সক্রিয় হওয়ার ক্ষণ নির্ধারণের মধ্য দিয়ে এর গতিপ্রকৃতি সম্পর্কে অনুমান করা সম্ভব। শরীর কখন সাড়া দিচ্ছে, জানলে ভাইরাসটি থেকে মুক্তি কতদূরে তা জানা যাবে। ,এই অগ্রগতির বিষয়ে অস্ট্রেলিয়ার স্বাস্থ্যমন্ত্রী গ্রেগ হান্ট জানান, এই আবিষ্কার ভাইরাসটির প্রতিষেধক খুঁজে পেতে সহায়তা করবে। ,"
সোশ্যাল আইসোলেশনে যা করবেন,"সারাবিশ্বে এখন করোনা আতঙ্ক ছড়িয়ে পড়েছে। তাই কারও করোনা সন্দেহ হলেই তাকে রাখা হচ্ছে হোম কোয়ারেন্টাইনে। ,তবে চিকিৎসকদের মতে, আতঙ্কের কোনো কারণ নেই। কয়েকটা দিন ঘরে বিশ্রামে থাকলে এই রোগকে নিয়ন্ত্রণ করা সম্ভব। রোগ হলে আক্রান্তকে ‘সোশ্যাল আইসোলেশন’-এ থাকার পরামর্শ দিচ্ছেন চিকিৎসকরা।,সোশ্যাল আইসোলেশনের ওপরে নির্ভর করেই সংক্রমণ ঠেকিয়ে রাখার কথা ভাবছেন চিকিৎসকরা। ,এ ধরনের সোশ্যাল আইসোলেশনের মানে কী? আর কেনইবা তা করা হয়?,সংক্রামক অসুখ বিশেষজ্ঞ সুমিত সেনগুপ্তের মতে, সোশ্যাল আইসোলেশন হচ্ছে– বাড়িতে থেকেই সমাজের সব রকম জমায়েত থেকে দূরে থাকা। 
তিনি বলেন, প্রয়োজনেই মানুষকে অন্য মানুষের সংস্পর্শে আসতে হয়। অফিস, ক্লাব, পাড়ার আড্ডা, স্কুল-কলেজ, জিম, নানা রকম পার্টি, অনুষ্ঠান, বাজার, পারিবারিক জমায়েত,,যাতায়াত সব মিলিয়েই বাইরের মানুষজনের সংস্পর্শে আসতে হয় তাকে। কেউ অসুস্থ মনে হলে তাকে ১৪ থেকে ১৫ দিন এসব না করে ঘরে বসে থাকলে অসুখ ভালো হয়। আর রোগ ঠেকিয়ে রেখে সংক্রমণ প্রতিরোধ করার এটিই উপায়।,বিশেষজ্ঞদের মতে, সোশ্যাল আইসোলেশন মানে একঘরে হয়ে থাকা নয়। বরং কিছু দিন কয়েকটা নিয়ম মেনে চলা।,কী করবেন?,১. এ সময় রান্নার কাজ নিজেই করুন। সম্ভব না হলে খাবার ডেলিভারি করে এমন কোনো সংস্থাকে অর্ডার করে দিন। ফোনে বলে রাখুন দরজার কাছে খাবার নামিয়ে রেখে যেতে। টাকা-পয়সা দিন অনলাইনে। ,২. ঘরে কেউ থাকলে সারাক্ষণ সার্জিক্যাল মাস্ক পরে থাকুন। রোগীর জন্য রান্নাবান্না করা বা খেতে দিতে বাধা নেই। ,৩. রোগীকে দেখভালের সময় পরে থাকুন এন ৯৫ মাস্ক। মাস্ক পরা থাকলে ও ঘন ঘন হাত ধুলে কোনো ভয় নেই।,৪. বিশেষ প্রয়োজনে রোগীকে চিকিৎসকের কাছে নিতে হলে মাস্ক  পরতে হবে। ঘরে ফিরে সাবান বা ইথাইল অ্যালকোহল মেশানো হ্যান্ডওয়াশে এবং পানি দিয়ে গোসল ও কাপড় কাচতে হবে। ,৫. যোগাসন ও শরীরচর্চা শরীরের রোগ প্রতিরোধ ক্ষমতা বাড়াবে। তাই জিমে না গিয়ে বাড়িতেই তা করতে পারেন। ,৬. ফোনে কথা বলা বা ভিডিও দেখায় কোনো বাধা নেই। শুধু আপনার ব্যবহারের ফোনটিকে আলাদা করে রাখুন।,৭. গামছা তোয়ালেসহ গোসলের উপকরণ প্রতিদিন গরম পানিতে ফুটিয়ে নিন। চিকিৎসকের পরামর্শমতো রোগ প্রতিরোধ ক্ষমতা বাড়ানোর ওষুধ ও খাবার খান।,৮. রোগীর ব্যবহারের ঘর ও জিনিস আলাদা করে রাখতে পারলে ভালো। দরকার না পড়লে সেই ঘরে অন্য কারও প্রবেশ না করা ভালো।  ,৯. দেখভাল করতে তার ঘরে ঢুকলে বেরিয়েই ভালো করে হাত-পা ধুয়ে নিন। পরে থাকুন মাস্ক।,তথ্যসূত্র: আনন্দবাজার পত্রিকা,"
করোনা: ইচ্ছেমতো প্যারাসিটামল খেলে ভয়াবহ ক্ষতি,"চীনের হুবেইপ্রদেশের উহান শহর থেকে সারাবিশ্বে ছড়িয়ে পড়েছে করোনাভাইরাস। বাংলাদেশেও বাড়ছে করোনাভাইরাসে আক্রান্তের সংখ্যা।,করোনাভাইরাস সাধারণ ফ্লুয়ের মতো। এই ভাইরাসের কোনো ওষুধ বা টিকা এখনও আবিষ্কৃত হয়নি। তাই প্রতিরোধই হচ্ছে এই ভাইরাস থেকে বাঁচার অন্যতম উপায়-,করোনাভাইরাসের মোকাবেলায় আমাদের শরীরের রোগ প্রতিরোধ শক্তি আরও বাড়ানোর পরামর্শ দিয়েছেন চিকিৎসকরা।  ,সর্দি-কাশি-জ্বর হলে সাধারণত আমরা প্যারাসিটামলজাতীয় ওষুধ খাই। তবে চিকিৎসককে না জানিয়ে যে কোনো ওষুধ খাওয়া শরীরের জন্য ভয়াবহ ক্ষতি ডেকে আনতে পারে। ,বৈশ্বিকভাবে ছড়িয়ে পড়া এই ভাইরাসে এখন পর্যন্ত বিশ্বের ১৫২টি দেশের ১ লাখ ৭০ হাজারের বেশি মানুষ আক্রান্ত হয়েছে। মারা গেছে সাত হাজারের বেশি মানুষ। আক্রান্ত মানুষের একটি বড় অংশই সেরে উঠছে।,"
করোনা: যেভাবে মোবাইল ব্যবহার করলে নিরাপদ থাকবেন,"সারাবিশ্বে এখন করোনা আতঙ্ক চলছে। করোনায় প্রতিনিয়ত মৃতের সংখ্যা বাড়ছে।   করোনা ঠেকাতে জনবহুল এলাকা এড়িয়ে যাওয়ার পরামর্শ দিয়েছে বিশ্ব স্বাস্থ্য সংস্থা ‘হু’।,সম্প্রতি ‘হু’-এর সঙ্গে যুক্ত চিকিৎসকরা নিজের ব্যবহার করা মোবাইলের দিকে খেয়াল রাখতে বলেছেন। ,তবে মোবাইল থেকে করোনা ছড়ায় না। তবে করোনা ঠেকাতে মোবাইল পরিষ্কারের প্রয়োজন রয়েছে বলেই দাবি হুর সঙ্গে যুক্ত চিকিৎসকদের।,বিশেষজ্ঞদের মতে, প্রায় সারাক্ষণই হাতে ধরা থাকে মোবাইল। আর মোবাইলের কাভারে অনেক সময় জমে থাকে। তবে আমরা অনেকেই তা খেয়াল করি না। ফলে সেসব আণুবীক্ষণিক জীবাণু হাতের তালুতে লেগে যায়। ,তারা জানান, ঘন ঘন হাত ধোওয়ার কথা বললেও মোবাইল ছোঁয়ার পর পরই হাত পরিষ্কার করা বাস্তবিক পক্ষে সম্ভব নয়। তাই মোবাইল হাতে লাগলে তা থেকে ত্বকে কিছুটা জীবাণু যায়ই।তাই করোনা যেহেতু হাঁচি-কাশির ড্রপলেটের মাধ্যমে ছড়ায় তাই সর্তক হতে হবে। ,অনেক সময় বাইরে বের হলে অন্যের হাঁচি-কাশির ড্রপলেট মোবাইলের গায়েও পড়ে। তাই এই করোনা-ত্রাসের সময়ে অবশ্যই এই ছোটখাটো বিষয়গুলোর প্রতি যত্নবান হতে হবে।,আসুন জেনে নেই যেসব বিষয়ে সর্তক থাকবেন-,১. মোবাইল পরিষ্কার করতে ব্যবহার করুন ইথাইল অ্যালকোহল মেশানো হ্যান্ডওয়াশ বা ব্যাকটিরিয়ারোধী লোশন।,২.বিশেষজ্ঞ সুবর্ণ গোস্বামী বলেন, সব রকম জড়বস্তুর গায়ে ড্রপলেট লেগে থাকতে পারে। আর তা থেকে হাতে হাতে করোনা ছড়াতে পারে।,৩. ছিদ্রযুক্ত জড়বস্তু তোয়ালে, গামছা ইত্যাদির মাধ্যমে ছাড়াতে পারে। এছাড়া চেয়ার-টেবিলের মতো নিরেট জড়বস্তু থেকেও ছাড়াতে পারে। ,৪. প্রয়োজন না পড়লে ব্যাগ থেকে মোবাইল বের করবেন না। কথা বলতে ও টেক্সট করতে মোবাইল ব্যবহার করে আবার ঢুকিয়ে রাখুন ব্যাগে।,৫.মোবাইল রোজই পরিষ্কার করুন। অ্যালকোহল মেশানো হ্যান্ডওয়াশ বা বাজারচলতি ব্যাকটিরিয়ারোধী লোশন ব্যবহার করতে পারেন। অ্যালকোহল মেশানো পানিতে নরম কোনও কাপড় ভিজিয়ে তা দিয়ে মোবাইল পরিষ্কার করুন। ,৬. মোবাইলের কোণাগুলো সাফ করতে সরু সরু কটন বাডস ব্যবহার করুন।,৭. মোবাইলের কেস বা কভারকে আলাদা করে সাবান পানি দিয়ে ধুয়ে নিন।,তথ্যসূত্র: আনন্দবাজার পত্রিকা  ,"
"বিছানায় শুয়ে বই পড়ছেন, হতে পারে ৪ বিপদ!","রাতে বা দিনে বিছানায় শুয়ে বই পড়েন অনেকে। তবে বিছানায় শুয়ে বই পড়া কিন্তু ক্ষতিকর। এ ধরনের অভ্যাস থাকলে আজই পরিবর্তন করতে হবে।  রাতে বিছানায় শুয়ে বই পড়তে পড়তে ঘুমিয়ে পড়েন অনেকে। আবার সকালে ঘুম থেকে উঠে সোফায় গা এলিয়ে দিয়ে খবরের কাগজ পড়েন।   ,বহু বইপ্রেমীর অভ্যাস ট্রেনে-বাসে শুয়ে-বসে বই পড়া। আর এই শুয়ে বসে বই পড়ার সময় বইয়ের থেকে চোখের দূরত্ব সবসময় সমান থাকে না। আবার সঠিক অ্যাঙ্গেল বজায় রেখেও বই পড়ার হয় এমন নয়।  তবে যা কিছুই হোক না কেন, বই পড়ার অভ্যাস বাদ দেয়া যাবে না। ,বিশেষজ্ঞরা বলছেন, নিয়ম না মেনে বই পড়লে হতে পারে চোখের সমস্যা।  ,আসুন জেনে নিই নিয়ম মেনে বই না পড়লে চোখের যেসব ক্ষতি হতে পারে-,১. বই সঠিক দূরত্বে রেখে না পড়লে চোখের ওপর অতিরিক্ত চাপ পড়ে। দৃষ্টিশক্তি ঝাপসা হয়ে আসার সম্ভাবনা থাকে।,২. চোখের অংশে কমে যেতে পারে রক্ত চলাচল ,৩. অ্যাস্থেনোপিয়ার শিকার হতে পারেন। ,৪. চোখের অশ্রুগ্রন্থির পানি শুকিয়ে যেতে পারে, যা চোখের পেশির কাজে বাধা তৈরি হয়। ফলে প্রভাব ফেলে মাথার পেশিতেও। কমে যেতে পারে ঘুমের পরিমাণ। ,৫. অ্যাংজাইটি, অস্থিরতা বাড়তে থাকে দিনের পর দিন।
চোখের জন্যই আমাদের চারপাশের পৃথিবী আরও সুন্দর। সব অঙ্গের মধ্যে সবচেয়ে গুরুত্বপূর্ণ হচ্ছে চোখ। তাই শুয়ে পড়ার অভ্যাস ছাড়ুন।,তথ্যসূত্র: জিনিউজ,"
সরকারি কর্ম কমিশনের সব পরীক্ষা ৩১ মার্চ পর্যন্ত স্থগিত,"বাংলাদেশ সরকারি কর্ম কমিশনের (পিএসসি) সব পরীক্ষা ১৮ মার্চ থেকে ৩১ মার্চ পর্যন্ত অনিবার্য কারণে স্থগিত করা হয়েছে।,পিএসসির জনসংযোগ কর্মকর্তা ইশরাত শারমীন সাক্ষরিত এক বিজ্ঞপ্তিতে এ তথ্য জানানো হয়। স্থগিতকৃত সকল পরীক্ষার তারিখ ও বিস্তারিত তথ্য পরবর্তীতে জানানো হবে।,তবে ইতোমধ্যে গৃহীত পরীক্ষাসমূহের ফলাফল প্রকাশ অব্যাহত থাকবে বলেও বিজ্ঞপ্তিতে উল্লেখ করা হয়েছে।,"
