Blog Titles,Blog Content
বিকালের নাশতায় চমক,"সানফ্লাওয়ার পিজ্জা,যা লাগবে : ডো এর জন্য : ময়দা ৩.৫ কাপ, ডিম একটা, দুধ কম/বেশি ১/৫ কাপ, চিনি দুই টেবিল চামচ, তেল দুই টেবিল চামচম, ইস্ট্যান্ট ইস্ট এক চা চামচ, লবণ দুই চা চামচ।
ফিলিংয়ের জন্য : চিকেন ব্রেট ছোট কিউব এক কাপ, গাজর মিহি কুচি এক/চার কাপ, আদা রসুন বাটা দুই চা চামচ, সয়াসস এক টেবিল চামচ, গুঁড়া মরিচ এক/দুই চা চামচ, গুঁড়া গোলমরিচ দুই টেবিল চামচ, ময়দা এক টেবিল চামচ, পেঁয়াজ মোটা কুচি আধা কাপ, অরিগেনো এক চা চামচ।,অন্যান্য : সাদা তিল এক চা চামচ, বাটার দুই চা চামচ, দুধ দুই টেবিল চামচ, মোজারেলা চিজগ্রেট করা এক কাপ, স্লাইসড ব্লাক অলিভ দুই টেবিল চামচ, পিজ্জা সস এক/তিন কাপ।,,যেভাবে করবেন : ময়দা ঢেলে নিন। ময়দা লবণ, চিনি, ইস্ট একত্রে নেড়ে ফেটানো ডিম দিয়ে মাখুন। কুসুম গরম দুধ অল্প অল্প করে অ্যাড করুন। ১৫-২০ মিনিট ভালো করে মথে নরম ডো তৈরি করুন। একটি পাত্রে তেল ব্রাশ করে ডো হালকা গরম জায়গায় এক-দুই ঘণ্টা রেখে দিন। চিকেন কিউবে আদা-রসুন বাটা, মরিচ গুঁড়া, লবণ ও সয়াসস মাখিয়ে রেখে দিন ১৫ মিনিট। প্যানে অলিভ অয়েল দিয়ে চিকেন ঢেলে সিদ্ধ হওয়া পর্যন্ত রান্না করুন। পেঁয়াজ কুচি, ময়দা এবং গোল মরিচের গুঁড়া ছড়িয়ে নেড়ে নেড়ে তিন-চার মিনিট রান্না করুন।,অরিগেনো ছড়িয়ে নামিয়ে নিন। দুই ভাগে ভাগ করে ১২ ইঞ্চি সাইজের দুটি রুটি বানান। পিজ্জা প্যানে মাঝখানে পিজ্জাসস মাখিয়ে রান্না করা চিকেন গোল এবং উঁচু করে দিন। অবশিষ্ট চিকেন দুই ইঞ্চি দূরত্ব রেখে পিজ্জাসস লাগিয়ে তার ওপরে বৃত্তাকারে বিছিয়ে দিন। চিকেনের ওপর ব্ল্যাক অলিভ এবং মোজারেলা ছড়িয়ে অন্য রুটিটি দিয়ে ঢেকে সাইড আটকে দিন। মাঝের গোল বরাবর স্যুপের বাটি বসিয়ে দিন। বাইরের অংশ ৪২ ভাগে কেটে ছবির মতো করে এক একটা ভাগ ঘুরিয়ে সেট করুন। বাটি উঠিয়ে আধা ঘণ্টা হালকা গরম জায়গায় ঢেকে রাখুন। ওপরে দুধ ব্রাশ করে তিল ছিটিয়ে দিন। ২২০ ডিগ্রিতে প্রিহিটেড ওভেনে মাঝের র‌্যাকে ১০-১৬ মিনিট বেক করুন। কালার এলে বের করে বাটার ব্রাশ করে নিন।,অরেঞ্জ মিল্ক জেলো পুডিং,,যা লাগবে : ইন্সট্যান্ট অরেঞ্জ জেলো এক প্যাকেট, দুধ এক লিটার, কনডেন্স মিল্ক এক টিন, আগার আগার/জেলাটিন পাইডার তিন চা চামচ, পানি আধা কাপ, ভ্যানিলা এসেন্স আধা চা চামচ, সবুজ এবং হলুদ ফুড কালার সামান্য পরিমাণ, চকলেট বিস্কিট একটি। ,যেভাবে করবেন : প্যাকেটের নির্দেশনা অনুযায়ী জেলো বানিয়ে সান ফ্লাওয়ার মোল্ডে ঢেলে দিন। ,আগার আগার পাউডার পানিতে গুলে নিন। দুধ চুলায় বসিয়ে ফুটান। কনডেন্স মিল্ক গোলানো আগার আগার পাউডার, ভ্যানিলা এসেন্স দিয়ে নেড়েচেড়ে নামান, এটাকে তিনটি বাটিতে ভাগ করুন। একটায় সবুজ, অন্যটায় হলুদ ফুড কালার মেশান। অবশিষ্টটা সাদা রাখুন। জেলো জমে গেলে কুসুম গরম টেম্পারেচারে আনা সাদা দুধের মিশ্রণ জেলোর ওপরে ঢেলে দিন। ঠাণ্ডা হয়ে জমে গেলে কুসুম গরম সবুজ দুধ একইভাবে ঢেলে জমিয়ে নিন। শেষে হলুদ দুধ দিয়ে ঠাণ্ডা করে ফ্রিজে রাখুন। তিন-চার ঘণ্টা পর মাঝখানে চকলেট বিস্কিট দিয়ে পরিবেশন করুন।,ফ্রেন্স ফ্রাই,,যা লাগবে : ফিঙ্গার শেপে কেটে নেয়া আলু এক/দুই কেজি, লবণ স্বাদমতো, মরিচ গুঁড়া এক/দুই চা চামচ, গোলমরিচ গুঁড়া এক/দুই চা চামচ, কর্নফ্লাওয়ার এক/দুই টেবিল চামচ, ভাজার জন্য তেল দুই কাপ।,যেভাবে করবেন : পর্যাপ্ত পানিতে লবণ দিয়ে ফুটিয়ে নিন। আলুর টুকরাগুলো দিয়ে পাঁচ মিনিট ভাপে রেখে উঠিয়ে ঠাণ্ডা পানিতে চুবিয়ে নিয়ে আলুর গায়ের পানি ঝরিয়ে বা মুছে শুকনা করে নিন। কর্নফ্লাওয়ার, মরিচ গুঁড়া ও গোলমরিচ গুঁড়া মাখিয়ে দশ মিনিট রাখুন। ডুবো তেলে মচমচে সোনালি করে ভেজে উঠান। যে কোনো সসের সঙ্গে পরিবেশন করুন।,স্পাইসি প্রন পাস্তা,,যা লাগবে : দুই-তিন রকম পাস্তা দুই কাপ, পেঁয়াজ কিউব আধা কাপ, রসুন কুচি দুই টেবিল চামচ, আদা কুচি এক/দুই টেবিল চামচ, শুকনামরিচ চেরা আটটটি, লবণ স্বাদমতো, অলিভ অয়েল এক/তিন কাপ, টমেটোসস আধা কাপ, সয়াসস দুই টেবিল চামচ, পছন্দমতো আধা সিদ্ধ সবজি এক কাপ, ক্যাপসিকাম স্লাইস একটা, বাগদা চিংড়ি ২৫০ গ্রাম, টেস্টিং সল্ট এক চা চামচ, গোলমরিচ গুঁড়া আধা চা চামচম।,যেভাবে করবেন : পর্যাপ্ত পানিতে এক টেবিল চামচ তেল দিয়ে ফুটিয়ে পাস্তা দিয়ে সিদ্ধ করুন। সিদ্ধ হলে পাস্তা ঠাণ্ডা পানিতে ধুয়ে পানি ঝরিয়ে নিন। প্যানে অলিভ অয়েল গরম করে আদা-রসুন কুচি ও শুকনা মরিচ দিয়ে এক মিনিট ভেজে চিংড়ি দিয়ে দুই-তিন মিনিট ভাজুন। পেঁয়াজ কুচি ও সিদ্ধ সবজি দিয়ে হাই হিটে তিন-চার মিনিট ভাজুন। সিদ্ধ পাস্তা দিন। নেড়ে মিশান। সয়াসস্, ক্যাপসিকাম ও লবণ দিয়ে আরও চার মিনিট কুক করুন। টমেটোসস্, টেস্টিং সল্ট ও গোলমরিচ গুঁড়া দিয়ে নেড়েচেড়ে নামান। গরম গরম পরিবেশন করুন।,দহি বড়া,,যা লাগবে : বড়ার জন্য মাষকলাইয়ের ডাল এক কাপ, লবণ সামান্য, পানি এক টেবিল চামচ, তেল ১.৫ কাপ।,দই মিক্সাচারের জন্য : টকদই আধা কেজি, লাল মরিচের গুঁড়া আধা চা চামচ, জিরা গুঁড়া আধা চা চামচ, চাটমশলা আধা চা চামচ, বিট লবণ আধা চা চামচ, লেবুর রস আধা টেবিল চামচ, টমেটোসস এক টেবিল চামচ, তেঁতুলের মাড় এক টেবিল চামচ, চিনি তিন টেবিল চামচ, কাঁচামরিচ ছয়টি, ধনিয়াপাতা দুই টেবিল চামচ, পুদিনা পাদা দশটি, একত্রে ব্লেন্ড করা।,যেভাবে করবেন : মাষকলাইয়ের ডাল ভালো করে ধুয়ে সারা রাত ডুবো পানিতে ভিজিয়ে রাখুন। পানি ছেঁকে সামান্য লবণ ও প্রয়োজনমতো পানি দিয়ে ব্লেন্ড করে নিন। ভালো করে ফেটুন। তেল গরম দিন। অল্প আঁচে বড়া ছাড়–ন। লালচে করে ভেজে উঠান। বেশ খানিকটা পানিতে দুই টেবিল চামচ লবণ গুলে বড়াগুলো দিয়ে পাঁচ মিনিট ভিজাতে দিন। চিপে পানি ফেলে সার্ভিং ডিশে সাজিয়ে রাখুন। ,দইয়ের সঙ্গে সব উপকরণ একসঙ্গে মিশিয়ে ফেটুন, রেডি করে রাখা বড়ার ওপর ঢেলে দিন। ঘণ্টাখানিক সময় দিন সেটা হতে। এর পর পরিবেশন করুন।,রেসিপি দিয়েছেন জিনাত সুলতানা, আলোকচিত্রী মনির আহমেদ,"
শিশুদের ওপর টিকা পরীক্ষার অনুমতি পেল ফাইজার,"শিশুদের ওপর করোনাভাইরাসের টিকা পরীক্ষার অনুমতি পেল মার্কিন ফার্মাসিউটিক্যাল কোম্পানি ফাইজার। পরীক্ষামূলক এ টিকা ১২ বছরের ঊর্ধ্ব বয়সীদের ক্ষেত্রে প্রয়োগ করে এর কার্যকারিতা দেখা হবে। ,যুক্তরাষ্ট্রের বাবা-মায়ের মধ্যে এ টিকা পরীক্ষা নিয়ে আগ্রহ দেখা গেছে বলে বার্তা সংস্থা সিএনএনকে জানিয়েছেন প্রতিষ্ঠানটির শীর্ষ গবেষক।,যুক্তরাষ্ট্রে করোনা টিকা পরীক্ষার ক্ষেত্রে শিশুদের অন্তর্ভুক্ত করার  ঘটনা এটিই প্রথম। ,
সিনসিনাটি চিলড্রেনস হাসপাতালের একটি গবেষক দল ১৬ থেকে ১৭ বছর বয়সী কিশোরদের প্রথম টিকা দেবে। পরে ১২ থেকে ১৫ বছর বয়সী শিশুদের এতে অন্তর্ভুক্ত করা হবে। এ তথ্য জানান হাসপাতালের টিকা গবেষণা কেন্দ্রের পরিচালক রবার্ট ফ্রেঙ্ক। ,ফাইজারের ওয়েবসাইটে তাদের টিকাটি যুক্তরাষ্ট্রের ফুড অ্যান্ড ড্রাগ অ্যাডমিনিস্ট্রেশনের কাছ থেকে ১২ বছরের কিশোরদের মধ্যে পরীক্ষার অনুমোদন পেয়েছে।,যুক্তরাষ্ট্রে যে চারটি কোম্পানি তৃতীয় ধাপের টিকা পরীক্ষায় রয়েছে, তার মধ্যে অন্যতম ফাইজার। তারা ৩৮ হাজার মানুষের ওপর টিকা পরীক্ষা চালাচ্ছে। এর মধ্যে ৩১ হাজার জন টিকার দ্বিতীয় ডোজ নিয়েছেন।,ফাইজার জার্মানির প্রতিষ্ঠান বায়োঅ্যানটেকের সঙ্গে মিলে দুই ডোজের টিকা তৈরি করেছে। ফাইজারের পক্ষ থেকে বলা হয়েছে,  নিয়ন্ত্রকদের অনুমোদন পেলে এ বছরের শেষ নাগাদ ১০ কোটি ডোজ টিকা উৎপাদন করতে পারবে। ২০২১ সালের মধ্যে ১৩০ কোটি ডোজ টিকা তৈরির লক্ষ্যে কাজ করছে তারা।,"
বিশ্ব হাত ধোয়া দিবস ১৫ অক্টোবর,"বিশ্ব হাত ধোয়া দিবস আগামীকাল ১৫ অক্টোবর। দিবসটি বিশ্বব্যাপী জনসচেতনতা তৈরি ও উদ্বুদ্ধকরণের জন্য চালানো একটি প্রচারণামূলক দিবস। ,প্রতি বছর ১৫ অক্টোবর বিশ্বব্যাপী দিবসটি পালন করা হয়ে থাকে।  সাধারণ মানুষকে সাবান দিয়ে হাত ধোয়ার মাধ্যমে রোগের বিস্তার রোধ করার বিষয়ে সচেতনতা তৈরি করার উদ্দেশ্যে এ দিবসটি পালিত হয়ে থাকে।,সাবান দিয়ে হাত ধোয়ার বৈশ্বিক এবং স্থানীয় দৃষ্টিভঙ্গি প্রচার করার জন্য বিশ্ব হাত ধোয়া অংশীদার (GHP) (পূর্বে নাম ছিল ""হাত ধোয়ার জন্য সরকারি-বেসরকারি অংশীদারিত্ব"") ২০০৮ সালে বিশ্ব হাত ধোয়া দিবস চালু করে।,
বিশ্ব হাত ধোয়া দিবসের মূল লক্ষ্য হলো– সকল সমাজের সাবান দিয়ে হাত ধোয়ার একটি সাধারণ সংস্কৃতির সমর্থন ও প্রচলন করা।  এ ছাড়া সাবান দিয়ে হাত ধোয়ার উপকারিতা সম্পর্কে সচেতনতা বৃদ্ধি করা।,বিশ্ব পানি সপ্তাহে সুইডেনের স্টোকহোমে ২০০৮ সালের ১৫ অক্টোবর বিশ্ব হাত ধোয়া অংশীদার (GHP) বিশ্বব্যাপী আঞ্চলিক ও স্থানীয় পর্যায়ে সাবান দিয়ে হাত ধোয়া সম্পর্কে সচেতনতা সৃষ্টির উদ্দেশ্যে সর্বপ্রথম এ দিবসটি উদযাপন করে। পরে জাতিসংঘের সাধারণ অধিবেশনে তারিখটি প্রতি বছর পালন করার সিদ্ধান্ত নেয়া হয়। ,২০০৮ সালটি স্বাস্থ্যব্যবস্থার আন্তর্জাতিক বর্ষও ছিল। ২০০৮ সালে দিবসটি পালনে প্রতিষ্ঠাতা সংস্থাগুলোর মধ্যে ছিল: (আমেরিকাভিত্তিক একটি অলাভজনক মানব উন্নয়ন সংস্থা), রোগ নিয়ন্ত্রণ ও প্রতিরোধ কেন্দ্র, প্র্যাক্টার অ্যান্ড গ্যাম্বল, ইউনিসেফ, ইউনিলিভার, বিশ্বব্যাংকের পানি ও স্বাস্থ্যব্যবস্থা প্রোগ্রাম এবং আন্তর্জাতিক উন্নয়ন জন্যের মার্কিন যুক্তরাষ্ট্রের সংস্থা।,"
যেভাবে সংরক্ষণ করলে পেঁয়াজ ও আলু ভালো থাকবে,"পেঁয়াজ ও আলু কখনও একসঙ্গে রাখবেন না। পেঁয়াজ ইথিলিন গ্যাস তৈরি করে বাতাসে ছড়িয়ে দেয়। এই গ্যাস যে কোনো সবজি বা ফলকে দ্রুত পাকিয়ে দেয়। তাই পেঁয়াজের সঙ্গে আলু রাখলে তা দ্রুত পচে নষ্ট হয়ে যায়। ,এই গ্যাসের কারণে আলুতে দ্রুত অঙ্কুরোদগম হতে পারে। তবে অঙ্কুরোদগম হলে আলু খাওয়া যাবে না এমন নয়। অঙ্কুর কেটে ফেলে দিয়ে আলু খাওয়া যায়। 
আসুন জেনে নিই আলু ও পেঁয়াজ যেভাবে সংরক্ষণ করবেন-,১. আলু ও পেঁয়াজ আলাদা রাখুন। পেঁয়াজ ও আলু কখনও একসঙ্গে রাখবেন না। পেঁয়াজ ইথিলিন গ্যাস তৈরি করে বাতাসে ছড়িয়ে দেয়। এই গ্যাস যে কোনো সবজি বা ফলকে দ্রুত পাকিয়ে দেয়।,২. পেঁয়াজ ও আলু দুটো সবজি থেকেই আর্দ্রতা সৃষ্টি হয়ে থাকে, যা দুটো সবজিকে নষ্ট করে দেয়। ,৩. আলু ও পেঁয়াজ খোলা ও ঠাণ্ডা জায়গায় রাখুন। যেখানে বাতাস, সেখানে আলাদাভাবে সংরক্ষণ করুন।,৪. অন্ধকার, ঠাণ্ডা ও শুকনো জায়গায় আলু ভালো থাকে। সবচেয়ে ভালো হয় যদি আলু স্বাভাবিক তাপমাত্রার চেয়ে কম, তবে রেফ্রিজারেটরের তাপমাত্রার চেয়ে বেশি তাপমাত্রায় রাখা যায়। ,৫. যেখানে বাতাস চলাচল করে এমন জায়গায় পেঁয়াজ রাখুন। কাগজের ব্যাগ বা তারের ঝুড়িতে পেঁয়াজ রাখতে পারেন। তবে রেফ্রিজারেটরে রাখবেন না। ,লেখক: আয়েশা সিদ্দিকা, গৃহিনী,"
করোনা সংক্রমণ রোধে কেমন মাস্ক পরবেন ,"করোনা সংক্রমণ রোধে মাস্ক পরা খুবই জরুরি। একাধিক গবেষণায় দেখা গেছে, মাস্ক পরলে করোনা সংক্রমণ অনেকটাই রোধ করা যায়। এ ছাড়া যেসব দেশে মাস্ক পরা বাধ্যতামূলক করা হয়েছে, সেসব দেশে করোনা সংক্রমণ কমেছে।  ,করোনা সংক্রমণ রোধে বিশ্ব স্বাস্থ্য সংস্থা (হু) মাস্ক পরা ও হাত ধোয়ার ওপর সবচেয়ে বেশি গুরুত্ব দিয়েছে। ,করোনা সংক্রমণ রোধে মাস্ক পরলেও অনেকে এর সঠিক ব্যবহার জানে না। ,আসুন জেনে নিই করোনা সংক্রমণ রোধে কী ধরনের মাস্ক পরা উচিত-,১. ঢিলেঢালা মাস্ক পরবেন না। এমন মাস্ক পরতে হবে যা আপনার মুখের সঙ্গে চেপে বসে থাকে। যাতে ওপর-নিচ বা কোনোভাবে ভাইরাস আপনার নাক ও মুখে প্রবেশ করতে না পারে।,২.  মাস্ক পরে নাক ও মুখ ভালোভাবে ঢেকে রাখুন। ,৩. তিন স্তরের সুতি কাপড়ের মাস্ক পরা সবচেয়ে ভালো। এ ছাড়া সার্জিক্যাল মাস্কও ব্যবহার করতে পারেন। এমন মাস্ক ব্যবহার করা ভালো যা ধোয়া যায়।,৪.  উল্টো করে মাস্ক পরবেন না। এতে জীবাণু সহজেই শরীরে প্রবেশ করতে পারবে।,৫. মাস্ক হাত দিয়ে ধরা থেকে বিরত থাকুন। মাস্ক ছোঁয়া একদমই উচিত নয়। এতে করে সংক্রমণের ঝুঁকি বেড়ে যায়। যদি মাস্কে হাত দিতেই হয়, তা হলে অবশ্যই হাত স্যানিটাইজ করুন।,৬. একবার মাস্ক ব্যবহার করার পর সেটি স্যানিটাইজ করা বা ধুয়ে নেয়া জরুরি। আপনি যদি কাপড়ের মাস্ক ব্যবহার করেন, তবে সেটি পানি এবং সাবান দিয়ে ভালো করে ধুয়ে রোদে শুকিয়ে নিন। কখনই ময়লা বা ভেজা মাস্ক ব্যবহার করবেন না। এতে ঝুঁকি আরও বেড়ে যেতে পারে।, ,লেখক: ডা. আরেফিন খান, বক্ষব্যাধি বিশেষজ্ঞ, জাতীয় বক্ষব্যাধি ইনস্টিটিউট ও হাসপাতাল।
 ,"
