Blog Titles,Blog Content
কচি আমপাতায় সারাবে যেসব রোগ,"শীত শেষ হয়ে শুরু হচ্ছে বসন্ত। তার সঙ্গে আগমন ঘটেছে ফলের রাজা আমের। আম সবাই খেলেও এই পাতার পুষ্টিগুণের কথা আমরা অনেকেই জানি না। ,বাতব্যথা, শ্বাসকষ্ট, ব্লাডপ্রেশার নিয়ন্ত্রণে রাখবে আমপাতা। আর আমের মধ্যে রয়েছে অনেক উপকারী গুণ। এতে রয়েছে ভিটামিন, এনজাইম, অ্যান্টিঅক্সিডেন্ট, খনিজ উপাদান। ,আয়ুর্বেদ শাস্ত্রে আমপাতার অনেক উপকারিতার কথা জানানো হয়েছে। এই পাতা ব্যবহারের ফলে যেসব রোগ নিয়ন্ত্রণে রাখা যায়, যেসব বিষয়ে আলোচনা করা হয়েছে।  ,আম পাতায় মেঞ্জিফিরিন নামক একটি সক্রিয় উপাদান থাকে, যা স্বাস্থ্যের জন্য ভালো। ,আমপাতার ঔষধি গুণ-,১. অনেক সময় দেখা যায় বারবার হেঁচকি উঠছে। আমপাতা পুড়িয়ে তার ধোঁয়া নাকের কাছে ধরলে এই সমস্যা থেকে মুক্তি পাওয়া যাবে। ,২. বাতের সমস্যায় কচি আমপাতা খুবই উপকারী। কচি আমপাতা পানিতে ফুটিয়ে প্রতিদিন সেই পানি খেলে উপকার পাবেন। ,৩. আঁচিল নিরাময়ে আমপাতা খুব উপকারী। আমপাতা পুড়িয়ে কালো করে নিন। সেই গুঁড়োর মধ্যে সামান্য পানি মিশিয়ে পেস্ট তৈরি করে আঁচিলে লাগান। দ্রুত সেরে যাবে।,৪. আমপাতা শুকিয়ে গুঁড়ো করে প্রতিদিন সকালে এক গ্লাস পানি মিশিয়ে খান। কিডনিতে পাথর জমবে না। ,৫. কচি আমপাতা ব্লাডপ্রেশারকে নিয়ন্ত্রণে রাখে।,৬. শ্বাসকষ্টে ভুগলে প্রতিদিন সকালে আমপাতা দিয়ে তৈরি চা খান। উপকার পাবেন।,৭. আমপাতার সাহায্যে ক্ষত নিরাময়ে করা সম্ভব। আমপাতা পুড়িয়ে যে ছাই হচ্ছে তা ক্ষত স্থানে লাগালে উপকার পাবেন। ,তথ্যসূত্র: জিনিউজ,"
বাংলাদেশ থেকে হিমালয়ের চুলু-ফারইস্ট পর্বতে অভিযানে যাচ্ছে একদল তরুণ,"প্রথমবারের মতো বাংলাদেশ থেকে হিমালয়ের চুলু-ফারইস্ট পর্বতে শীতকালীন অভিযানে যাচ্ছে একদল অভিযাত্রী। ,অ্যাডভেঞ্চার ক্লাব দ্য কোয়েস্টের পক্ষ থেকে 'গো জায়ান উইন্টার এক্সপেডিশন ২০২০' শিরোনামে অভিযানে অংশ নেয়া অভিযাত্রীরা হচ্ছেন সালেহীন আরশাদী, ইন্তিয়াজ মাহমুদ, তাহমিদ হোসাইন রাফিদ এবং সামিউর রহমান তূর্য। ,১২ ফেব্রুয়ারি হিমালয়ের এই দুর্গম চূড়া আরোহণের অভিযানে দেশ ছাড়ছেন তরুণরা। এক মাসের এই অভিযানে হিমালয়ের চরমতম আবহাওয়ায় অন্নপূর্ণা পর্বতশ্রেণীতে অবস্থিত ১৯,৮৭৮ ফুট উচ্চতার চুলু-ফারইস্ট পর্বতে বাংলাদেশের পতাকা ওড়ানোর চেষ্টা করবেন এই তরুণ অভিযাত্রীরা। ,হিমালয়ের হিমবাহগুলোর গলা পানি থেকেই এই অঞ্চলের নদ নদীর সৃষ্টি, যা ব-দ্বীপে প্রাণ সঞ্চার করেছে। জলবায়ুর অভিযোজনে হিমবাহ গলে যাওয়ার মাত্রা দ্রুততর হচ্ছে, যা বাংলাদেশের মত ভাটির দেশের জন্য মারাত্মক বিপর্যয় ডেকে আনছে। ,পর্বতারোহণের পাশাপাশি তাই দলটি বৈশ্বিক উষ্ণতা বৃদ্ধির ভয়াবহতা ও পরিবেশ বিপর্যয়ের বিষয়ে সচেতনতা সৃষ্টির প্রয়াস চালাবে। ,হিমালয়ে শীতকালীন অভিযান নানা কারণে অত্যন্ত দুঃসাধ্য। পাঁচ হাজার মিটার উচ্চতার পর অক্সিজেনের পরিমাণ সমতলের অর্ধেক। অক্সিজেনের অভাবে প্রতিটি পদক্ষেপ নেওয়া বেশ কষ্টসাধ্য হয়ে দাঁড়ায়। ,সেই সঙ্গে শীতকালের তাপমাত্রা মাইনাস ৩০ ডিগ্রি সেলসিয়াসে নেমে যায়। তীব্র ঠাণ্ডার সঙ্গে তুমুল তুষারঝড়, হঠাৎ করে নেমে আসা তুষারধ্বস ও ফাটলের বাধা অভিযাত্রীদের মোকাবেলা করতে হবে। শীতকালীন এই অভিযানটি পৃষ্ঠপোষকতা করছে গো জায়ান।,"
গ্রাম বাংলার পিঠা এখন স্মৃতি হয়ে গেছে!,"কালের বিবর্তনে হারিয়ে যাচ্ছে ঐতিহ্যবাহী গ্রাম বাংলার বাহারি পিঠা। একসময় পাড়ায়-পাড়ায়, মহল্লায়-মহল্লায় ছোট- বড় সকলেই পিঠা খাওয়ার আনন্দে মেতে উঠত।,কিন্তু এখন তা আর চোখে পড়েনা। কর্মচাঞ্চল্য এই ব্যস্তময় জীবনের গর্ভে তা এখন হারিয়ে যাচ্ছে। যতই শীত বাড়ে ততই যেন মানুষের পিঠা বানানোর ব্যস্ততা বেড়েই চলত।,শীতকাল আসলে ভোলার গ্রাম-গঞ্জে, ফুটপাত হতে শুরু করে প্রতিটি ঘরে ঘরে পিঠা বানানোর ব্যস্ততা বেড়ে যেত। বাহারি রকমের পিঠা তৈরির উৎসবে আত্মহারা হত সর্বস্তরের মানুষ। শীতের এই সময়ে ভোলার বিভিন্ন গ্রামাঞ্চলের প্রায় প্রতি ঘরেই চিতল, দুধচিতল, পুলি, নকশি, পাটিসাপটা, ভাপা,পাখন, তেলে ও গোটা পিঠাসহ হরেক রকমের পিঠা তৈরিতে ব্যস্ত হয়ে পড়তেন গৃহিণীরা।,কিন্তু কালের বিবর্তনে ও কর্মচাঞ্চল্যের কারণে এ এলাকার মানুষ এখন বাড়িতে পিঠা তৈরির সেই উৎসবমুখর আমেজ হারিয়েছেন। সময়ের সঙ্গে সঙ্গে মানুষের জীবনযাত্রা বদলে যাচ্ছে অনেক।,কালের বিবর্তনের সঙ্গে সঙ্গে আমাদের গ্রামীন সংস্কৃতিগুলো হারিয়ে যাচ্ছে। জেলার মনপুরা উপজেলার গৃহিণী নুরনাহার বেগম বলেন, শীত আসলে আগে কত ধরণের পিঠা বানাতাম। সারারাত বসে ঢেঁকিতে চাল গুড়া করতাম এবং ভোরে উঠে পিঠা বানাতাম সবাই মিলে।,ছেলে মেয়েরা আনন্দের সঙ্গে পিঠা খেয়ে স্কুলে চলে যেত। কিন্তু বিগত কয়েক বছর ধরে পিঠা তৈরি হয় না। আগের সেই পিঠা বানানোর আমেজ হারিয়ে গেছে অনেকদিন আগে।,এখন সবাই পিঠা বাজার থেকে কিনে এনে খায়। এতে কোনো আনন্দ- উৎসাহ থাকে না।,গ্রামের গৃহিণীদের মধ্যে আগের মত পিঠা বানাননোর উৎসব নেই। হরেক রকমের পিঠ আমাদের নতুন প্রজন্ম থেকে হারিয়ে যাচ্ছে। তাই পিঠা বানানোটা এখন স্মৃতি হয়ে গেছে।,"
ওজন কমাবে চিংড়ি সালাদ,"শরীরের অতিরিক্ত ওজন কমাতে ডায়েট করেন অনেকে। আর ওজন কমাতে পুষ্টি বিশেষজ্ঞরা গবেষণা করে বের করেছেন নানা ধরনের ডায়েট। ,তবে শরীরের জন্য প্রয়োজনীয় পুষ্টি চাহিদা পূরণ হচ্ছে কিনা, সেটি মাথায় রাখতেই হবে। ডায়েট চার্টের অন্যতম খাবার হলো সালাদ। 
চিংড়ি খেতে অনেকেই পছন্দ করেন। আর চিংড়ি দিয়ে তৈরি সালাদ কিন্তু খেতে দারুণ। এ সালাদ আপনাকে শক্তি জোগাতে সাহায্য করবে। আর ওজন কমাতে খেতে পারেন চিংড়ি সালাদ।,আসুন জেনে নেই কীভাবে তৈরি করবেন চিংড়ি সালাদ-,উপকরণ,চিংড়ি মাছ আধা কেজি, চিলি সস দুই টেবিল চামচ, রসুন কুচি ছয়-সাত কোয়া, কাঁচামরিচ সাত-আটটি, ফিশ সস, পাঁচ-ছয় টেবিল চামচ, সাদা ভিনেগার চার টেবিল চামচ, তিলের তেল পরিমাণমতো।,সালাদের জন্য,পেঁয়াজের কলি কুচি চার-পাঁচটি, গাজর কুচি একটি, ধনেপাতা সামান্য ও লবণ স্বাদমতো।,প্রস্তুত প্রণালি,প্রথমে চিংড়ি মাছ লবণ মেশানো পানিতে সেদ্ধ করে নিন। এর মধ্যে রসুন কুচিও দিয়ে দিন। এবার একটি বাটিতে ফিশ সস, চিলি সস, সাদা ভিনেগার, কাঁচামরিচ কুচি ও তিলের তেল একসঙ্গে মিশিয়ে নিন।,এখন এতে গাজর কুচি, পেঁয়াজের কলি কুচি, ধনেপাতা কুচি ও সামান্য লবণ দিয়ে ভালো ভাবে মেশান। এরপর সেদ্ধ করা চিংড়ি ও রসুন কুচি এই মিশ্রণের সঙ্গে মিশিয়ে নিন। ব্যাস, খুব সহজেই তৈরি হয়ে গেল স্বাস্থ্যকর চিংড়ি সালাদ।,,"
বন্ধ্যত্বের ঝুঁকি কমাবে যে চকলেট,"যখন কোনো সক্ষম দম্পতি একসঙ্গে থাকার পরও এক বছর এবং এর বেশি সময় সহবাস করা সত্ত্বেও সন্তান জন্মদানে ব্যর্থ হয়, তখন সেই দম্পতিকে ‘বন্ধ্যা’ এবং দম্পতির এ অবস্থাকে বন্ধ্যত্ব বলে। ,বন্ধ্যত্ব শুধু সবসময় নারীদের সমস্যা নয়। নারী-পুরুষ উভয়ের সমস্যাই বন্ধ্যত্বের কারণ হতে পারে। এ বন্ধ্যত্ব পুরুষ অথবা মহিলা অথবা উভয়ের কারণে হতে পারে।,যৌবনে টেস্টোস্টেরন হরমোন যথেষ্ট পরিমাণে ক্ষরিত হয় বলে যৌন মিলনের বাসনা জন্মে। তবে বার্ধক্যে টেস্টোস্টেরন হরমোনের ক্ষরণ কমে যায়। তাই ইচ্ছেটাও কমে যেতে থাকে। এ ছাড়া শরীরে অতিরিক্ত চর্বির কারণে এ সমস্যা হতে পারে। ,থাইরয়েড বা ডায়াবেটিসের কারণেও এই সমস্যা হতে পারে। এই সমস্যায় থেকে পারেন ডার্ক চকলেট।,বিশেষজ্ঞদের দাবি, শুক্রাণুর কর্মক্ষমতা বাড়ায় ডার্ক চকলেট! ডার্ক চকলেটে রয়েছে অ্যামিনো অ্যাসিড, এল-আর্জিনিন এইচসিএল যা শুক্রাণুর সংখ্যা বাড়ায়। এ ছাড়া পুরুষের বন্ধ্যত্ব দূর করতে এই চকলেট বিশেষ ভূমিকা রাখে। ,বিশেষজ্ঞরা আরেও জানায়, ডার্ক চকলেটে প্রচুর পরিমাণে অ্যান্টিঅক্সিডেন্ট রয়েছে, যা যৌন উদ্দিপনা বৃদ্ধিতে ভুমিকা রাখে। 
গবেষণায় দেখা গিয়েছে, যে সবপুরুষ নিয়মিত সামান্য পরিমাণে হলেও ডার্ক চকলেট খান, তাদের যৌন ক্ষমতা অন্যদের চেয়ে বেশি। 
তাই মিল্ক চকলেট নয় বন্ধ্যত্বের ঝুঁকি কমাতে, শুক্রাণুর সংখ্যা আর কর্মক্ষমতা বাড়াতে নিয়মিত খান ডার্ক চকলেট।,তথ্যসূত্র: জি নিউজ, ,"
ওজন কমাতে কতটুকু লবণ খাবেন?,"অতিরিক্ত ওজন থাকলে অবশ্যই তা কমিয়ে ফেলতে হবে। কারণ অতিরিক্ত ওজনের ফলে শরীরে বিভিন্ন ধরনের রোগ হয়ে থাকে। অতিরিক্ত ওজন কমাতে খেতে পারেন পরিমাণমতো লবণ। ,তবে এখন প্রশ্ন হলো– কতটুকু লবণ খাবেন? বিশেষজ্ঞদের মতে, লবণ খেলে ওজন বাড়ার সমস্যাটা এলে একটা মিথ। অনেকেই ধারণা লবণ বেশি খেলে শরীরে পানির পরিমাণ বেড়ে যায়। তাই খাবারে লবণের পরিমাণ কমিয়ে দেন। আসলে তা পুরোপুরি সত্যি নয়।,ভারতীয় সংবাদমাধ্যম জি নিউজ জানিয়েছে, লবণ খেলে এমন নয় যে ওজন বাড়ে। আর যাদের উচ্চ রক্তচাপের সমস্যা রয়েছে, তাদের প্রতিদিন নির্দিষ্ট পরিমাণে লবণ খেতে হবে। ,আসুন জেনে নিই ওজন কমাতে কতটুকু লবণ খাবেন?,১. প্রতিদিন এক চা চামচ লবণ খেতে পারেন। তবে কাঁচালবণ না খেয়ে রান্নায় দিয়ে খাওয়াই ভালো। ,২. প্যাকেটের গায়ে পড়ে আয়োডিন যুক্ত লবণ কিনুন।,৩. লবণের অভাবে শরীরে সোডিয়ামের অভাব, রক্তচাপ কমে যায়, মাথা ঘোরা ছাড়াও নানা ধরনের সমস্যা দেখা দিতে পারে। তাই দৈনন্দিন খাবারের তালিকা থেকে লবণ পুরোপুরি বাদ দেয়া যাবে না। ,৪. পাউরুটি, চিপস, সস, চিজসহ নানা ধরনের খাবারে লবণ থাকে। তাই এসব খাবার অতিরিক্ত খাওয়া যাবেন না। ,৫. ব্যায়াম করলে ও কিডনির সমস্যা থাকলে ডায়াটেশিয়ানের পরামর্শ মতো লবণ খেতে হবে।  ,তথ্যসূত্র: জিনিউজ, ,"
ফায়ার সার্ভিসে নিয়োগ,"ফায়ার সার্ভিস ও সিভিল ডিফেন্স অধিদফতরে ০২টি পদে ৩৭৬ জনকে নিয়োগ দেওয়া হবে। আগ্রহীরা আগামী ২৩ ফেব্রুয়ারি পর্যন্ত আবেদন করতে পারবেন।,প্রতিষ্ঠানের নাম: ফায়ার সার্ভিস ও সিভিল ডিফেন্স অধিদফতর,পদের নাম: ফায়ারম্যান
পদসংখ্যা: ৩৬৮ জন
শিক্ষাগত যোগ্যতা: এসএসসি/সমমান
শারীরিক যোগ্যতা: উচ্চতা ৫ ফুট ৪ ইঞ্চি, বুক ৩২ ইঞ্চি এবং শারীরিক গঠন ত্রুটিমুক্ত
বেতন: ৯,০০০-২১,৮০০ টাকা,পদের নাম: নার্সিং অ্যাটেনডেন্ট
পদসংখ্যা: ০৮ জন
শিক্ষাগত যোগ্যতা: এসএসসি/সমমান
শারীরিক যোগ্যতা: উচ্চতা ৫ ফুট ৪ ইঞ্চি, বুক ৩২ ইঞ্চি এবং শারীরিক গঠন ত্রুটিমুক্ত
বেতন: ৯,০০০-২১,৮০০ টাকা,চাকরির ধরন: অস্থায়ী
প্রার্থীর ধরন: পুরুষ
বয়স: ০১ জানুয়ারি ২০২০ তারিখে ১৮-৩০ বছর। বিশেষ ক্ষেত্রে ৩২ বছর,আবেদনের নিয়ম: আগ্রহীরা www.fscd.teletalk.com.bd এর মাধ্যমে আবেদন করতে পারবেন। আবেদনের সঙ্গে ৩০০-৩০০ সাইজের ছবি ও ৩০০-৮০ সাইজের স্বাক্ষর স্ক্যান করে যুক্ত করতে হবে।,আবেদনের শেষ সময়: ২৩ ফেব্রুয়ারি ২০২০ তারিখ বিকেল ০৫টা পর্যন্ত আবেদন করতে পারবেন।,সূত্র: জাগোজবস ডটকম,"
