Blog Titles,Blog Content
পশুর হাটে গেলে মেনে চলুন ৭ স্বাস্থ্যবিধি ,"করোনাভাইরাসের সংক্রমণে এই সময়ে এসেছে ঈদুল আজহা। এই ঈদে মহান আল্লাহর সন্তুষ্টি অর্জনের জন্য মানুষ পশু কোরবানি করে থাকেন। আর কোরবানির পশু সাধারণ হাট থেকেই কিনতে হয়। ,অনলাইনে পশু বেচাবিক্রি হলেও এখন পশু কেনার জন্য হাটে যাচ্ছেন অনেকেই। সাধ ও সাধ্যের ভারসাম্য রাখতে কিছু মানুষ চাইলেও পশুর হাটে যাওয়া এড়াতে পারছেন না। তবে হাট থেকে আপনার করোনা সংক্রমণ হতে পারে। ,পশুর হাট থেকে যেহেতু করোনা সংক্রমণ হতে পারে, তাই স্বাস্থ্যবিধি মেনে চলা জরুরি। ,আসুন জেনে নিই যেসব স্বাস্থ্যবিধি মেনে চলবেন–,১. কোরবানির হাটে করোনা সংক্রমণ রোধ সবচেয়ে বড় হাতিয়ার  হচ্ছে মাস্ক। সার্জিক্যাল মাস্ক ও তিন স্তরের কাপড়ের মাস্ক পরতে পারেন। ভালো মাস্ক ব্যবহার করলে সংক্রমণ এড়ানো যায়। ,২. এমন মাস্ক পরবেন যা নাকের ওপর থেকে চোয়ালের নিচের অংশ পর্যন্ত যেন ভালোভাবে আটকে থাকে। কোনো অবস্থাতেই মাস্ক মুখ থেকে খুলে থুতনি ও কানে ঝুলিয়ে রাখা যাবে না।  ,৩. অনেকেই স্বাস্থ্যবিধি মানছেন না। তাই যতটা সম্ভব দূরত্ব বজায়  রাখুন। ,৪. গবাদিপশুর গায়ে এই ভাইরাস লেগে থাকবে এমন নয়। তবে গায়ে হাত দেয়ার সময় ‘হ্যান্ড গ্লাভস’ ব্যবহার করবেন। বাড়ি থেকে সাবান ও পানির বোতল নিয়ে যেতে পারেন। পশু স্পর্শ করার পর হাত ধুয়ে নিন।  ,৫. পিপিই পরে হাটে যাওয়ার প্রয়োজন নেই। এতে আপনি গরমে অসু্স্থ হয়ে যেতে পারেন। তবে পা বাঁচাতে গামবুট পরতে পারেন।
 
৬. হাট থেকে ফিরেই হাত সাবানপানি দিয়ে ধুয়ে ফেলুন। গায়ের পোশাক, জুতা এবং নিজেকে জীবাণুমুক্ত করুন।
 
৭. কোরবানির পশুটিকে সাবান কিংবা শ্যাম্পু দিয়ে গোসল করাতে হবে। ,লেখক:,ডা. মোহাম্মদ আলী 
মৎস্য ও প্রাণিসম্পদ মন্ত্রণালয়ের 
উপপরিচালক 
প্রাণিসম্পদ অধিদফতর 
কেন্দ্রীয় গোপ্রজনন ও দুধ খামার সাভার, ঢাকা।,"
"স্তন ক্যান্সারের ঝুঁকি কাদের বেশি, করণীয়","বিশ্ব স্বাস্থ্য সংস্থার হিসাব অনুযায়ী, বাংলাদেশে প্রতি বছর ১৫ হাজারের বেশি মানুষ স্তন ক্যান্সারে আক্রান্ত হচ্ছেন। যার মধ্যে ৯৮ শতাংশ নারী ও ২ শতাংশ পুরুষ। প্রতি বছর শুধু স্তন ক্যান্সারে সাড়ে ৭ হাজারের বেশি নারী মারা যাচ্ছেন।
 
এই প্রতিবেদন থেকে স্তন ক্যান্সারের ভয়াবহ ঝুঁকি সম্পর্কে কিছুটা হলেও আচ করা যায়। এই রোগ থেকে বাঁচতে হলে এর কারণ, লক্ষণ ও প্রতিকার এবং প্রতিরোধ ব্যবস্থা সম্পর্কে জানা থাকা দরকার।  ,যাদের স্তন ক্যান্সারের ঝুঁকি বেশি-,যাদের স্তন ক্যান্সারের পারিবারিক ইতিহাস রয়েছে, যারা নিয়মিত স্কিনং করান না, বয়স চল্লিশের বেশি, ১২ বছরের আগে ঋতুস্রাব শুরু হয়েছে, ঋতুস্রাব ৫৫ বছরের পরও চলতে থাকলে, প্রথম সন্তান ৩৫ বছরের পরে হলে স্তন ক্যান্সারের ঝুঁকি বেশি। স্তনে অন্য কোনো রোগ হলে, বন্ধ্যত্ব ও উচ্চতা ৫’- ৮ ইঞ্চি বা তারও বেশি হলেও এই রোগ হওয়ার ঝুঁকি থেকে যায়। 
এই সমস্যা দেখা দিলে বিশেষজ্ঞ চিকিৎসকের পরামর্শ নিতে হবে। ,কখন দ্রুত চিকিৎসকের কাছে যাবেন,আপনি স্তন ক্যান্সারে আক্রান্ত হলে বেশ কিছু লক্ষণ দেখা দেবে। এসব লক্ষণ দেখা দিলে অবশ্যই দ্রুত চিকিৎসকের পরামর্শ নিতে হবে। ,লক্ষণগুলো হলো- বুকের মধ্যে শক্ত চাকা, ঘন পরু বা অমসৃণ, স্তন ফুলে গেলে, গরম অনুভব হলে, লাল হয়ে গেলে অথবা ত্বক কালো হয়ে গেলে। ,এ ছাড়া স্তনের আকার আকৃতি যদি দ্রুত পরিবর্তন হয়, স্তনের ত্বকে গর্ত ও কুঁচকে যাওয়া, নিপলে চুলকানি, রেশ হওয়া, ঘা হওয়া, নিপল দিয়ে রক্ত বা সাদা, যে কোনো তরলজাতীয় আঠালো পদার্থ নিঃসরণ হলে ও স্তনের মধ্যে তীব্র ব্যথা হলে দ্রুত ডাক্তারের কাছে যাবেন। ,এই রোগ থেকে বাঁচার উপায়-,যে কোনো রোগ নিরাময়ের চেয়ে প্রতিরোধ করা সবচেয়ে উত্তম। কিছু নিয়ম মেনে চললে এই রোগ খুব সহজে প্রতিরোধ করা যায়।
 
ওজন নিয়ন্ত্রণে রাখা, প্রতিদিন ঘাম ঝড়িয়ে ৩০-৪৫ মিনিট ব্যায়াম করা, ফল ও সবজি খাওয়া, ধূমপান ও মদ্যপান এড়িয়ে চলা, ৩৫ বছরের পর পিল না খাওয়া, হরমন থেরাপি না নেয়া, শিশুকে বুকের দুধ খাওয়ানো।,এ ছাড়া টেমক্সিফেন অথবা রেলক্সিফেন ওষুধ দীর্ঘদিন সেবন না করা।
 
লেখক:
ডা. রফিক আহমেদ
বক্ষব্যাধি ও ক্যান্সার বিশেষজ্ঞ
ঢাকা ন্যাশনাল মেডিকেল কলেজ হাসপাতাল।,"
সাপে কাটলে কী করবেন?,"বর্ষা মৌসুমে বাড়ে সাপ ও পোকামাকড়ের উপদ্রব। প্রতি বছর এই সময়ে সাপের কামড়ে অনেক মানুষের মৃত্যু হয়। ,বিশ্ব স্বাস্থ্য সংস্থার ২০১৯ সালের অক্টোবরের তথ্যের বরাত দিয়ে বিবিসির প্রতিবেদন বলছে, প্রতি বছর অন্তত পাঁচ লাখ ৮০ হাজার মানুষ সাপের দংশনের শিকার হন। আর মারা যান অনন্ত ৬ হাজার মানুষ।,সাপে কাটলে আতঙ্কিত না হওয়ার পরামর্শ দিয়েছেন বিশেষজ্ঞরা। তারা বলছেন, সাপে কাটলেই মৃত্যু হবে এমন নয়।
 
সম্প্রতি বিবিসিকে দেয়া এক সাক্ষাৎকারে চট্টগ্রাম মেডিকেল কলেজ হাসপাতালের অধ্যাপক অনিরুদ্ধ ঘোষ বলেন, বাংলাদেশে ৮০ শতাংশ সর্পদংশনের ক্ষেত্রে সাপ থাকে নির্বিষ। তাই সাপ কামড়ালেই মৃত্যু হবে এমন ধারণা সঠিক নয়। ,সাপের দংশন এবং অ্যান্টিভেনম নিয়ে গবেষণা করা এই অধ্যাপক বলেন, সাপে কাটলে দ্রুত ওষুধ বা অ্যান্টিভেনম প্রয়োগ করতে হবে। তা হলে মৃত্যুঝুঁকি কমবে। ,সাপে কাটলে কী করবেন?,সাপ কাটলে কী করতে হবে ও কী করবেন না, সে বিষয়ে চট্টগ্রাম মেডিকেল কলেজ হাসপাতালের এই অধ্যাপক কয়েকটি পরামর্শ দিয়েছেন, সেগুলো নিচে দেয়া হলো–, ,১. দ্রুত চিকিৎসকের শরণাপন্ন হতে হবে। ,২. শক্ত কাপড় দিয়ে হালকা করে সাপে কাটা স্থান বাঁধতে হবে।,৩. সাপে কাটা পেশি কম নড়াচড়া করুন, পেশির নড়াচড়া যত কম হবে, বিষ তত কম ছড়াবে।,কী করবেন না,১. এ সময় আতঙ্কিত হবেন না। ওঝা বা ঝাড়ফুঁকের অপেক্ষা না করে চিকিৎসকের শরণাপন্ন হোন।
 
২. চিকিৎসক দেখার আগ পর্যন্ত কিছু খাবেন না। 
৩. কোনো মলম বা মালিশ লাগানো উচিত নয়। 
৪. সাপে কাটা জায়গায় শক্ত করে বাঁধতে হবে। কারণ রক্ত জমে গিয়ে আক্রান্ত ব্যক্তি পঙ্গু হয়ে যেতে পারেন। ,তথ্যসূত্র: বিবিসি,"
ঈদে সুস্থ থাকতে মেনে চলুন ৫ স্বাস্থ্যবিধি ,"মহামারী করোনাভাইরাস সংক্রমণের এই সময়ে প্রিয়জনদের সঙ্গে ঈদ করতে রাজধানী ছাড়ছেন বহু মানুষ। করোনা সংক্রমণের চলমান পরিস্থিতিতে বাসস্টপেজ, স্টেশন, টিকিট কাউন্টারে লোকজনের ভিড় আপনার ঈদ নিরানন্দময় করে তুলতে পারে।,এবারের ঈদে পাশে সিট খালি রেখে দূরত্ব বজায় রেখে যানবাহন চলাচলের নির্দেশনা সরকারের পক্ষ থেকে দেয়া হলেও অনেক পরিবহন তা মানছে না।
 
মনে রাখবেন– আপনার সুস্থতার ওপর আপনার পরিবারের সদস্যদের সুস্থতাও নির্ভর করে। কারণ আপনি আক্রান্ত হলে পরিবার ঝুঁকিতে থাকবে। তাই ঈদে যদি আপনাকে বাড়ি যেতেই হয়, তবে অবশ্যই মানতে হবে স্বাস্থ্যবিধি।
    
আসুন জেনে নিই ঈদে সুস্থ থাকতে মানতে হবে যেসব স্বাস্থ্যবিধি-,১. টার্মিনালে কোনোভাবেই ভিড় করা যাবে না। একজন মানুষ থেকে অন্তত তিন ফুট দূরত্ব বজায় রাখতে হবে।,২. মাস্ক পরা আবশ্যক। এ ছাড়া মাস্ক নাকে টেনেই পরতে হবে। কোনো অবস্থাতেই মাস্ক খুলে মুখে ও কানের সঙ্গে ঝুলিয়ে রাখা যাবে না। 
৩. ঘর থেকে বের হওয়ার সময় সঙ্গে হ্যান্ড স্যানিটাইজার রাখুন। ১৫ থেকে ২০ মিনিট পর পর হাতে ব্যবহার করুন। আর হাত ধোয়ার সুযোগ থাকলে সাবান দিয়ে হাত ধুয়ে নিন। ,৪. খাবারের বিষয়ে সচেতন হতে হবে। ঘরে তৈরি করা খাবার বক্সে করে সঙ্গে নিতে পারেন। কোনোভাবেই বাইরের কেনা খাবার খাবেন না। ,৫. বাড়ি ফেরার পর কুসুম গরম পানি দিয়ে গোসল করুন। যদি গরম পানির ভাব নিতে পারেন তবে ভালো। এ ছাড়া ঠাণ্ডাজাতীয় খাবার এড়িয়ে চলুন। , ,লেখক:
ডা. উত্তম কুমার দাস
কার্ডিওলজি ও মেডিসিন বিশেষজ্ঞ
হোলি ফ্যামিলি হাসপাতাল ঢাকা।,"
নাক মুখ ও চোখ ঢাকা থাকলে কী সংক্রমণ থেকে বাঁচা যায়? ,"বৈশ্বিক মহামারী করোনাভাইরাসের সর্বজনবিদিত কোনো ভ্যাকসিন বা টিকা আজও আবিষ্কৃত হয়নি। তাই সচেতনতা, জীবনযাপনে পরিবর্তন ও সঠিক স্বাস্থ্যবিধি মেনে চলাই এ ভাইরাস থেকে বাঁচার উপায়।
   
সংক্রমণ রোধে এ সময় ঘন ঘন সাবান দিয়ে হাত ধোয়া, মাস্ক ব্যবহার ও সামাজিক দূরত্ব বজায় রাখার ওপর সবচেয়ে বেশি গুরুত্ব দেয়া হচ্ছে। এ ছাড়া বিশ্বের বিভিন্ন দেশে মাস্ক পরা বাধ্যতামূলকও করা হয়েছে।
 
এখন প্রশ্ন হচ্ছে– করোনা সংক্রমণ থেকে বাঁচতে মাস্ক ব্যবহার কিংবা নাক-মুখ-চোখ ঢেকে রাখাটা কতটা কার্যকর?,আমরা চীন, জাপান ও দক্ষিণ কোরিয়ার দিকে তাকালে দেখব যে, এসব দেশের মানুষ নিজেকে সুরক্ষিত রাখতে এমনিতেই মাস্ক ব্যবহার করছেন। আসলে মাস্ক ব্যবহার এসব দেশের মানুষের সংস্কৃতির অংশ হয়ে গেছে। এলার্জি, সর্দি-কাশি ভাইরাসসহ যে কোনো ধরনের শ্বাসনালির রোগ প্রতিরোধ করতে মাস্ক ব্যবহার জরুরি।
 
এই মাস্ক ব্যবহার প্রথমে একটু অস্বস্তিকর মনে হলেও দুই থেকে তিন সপ্তাহের মধ্যে এই স্বাভাবিক অভ্যাসে পরিণত করা যায়। ,মাস্ক পরলে সংক্রমণের ঝুঁকি কমে এমন প্রমাণ একাধিক গবেষণায় পাওয়া গেছে। আর মাস্ক পরলে সংক্রমণের ঝুঁকি অবশ্যই কমে আসবে। ,মাস্ক পরলে যেসব সংক্রমণ রোধ করা যায়-,সাধারণত নাক, মুখ ও চোখের মধ্য দিয়ে এই ভাইরাস আমাদের শ্বাসনালিতে প্রবেশ করে। তাই সংক্রমণ রোধে নাক, মুখ ও চোখ ঢেকে রাখা জরুরি। আর এসব ঢাকতে ভালো মানের মাস্ক ব্যবহার করতে হবে। আর চোখে সাধারণ চশমা বা স্নানগ্লাস ব্যবহার করতে পারেন।
 
করোনা আক্রান্ত রোগী যদি মাস্ক পরে, তবে তিনি নিজে ও অন্যরা নিরাপদে থাকবেন। এতে সংক্রমণের ঝুঁকি কমে ৯০ শতাংশ।, ,লেখক:
বঙ্গবন্ধু শেখ মুজিব মেডিকেল বিশ্ববিদ্যালয়
রেসপিরেটরি মেডিসিন বিভাগের সহযোগী অধ্যাপক। ,"
করোনাকালে ঠাণ্ডা খাবার ও পানীয় খাবেন না,"ষড়ঋতুর দেশে এখন চলছে বর্ষাকাল। এ সময়ে জ্বর, ঠাণ্ডা-কাশি, গলাব্যথা, চর্মরোগসহ বিভিন্ন ধরনের রোগবালাই হয়ে থাকে। ,অন্যদিকে চলছে করোনাকাল। বৈশ্বিক মহামারীর এই সময়ে অন্য সময়ে চেয়ে একটু বেশি সতর্ক থাকতে হবে।
  
করোনাভাইরাসের প্রধান উপসর্গগুলোর অন্যতম হচ্ছে- ঠাণ্ডা-কাশি, গলাব্যথা, জ্বর, স্বাদ ও গন্ধ না পাওয়া। তাই এ সময়ে ঠাণ্ডাজাতীয় খাবার ও পানীয় খাওয়া থেকে বিরত থাকতে হবে।
 
করোনাভাইরাস শ্বাসনালির মধ্য দিয়ে ঢুকে ফুসফুসে প্রবেশ করে এবং শ্বাসনালির কর্মক্ষমতা ধীরে ধীরে নষ্ট করে দেয়। ফলে দেখা দেয় শ্বাসকষ্ট। ঠাণ্ডা খেলে শ্বাসকষ্টের সমস্যা আরও বেড়ে যায়।
 
শ্বাসকষ্ট, ঠাণ্ডা এবং জ্বরে ঠাণ্ডা খাবার ও পানীয় খাওয়া যাবে না।  ঈদে মাংস ও চর্বিজাতীয় খাবার বেশি খাওয়া হয়ে থাকে। এর সঙ্গে অনেকে ঠাণ্ডা কোমল পানীয় খেয়ে থাকেন, যা উচিত নয়।
   
এখন যেহেতু করোনা সংক্রণের সময়, তাই ঠাণ্ডা খাবার ও পানীয় খাওয়া থেকে বিরত থাকুন।
 
এ সময়ে সুস্থ থাকতে কী করবেন?
১. এ সময়ে খাবার সবসময় গরম করে খাবেন। এ ছাড়া আদা ও লেবু দিয়ে তৈরি চা খেতে পারেন। আর গরম দুধ আপনার পুষ্টির চাহিদা পূরণ করে শরীরে শক্তি জোগাবে। ,২. আর যদি হালকা ঠাণ্ডা-কাশি হয়ে থাকে, তবে কুসুম লবণপানিতে গড়গড়া করতে করবেন ও কুসুম গরম পানি পান করতে পারেন। ,৩. এ সময় ফ্রিজের খাবার গরম করে খেতে হবে ও ঠাণ্ডা পানীয় খাওয়া যাবে না।,৪.  বাজার করে ঘরে ফেরার পর ফল, সবজি ও মাছ-মাংস লবণপানি দিয়ে ধুয়ে নিন। এর পর পানি ঝরিয়ে ফ্রিজে রাখুন। এ ছাড়া এক মাস পর পর ফ্রিজ পরিষ্কার করুন। , ,লেখক:
আখতারুন নাহার আলো
প্রধান পুষ্টিবিদ
বারডেম জেনারেল হাসপাতাল।
 ,"
