Blog Titles,Blog Content
"হৃদরোগ নিয়ে যত ভুল ধারণা, প্রতিরোধে করণীয়","বর্তমানে হার্টঅ্যাটাক একটা সাধারণ রোগ হয়ে দাঁড়িয়েছে। বিশ্বের কোটি  মানুষ এই রোগে ভুগছেন। ধমনিপথ রুদ্ধ হলে হৃদযন্ত্র ও রক্তনালির জন্য নানা সমস্যা হতে পারে।
 
৪৫ বছর বা তার বেশি বয়সী পুরুষ এবং ৫৫ বা তার বেশি বয়সের নারীরা এই রোগে বেশি আক্রান্ত হন। ,হার্টঅ্যাটাক কেন হয়?,করোনারি ধমনি রোগ হলো হার্টঅ্যাটাকের প্রধান কারণ। রক্তে অনেক দিন ধরে যদি উঁচুমানের কোলস্টেরল থাকে, তা হলে ধমনির দেয়ালে কোলস্টেরল জমা হতে হতে কোলেস্টরল পুঞ্জ হতে থাকে। 
কোলস্টেরল মান নিয়ন্ত্রণের আছে উপায়, খাদ্যের ধরন পাল্টানো, ব্যায়াম করা আর ওষুধ।,রোগটি ঘটাতে পারে এনজাইনা– হৃদযন্ত্রে রক্তপ্রবাহ কমে গেলে বুকে ব্যথা হয় একে বলে এনজাইনা। রোগটির গুরুতর পরিণতি হলো হার্টঅ্যাটাক। ধমনি হঠাৎ রুদ্ধ হলে এমন হতে পারে। ,হৃদরোগ নিয়ে আমাদের কিছু ভ্রান্ত ধারণা আছে। আসুন জেনে নিই এমন কিছু বিষয়-,১. শরীর হালকা-পাতলা হলে করোনারি হৃদরোগ হবে না। অনেকে তা মনে করেন। যাদের ওজন বেশি নয়, এদের যেমন উচ্চরক্তচাপ, ডায়াবেটিস ও ধূমপানের অভ্যাস থাকলে, পারিবারিক ইতিহাস থাকলে করোনারি হৃদরোগ হতে পারে।,২. হৃদরোগ হবে কেন আমার? আমি তরুণ, বয়স কম। কোলস্টেরল পুঞ্জ ধমনির দেয়ালে গঠিত হতে থাকে শৈশব থেকেই, কোলস্টেরল মানে অসঙ্গতি, ডায়াবেটিস, উচ্চরক্তচাপ ও পারিবারিক ইতিহাস থাকলে তারুণ্যেও হতে পারে হৃদরোগ।,৩. নারীদের করোনারি ধমনি রোগ কম হয়। রজঃনিবৃত্তির পর নারীর ঝুঁকি পুরুষের কাছাকাছি হয়ে যায়। বরং ৬০ ঊর্ধ্ব নারীদের পুরুষের চেয়ে হৃদরোগে ও স্ট্রোকে মৃত্যু বেশিই হয়। দুর্ভাগ্যবশত যেসব নারীর হার্টঅ্যাটাক হয় তাদের অবস্থা পুরুষের চেয়েও বেশি শোচনীয়।,প্রতিরোধে করণীয়,নিয়মিত স্বাস্থ্যকর জীবনযাপন করলে আপনি সুস্থ থাকবেন। ধূমপান, মদ্যপান এড়িয়ে চলুন। নিয়মিত শরীরচর্চা করতে হবে এবং অতিরিক্ত ওজন থাকলে তা কমাতে হবে। ,এ ছাড়া বিষণ্ণতা বা স্ট্রেস মুক্ত থাকার চেষ্টা করুন। ডায়াবেটিস, কোলেস্টেরল ও রক্তচাপের মাত্রা নিয়ন্ত্রণ করুন। আর স্বাস্থ্যকর খাবার খান এবং নিয়মিত মেডিকেল চেকআপ করান।,লেখক: 
সাবেক পরিচালক
ল্যাবরেটরি মেডিকেল সার্ভিসেস
বারডেম হাসপাতাল।,"
সকালের নাস্তায় মাশরুম অমলেট,"সকালের নাস্তায় খেতে পারেন মাশরুম অমলেট। ওজন কমাতে স্বাস্থ্যকর এই খাবার তৈরি করতে পারেন ঘরেই। ,সকালের নাস্তায় তৈরি করতে পারেন মাশরুম অমলেট-,উপকরণ,ডিম ৪টি, বাটার বা মাখন ১ টেবিল চামচ, কাঁচামরিচ কুচি ১  চামচ মাশরুম আধাকাপ, চিলি ফ্লেক্স আধা চা চামচ, ধনেপাতা কুচি আধা চা চামচ, গাজর কুচি ১টেবিল চামচ, গোলমরিচ গুঁড়া আধা চা চামচ, পেঁয়াজ কুচি ২ টেবিল চামচ, রসুন কুচি ১টেবিল চামচ ও লবণ স্বাদমতো।, প্রণালি,প্রথমে ফ্রাইপ্যানে এক চা চামচ বাটার দিয়ে তাতে রসুন কুচি , মাশরুম কুচি, চিলি ফ্লেক্স ও লবণ দিয়ে ভাজুন। শরুম ৫ মিনিট ভেজে নামিয়ে রাখুন। 
এবার ডিম ভেঙে স্বাদমতো লবণ, গোলমরিচ গুঁড়া, পেঁয়াজ কুচি, কাঁচামরিচ কুচি, গাজর কুচি, ধনেপাতা কুচি দিয়ে ভালো করে ফেটে নিতে হবে।,এরপর ফ্রাইপ্যান চুলায় বসিয়ে এতে বাকি বাটার দিয়ে দিন। এতে ফেটানো ডিম দিয়ে ভেজে নিন। ,ডিম উল্টে অপর পাশে এক পাশে ভাজা মাশরুম দিয়ে সার্ভিং ডিসে নামিয়ে নিন। ব্যস হয়ে গেল মাশরুম অমলেট। ,
লেখক: শিউলী আকতার বীনা, গৃহিণী।

 ,"
রসাল তালের স্পঞ্জ কেক রেসিপি,"বাজারে এখন হাত বাড়ালেই পাওয়া যায় পাকা তাল। তালের রস দিয়ে ঘরেই তৈরি করতে পারেন নরম তুলতুলে কেক। ,আসুন জেনে নিই কীভাবে বানাবেন তালের স্পঞ্জ কেক-,উপকরণ,তরল দুধ ১/৩ কাপ, ইস্ট আধা চা চামচ, ঘন তালের রস দেড় কাপ, লবণ স্বাদমতো, চালের গুঁড়া ২ কাপ, ময়দা আধাকাপ, গুঁড়াদুধ ১/৪ কাপ, চিনি ২/৩ কাপ বা স্বাদমতো, কোরানো নারিকেল ১ কাপ।,প্রণালি,কুসুম গরম দুধের সঙ্গে ইস্ট ও লবণ মিশিয়ে ১০ মিনিট রেখে দিন। এর পর একটি পাত্রে চালের গুঁড়া, ময়দা, গুঁড়াদুধ ও চিনি মিশিয়ে নিতে হবে এবং তাতে কোরানো নারিকেল দিয়ে দিন।,তালের রস ও ইস্টের মিশ্রণ দিয়ে সময় নিয়ে সব উপকরণ মিশিয়ে ঢাকনা দিয়ে ঢেকে ৪ ঘণ্টার জন্য উষ্ণ স্থানে রেখে দিন।,এবার বড় আকারের একটি স্টিলের বাটিতে তেল ব্রাশ করে ব্যাটার ঢেলে দিন। বড় প্যানে পানি দিয়ে বলক তুলে নিন। একটি স্টিলের স্ট্যান্ড বলক ওঠা পানিতে বসিয়ে ওপরে কেকের বাটি বসিয়ে প্যান ঢেকে দিন।
 
প্যানের ঢাকনায় থাকা ছিদ্র বন্ধ করে দেবেন। মাঝারি আঁচে ৪০ মিনিট রেখে দিন। কেক হয়ে গেলে নামিয়ে ঠাণ্ডা করে বাটি থেকে বের করে নিন।  ,লেখক: স্বর্ণালি সাঈদ, গৃহিণী।,"
৫ খাবারে পাবেন ভিটামিন কে,"শরীর সুস্থ রাখতে প্রয়োজন ভিটামিনসমৃদ্ধ পুষ্টিকর খাবার। তেমনি একটি ভিটামিন হচ্ছে ভিটামিন কে। ,এই ভিটামিন শরীরের জন্য অত্যন্ত উপকারী। শরীরে রক্ত সঞ্চালন বৃদ্ধি,  হাড় ও হৃদযন্ত্র ভালো রাখতে এ ভিটামিন জরুরি।,এ ভিটামিন অস্টিওপোরোসিস থেকে বাঁচায়, রক্তজমাট বাঁধতে দেয়, হার্ট ভালো রাখে, পিরিয়ডে অতিরিক্ত রক্তক্ষরণে বাধা দেয়, ক্যান্সার প্রতিরোধ করে এবং বুদ্ধির বিকাশ ঘটায় ও রোগ প্রতিরোধ ক্ষমতা বাড়ায়। ,যে ৫ খাবারে পাবেন ভিটামিন কে,৫ খাবারে রয়েছে প্রচুর পরিমাণে ভিটামিন কে। আসুন জেনে নিই এই ৫ খাবার সম্পর্কে-,১. শীতকালীন সবজি হিসেবে পরিচিত শালগম। আধাকাপ সিদ্ধ শালগমে ৪২৬ মাইক্রোগ্রাম ভিটামিন কে পাওয়া যায়। এই সবজি কোলস্টেরল দূর করে, রোগ প্রতিরোধ ক্ষমতা বাড়ায়, রক্তস্বল্পতা দূর করে, ক্যান্সার প্রতিরোধ করে এবং কোষ্ঠকাঠিন্য দূর করে ও রক্তকণিকা বাড়ায়। ,২. ব্রোকলি খু্বই পরিচিত একটি সবজি। আধাকাপ সিদ্ধ ব্রোকলি থেকে ১১০ মাইক্রোগ্রাম ভিটামিন কে পেতে পারেন। ব্রোকলিতে আয়রনের পরিমাণ অনেক বেশি থাকে। ভিটামিন ‘এ’র একটি ভালো উৎস। ,৩. গাজরে পাবেন ভিটামিন কে। ৬ আউন্স গাজরের রসে ২৮ মাইক্রোগ্রাম ভিটামিন কে থাকে। গবেষকরা বলেন, প্রতিদিন সকালে এক গ্লাস গাজরের রস খেলে রোগ প্রতিরোধ ক্ষমতা বাড়ে। ,৪. বেদানায় রয়েছে প্রচুর পরিমাণে ভিটামিন কে। আরও রয়েছে প্রচুর পরিমাণে আয়রন, পটাশিয়াম, যা হিমোগ্লোবিনের পরিমাণ বাড়ায়। এ ছাড়া অ্যান্টিঅক্সিডেন্টসহ ভিটামিন এ, সি, ই প্রভৃতি পুষ্টি উপাদান রয়েছে ,৫. কচি পালংশাক ভিটামিন কের ভালো উৎস, যা শরীরে রোগ প্রতিরোধ ক্ষমতা বাড়ায়। পালংশাকে প্রচুর ভিটামিন ‘সি’ এবং বিটা ক্যারোটিন, যা  কোলনের কোষগুলোকে রক্ষা করে। ,
তথ্যসূত্র: এনডিটিভি,"
এই সময়ে কুসুম গরম পানি পানের যত উপকার  ,"মহামারী করোনাভাইরাসে প্রতিদিন অনেক মানুষ আক্রান্ত হচ্ছেন ও মারা যাচ্ছেন। তার ওপরে এখন শীত প্রায় চলেই এসেছে। এ সময়ে ঠাণ্ডা-কাশি থেকে সুরক্ষিত থাকতে কুসুম গরম পানি পান করতে পারেন। ,ঢামেক টেলিমেডিসিন বিভাগের কো-অর্ডিনেটর সহযোগী অধ্যাপক ডা. মোহাম্মদ জায়েদ হোসেন যুগান্তরকে বলেন, শরীরের ৭০ শতাংশ-ই পানি। সুস্থ থাকতে প্রতিদিন অন্তত দুই লিটার পানি পান করা উচিত।,এ ছাড়া শরীরের আর্দ্রতা বজায় রাখা, শরীরকে সচল রাখা, ত্বক ও চুলকে ঠিক রাখা, কিডনির যত্ন, কোলেস্টেরলের মাত্রা নিয়ন্ত্রণ করের পানির বিকল্প নেই।  
ঠাণ্ডা পানি পান না করে উষ্ণ পানি পান করলে উপকার পাবেন। 
আসুন জেনে নিই কুসুম গরম পানি পানের উপকারিতা-,১. কুসুম গরম পানি পানে হজম ক্ষমতা বাড়ে, রক্ত চলাচলকে উন্নত হয়, ওজন হ্রাস এবং রোগ প্রতিরোধ ক্ষমতা বাড়ে। ,২. কুসুম গরম পানি পানে শরীর থেকে সব ধরনের ক্ষতিকারক টক্সিন দূর করে। গরম পানি পান করলে তা ঘাম ও মূত্রের মধ্য দিয়ে শরীরের টক্সিন দূর করে শরীরকে সুস্থ রাখে।,৩. কোষ্ঠকাঠিন্যের সমস্যায় পান করতে পারেন কুসুম গরম পানি। কোষ্ঠকাঠিন্যের সমস্যা হলে রাতে ঘুমানোর আগে ও সকালে ঘুম থেকে উঠে খালি পেটে এক গ্লাস করে কুসুম গরম পানি পান করুন। এতে অন্ত্রের মধ্য দিয়ে যাওয়ার সময় অন্ত্রকে সংকুচিত করে বর্জ্য পদার্থ দূর করতে সহায়তা করে।,
৪. কুসুম গরম পানি পান করলে রক্ত সঞ্চালন ভালো হয়, প্রতিটি স্নায়ুকে সচল হয় ও শরীরের বিভিন্ন ব্যথা দূর হয়। ,৫. মাথার যন্ত্রণা, গিঁটে গিঁটে ব্যথা, নারীর ঋতুচক্রের ব্যথায় পান করতে পারেন কুসুম গরম পানি। ,৬. সর্দি-কাশি, নাক বন্ধ হয়ে যাওয়া, বুকে কফ জমা ও খুসখুসে কাশির সমস্যায় পান করতে পারে কুসুম গরম পানি।  ,৭. কুসুম গরম পানি পানে ত্বক আর্দ্র থাকে, বার্ধক্যের ছাপ কমায় ও স্কাল্পকে হাইড্রেটেড রেখে খুশকি থেকে দূরে রাখে।,
 ,"
মায়ের প্রথম দুধ পানে শিশুর যত উপকার ,"নবজাতকের জন্মের পর তাকে মায়ের শালদুধ পান করানো খুব জরুরি। নবজাতককে নিরাপদ ও রোগমুক্ত রাখতে এই দুধ অবশ্যই পান করাতে হবে। ,সন্তান জন্মের ছয় মাস পর্যন্ত শিশুকে মায়ের বুকের দুধ ছাড়া অন্য কোনো খাবার দেয়ার প্রয়োজন নেই। এ সময় মায়ের দুধ শিশুর জন্য যথেষ্ঠ। তবে ছয় মাস পর থেকে শিশুকে বাড়তি খাবার দিতে হবে।  ,শালদুধ কি?,প্রসবের ঠিক পরেই মেয়েদের স্তন বৃন্ত থেকে এক প্রকার হলদেটে ঘন দুধ নিঃসৃত হয়, যা শালদুধ বা কোলোস্ট্রাম নামে পরিচিত। প্রসবের পর মোট দুই থেকে তিন দিন পর্যন্ত এই দুধ নিঃসৃত হয়। ,এটি মায়েদের স্বাভাবিক বুকের দুধের চেয়ে অনেকটাই ঘন হয়। এই দুধ পান করা সদ্যজাতের জন্য খুবই উপকারী। ,শালদুধের স্বাস্থ্য উপকারিতা,১. শালদুধে ফ্যাট ও শর্করার চেয়ে প্রোটিনের পরিমাণ বেশি। এ ছাড়া গ্লাইকোপ্রোটিন, ইমিউনোগ্লোবিউলিন, ল্যাক্টোফেরিন, ল্যাক্টো অ্যালবুমিন, ভিটামিন-এ, ভিটামিন-কেসহ বিভিন্ন রোগ প্রতিরোধক এবং সন্তান বিকাশে সহায়ক উপাদান থাকে।,২. মায়ের দুধে থাকা ল্যাক্টো অ্যালবুমিন টিউমার ও ক্যান্সার প্রতিরোধে সাহায্য করে। এ ছাড়া কোলোস্ট্রামে থাকা সাইটোকাইনস টিউমার গঠনে বাধা সৃষ্টি করে।,৩. শালদুধে রয়েছে প্রোটিন সাইটোকাইনস, যা শিশুর শরীরে দেহের কোষ ও বুদ্ধির বিকাশে সহায়ক। ,৪.  এই দুধ পানে শিশুর শরীরের রোগ প্রতিরোধ ক্ষমতা বাড়ে। এ ছাড়া মায়ের বুকের দুধ বিভিন্ন সংক্রমণ, অ্যালার্জির বিরুদ্ধে লড়াই করতে শিশুর রোগ প্রতিরোধ ব্যবস্থাকে আরও শক্তিশালী করে। ,৫. শিশুর শরীর, ত্বক, পেশি, হাড়, কার্টিলেজ, স্নায়ু পেশি গঠনে গুরুত্বপূর্ণ ভূমিকা পালন করে এই দুধ। দেহের সার্বিক গঠনেও সহায়তা করে কোলোস্ট্রাম।,৬. এই দুধ শিশুকে ভাইরাসের সংক্রমণ থেকে রক্ষা করে। বিশ্ব স্বাস্থ্য সংস্থা, ইউনিসেফ এবং ওয়ার্ল্ড অ্যালায়েন্স ফর ব্রেস্ট ফিডিং অ্যাকশন জন্মের এক ঘণ্টার মধ্যে শিশুকে মায়ের দুধ খাওয়ানোর কথা বলেছে। ,৭. হৃদরোগের ঝুঁকি হ্রাস করে মায়ের দুধ। যেসব শিশুকে টানা ছয় মাস মায়ের দুধ পান করানো হয়, তাদের হৃদরোগে আক্রান্ত হওয়ার ঝুঁকি অনেক কমে যায়। ,লেখক:
ডা. বেদৌরা শারমিন,
গাইনি কনসালট্যান্ট
সেন্ট্রাল হাসপাতাল লিমিটেড।,"
মাশরুম পেপার ফ্রাই রেসিপি,"মাশরুম খুবই উপকারী একটি খাবার। মাশরুম দিয়ে তৈরি করতে পারেন মজাদার মাশরুম পেপার ফ্রাই। ,আসুন জেনে নিই কীভাবে তৈরি করবেন এই খাবার-,উপকরণ ,১ চামচ গোলমরিচ হাফ চামচ, শুকনো ধনে বীজ হাফ চামচ, মৌরি হাফ চামচ জিরা, ৩০০ গ্রাম মাশরুম, ২ চামচ ঘি বা মাখন, ২টি শুকনো লাল মরিচ, ১০টা কারিপাতা, ১ চামচ সরিষা, আদা কুচি পরিমাণমতো, ১টি পেঁয়াজ কুচি, হাফ ক্যাপসিকাম ও স্বাদমতো লবণ।,প্রণালি,প্রথমে সব শুকনো মসলার মিশ্রণ তৈরি করতে হবে। গোলমরিচ, জিরা, মৌরি এবং শুকনো ধনে দিয়ে ভালোভাবে পিষে নিন। ভুলেও পানি দেবেন না । মসলাটি তৈরি করে আলাদা রাখুন। ,এবার প্যানে দুই চামচ ঘি গরম করে নিন। এতে শুকনো লাল মরিচ, ১ চামচ সরিষার বীজ ও কারিপাতা দিন।
এর পর একটু নেড়ে আদা ও পেঁয়াজ কুচি দিন। পেঁয়াজ হালকা বাদামি হয়ে এলে এতে মাশরুম দিন এবং আঁচ একটু বাড়িয়ে রান্না করুন। ভালোভাবে ভেজে নিন। 
এবার এতে কেটে রাখা ক্যাপসিকাম দিন এবং দুই-তিন মিনিট রান্না করুন। এর পর এতে পিষে রাখা মসলা দিয়ে ভালোভাবে মেশান। ব্যস তৈরি হয়ে গেল মাশরুম পেপার ফ্রাই।, ,তথ্যসূত্র: বোল্ডস্কাই,"
