Blog Titles,Blog Content
স্বাস্থ্য মন্ত্রণালয়ে নিয়োগ,"স্বাস্থ্য ও পরিবার কল্যাণ মন্ত্রণালয় ৬টি পদে ৬৫ জনকে নিয়োগের বিজ্ঞপ্তি প্রকাশ করেছে।
 
পদগুলো হলো¬– সিনিয়র ইনস্ট্রাক্টর (শিশু স্বাস্থ্য) ১ জন, সিনিয়র ইনস্ট্রাক্টর (ডেভেলপমেন্টাল থেরাপি) ১ জন, ট্রেনিং কো-অর্ডিনেটর ১ জন, শিশু স্বাস্থ্য চিকিৎসক ২১, শিশু মনোবিজ্ঞানী ২০ জন ও ডেভেলপমেন্টাল থেরাপিস্ট পদে ২১ জন নিয়োগে এ বিজ্ঞপ্তি প্রকাশ করা হয়েছে। ,বিজ্ঞপ্তি অনুসারে পদগুলোয় যোগ্যতা পূরণ সাপেক্ষে যোগ দিতে পারবেন যে কেউ। অনলাইনে পদগুলোর জন্য আবেদন শুরু হবে ১২ অক্টোবর থেকে। আবেদন করা যাবে ১২ নভেম্বর পর্যন্ত।,আবেদনের যোগ্যতা,প্রতিটি পদে আবেদনের জন্য যোগ্যতা, অভিজ্ঞতা এবং বয়সসীমা আলাদা আলাদা। পদভেদে আবেদনের যোগ্যতা, অভিজ্ঞতা ও বয়সসীমার শর্তাবলি জানা যাবে বিজ্ঞপ্তিতে।,আবেদনের বয়স,সিনিয়র ইনস্ট্রাক্টর (শিশু স্বাস্থ্য) পদে আবেদনের বয়স ৩৭ বছর, সিনিয়র ইনস্ট্রাক্টর (ডেভেলপমেন্টাল থেরাপি) ৩৭ বছর, ট্রেনিং কো-অর্ডিনেটর ৩০ বছর, শিশু স্বাস্থ্য চিকিৎসক ৩২ বছর, শিশু মনোবিজ্ঞানী ৩০ বছর ও ডেভেলপমেন্টাল থেরাপিস্ট পদের জন্য আবেদনের বয়স ৩০ বছর হতে হবে। প্রার্থীর বয়স ১-১০-২০২০ তারিখে নির্ধারিত সীমার মধ্য হতে হবে।,বিবরণ,সিনিয়র ইন্সট্রাক্টর (শিশু স্বাস্থ্য) পদের শিক্ষাগত যোগ্যতা এমবিবিএস, শিশু স্বাস্থ্য বিষয়ে ডিসিএইচ/এমডি/এফসিপিএস ও সংশ্লিষ্ট কাজে ৫ বছরের অভিজ্ঞতা থাকতে হবে। এ পদের জন্য বেতন ৫৬,৫২৫ টাকা।,সিনিয়র ইন্সট্রাক্টর (ডেভেলপমেন্টাল থেরাপি) পদের শিক্ষাগত যোগ্যতা ফিজিও থেরাপি/অকুপেশনাল থেরাপি/স্পিচ থেরাপি বিষয়ে স্নাতক/সমমানের ডিগ্রিসহ স্নাতকোত্তর ডিগ্রি ও সংশ্লিষ্ট কাজে সাত বছরের পেশাগত অভিজ্ঞতা থাকতে হবে।
বয়স: ৩৭ বছর।,বেতন: ৫৬,৫২৫ টাকা।,পদের নাম: ট্রেনিং কো-অর্ডিনেটর,পদ সংখ্যা: ০১ টি।,শিক্ষাগত যোগ্যতা: স্নাতক সম্মানসহ স্নাতকোত্তর/সমমানের ডিগ্রি ও কম্পিউটার অফিস প্রোগ্রামসহ অন্যান্য বিষয়ে অভিজ্ঞতা থাকতে হবে।,বয়স: ৩০ বছর।,বেতন: ৩৫,৬০০ টাকা।,পদের নাম: শিশু স্বাস্থ্য চিকিৎসক,পদ সংখ্যা:                                          ২১ টি।,শিক্ষাগত যোগ্যতা: এমবিবিএস; শিশু রোগে উচ্চতর ডিগ্রিধারী ও সংশ্লিষ্ট কাজে অভিজ্ঞ প্রার্থীদের অগ্রাধিকার।,বয়স: ৩২ বছর।,বেতন: ৩২,৩০০ টাকা।,পদের নাম: শিশু মনোবিজ্ঞানী,পদ সংখ্যা: ২০টি।,শিক্ষাগত যোগ্যতা: ক্লিনিক্যাল সাইকোলজি বিষয়ে স্নাতক সম্মানসহ স্নাতকোত্তর ডিগ্রি ও সংশ্লিষ্ট কাজে ০৩ বছরের অভিজ্ঞতা থাকতে হবে।,বয়স: ৩০ বছর।,বেতন: ৩২,৩০০ টাকা।,পদের নাম: ডেভেলপমেন্টাল থেরাপিস্ট,পদ সংখ্যা: ২১টি।,শিক্ষাগত যোগ্যতা: ফিজিও থেরাপি/অকুপেশনাল থেরাপি/স্পিচ থেরাপি বিষয়ে স্নাতক/সমমানের ডিগ্রিসহ স্নাতকোত্তর ডিগ্রি ও নিউরো ডিজঅর্ডার, অটিস্টিক শিশুদের থেরাপি দেয়ার ০৩ বছরের পেশাগত অভিজ্ঞতা থাকতে হবে।
বয়স: ৩০ বছর।,বেতন: ৩২,৩০০ টাকা।,আবেদনের নিয়ম,আগ্রহী প্রার্থীরা (http://hsm.teletalk.com.bd/) ওয়েবসাইট থেকে আবেদনপত্র পূরণ করে আগামী ১২-১১-২০২০ তারিখ পর্যন্ত জমা দিতে পারবেন। www.dghs.gov.bd ও www.hospitaldghs.gov.bd-তে আবেদনের বিস্তারিত পাওয়া যাবে।,
 ,"
আজ বিশ্ব ডিম দিবস,"আজ বিশ্ব ডিম দিবস। বিশ্বের অন্যান্য দেশের মতো বাংলাদেশেও দিবসটি পালিত হচ্ছে। ডিম দিবসের এবারের প্রতিপাদ্য– ‘প্রতিদিনই ডিম খাই, রোগ-প্রতিরোধের ক্ষমতা বাড়াই’।,দিবসটি উপলক্ষে মৎস্য ও প্রাণিসম্পদ অধিদফতর (ডিএলএস), বাংলাদেশ পোলট্রি ইন্ডাস্ট্রিজ সেন্ট্রাল কাউন্সিল (বিপিআইসিসি) এবং ওয়ার্ল্ড পোলট্রি সায়েন্স অ্যাসোসিয়েশন বাংলাদেশ সারাদেশে অনলাইনের মাধ্যমে আলোচনা অনুষ্ঠানের আয়োজন করেছে।,প্রাণিজ আমিষের চাহিদা পূরণ, স্বাস্থ্যবান ও মেধাবী জাতি গঠন– সর্বোপরি ডিমের গুণাগুণ সম্পর্কে জনসচেতনতা বাড়ানোর লক্ষ্যে ১৯৯৬ সাল থেকে এ দিনটি বিশ্বজুড়ে পালিত হয়ে আসছে।,অস্ট্রিয়ার রাজধানী ভিয়েনায় অক্টোবর মাসের দ্বিতীয় শুক্রবার প্রথম বিশ্ব ডিম দিবসের আয়োজন করা হয়। ডিমের গুণাগুণ সম্পর্কে জনসচেতনতা বাড়াতে বর্তমানে বিশ্বের ৪০ দেশে পালিত হয় দিবসটি।,পুষ্টিবিদরা জানান, ডিমে রয়েছে উচ্চমাত্রার প্রোটিন। পরিবারের প্রোটিনের চাহিদা পূরণে ডিমের বিকল্প নেই। প্রতিদিনের খাদ্য তালিকায় একটি ডিম রাখা উচিত। 
বাংলাদেশ কৃষি বিশ্ববিদ্যালয়ের পোলট্রি সায়েন্স বিভাগের অধ্যাপক ড. ইলিয়াস হোসেন বলেন, প্রতিদিন একজন মানুষকে অন্তত একটি করে ডিম খাওয়া উচিত।
 ,"
মাছের ঝোল আর সবজি-মাছ,"চালকুমড়া ইলিশ,যা লাগবে: ইলিশ মাছ ৭-৮ পিস, চালকুমড়া টুকরা চার কাপ, হলুদ গুঁড়া আধা চা চামচ, মরিচ গুঁড়া দেড় চা চামচ, ধনিয়া গুঁড়া দুই চা চামচ, আদা বাটা এক চা চামচ, পেঁয়াজ কুচি তিন টেবিল চামচ, তেল আধা কাপ, লবণ স্বাদমতো, কাঁচামরিচ ৫-৬টি ও গরম পানি পরিমাণমতো।,,যেভাবে করবেন : মাছ কেটে ধুয়ে পানি ঝরিয়ে নিন। আধা চা চামচ হলুদ গুঁড়া ও স্বাদমতো লবণ দিয়ে মেখে তেলে ভেজে নিন। ,মাছ ভাজা তেলের সঙ্গে আরেকটু তেল দিয়ে গরম হলে পেঁয়াজ কুচি ভেজে সব মসলা একটু পানি দিয়ে গুলিয়ে মসলা কষিয়ে নিন। আগে থেকে কেটে ধুয়ে রাখা চালকুমড়া মসলায় দিন। ,আধা কাপ পানি দিয়ে কষিয়ে নিন। চালকুমড়া কষানো হলে ডুবিয়ে গরম পানি দিন। চালকুমড়া সিদ্ধ হলে মাছ দিন। কাঁচামরিচ দিন। ঝোল থাকতে নামিয়ে নিন।,ট্যাংরা মাছের ঝোল,যা লাগবে : ট্যাংরা মাছ ৫০০ গ্রাম, পেঁয়াজ কুচি আধা কাপ, হলুদ গুঁড়া এক চা চামচ, মরিচ গুঁড়া এক চামচ, ধনিয়া গুঁড়া এক চা চামচ, জিরা গুঁড়া এক চা চামচ, আদা-রসুন বাটা এক চা চামচ, ধনিয়াপাতা কুচি দুই টেবিল চামচ, কাঁচামরিচ ফালি ৪-৫টি, তেল তিন টেবিল চামচ ও লবণ স্বাদমতো।,,যেভাবে করবেন : মাছ কেটে ধুয়ে পানি ঝরিয়ে নিন। কড়াইতে তেল দিয়ে গরম হলে পেঁয়াজ কুচি দিন। পেঁয়াজ নরম হলে সব গুঁড়া ও বাটা মসলা আধা কাপ পানিতে গুলে দিন। ,মসলা কষানো হলে মাছ দিয়ে কষিয়ে নিন। মাছ কষানোর সময় লবণ দিন। মাছ কষানো হলে মাছ ডুবিয়ে গরম পানি দিন। ভালোমতো জ্বাল করে কাঁচামরিচ ফালি ও ধনিয়াপাতা কুচি দিয়ে নামিয়ে নিন। গরম গরম পরিবেশন করুন গরম ভাতের সঙ্গে।,পুঁইঝিঙ্গা ইলিশ মিলমিশ,যা লাগবে : ঝিঙ্গা ৫০০ গ্রাম (লম্বা করে কাটা), পুঁইশাক (কাটা-বাছা) ৩০০ গ্রাম, ইলিশ মাছ লেজ-মাথাসহ ৫-৬ টুকরা, পেঁয়াজ কুচি তিন টেবিল চামচ, হলুদ গুঁড়া এক চা চামচ, মরিচ গুঁড়া আধা চা চামচ, কাঁচামরিচ ফালি ৭-৮টি, লবণ স্বাদমতো ও তেল দুই টেবিল চামচ।,,যেভাবে করবেন : কড়াইতে তেল দিয়ে পেঁয়াজ কুচি দিন। পেঁয়াজ কুচি নরম হলে হলুদ-মরিচ-ধনিয়া গুঁড়া এক কাপের চার ভাগের এক ভাগ পানিতে গুলে দিন। মসলা কষানো হলে মাছ দিয়ে কষান। ,প্রয়োজনে একটু পানি দিন। মাছ কষানো হলে তুলে রাখুন। মাছ কষানো মসলায় ঝিঙ্গা দিন। ঝিঙ্গা একটু নরম হলে শাক দিন। আধা কাপ গরম পানি দিন। ঝিঙ্গা ও পুঁইশাক মজে এলে কষানো ইলিশ মাছ দিয়ে বলক তুলে নামিয়ে নিন।,বেলে মাছ আমড়ার দোপেঁয়াজা,যা লাগবে : বেলে মাছ ৫০০ গ্রাম, আমড়া টুকরা এক কাপ, পেঁয়াজ কুচি এক কাপ, টমেটো টুকরা এক কাপ, আদা বাটা দুই চা চামচ, রসুন বাটা আধা চা চামচ, হলুদ গুঁড়া এক চা চামচ, মরিচ গুঁড়া দুই চা চামচ (রুচি অনুযায়ী), ধনিয়া গুঁড়া এক টেবিল চামচ, ভাজা জিরা গুঁড়া এক চা চামচ, আস্ত কাঁচামরিচ ৭-৮টি, ধনিয়াপাতা কুচি আধা কাপ, লবণ স্বাদমতো, তেল আধা কাপ ও গরম পানি এক কাপ।,,যেভাবে করবেন: আমড়ায় লবণ মেখে এক ঘণ্টা রেখে ধুয়ে নিন। বেলে মাছ টুকরা করে কেটে ধুয়ে পানি ঝরিয়ে দিন। এবার লবণ ও সামান্য হলুদ-মরিচের গুঁড়া দিয়ে মেখে রাখুন। ,কড়াইতে তেল দিয়ে গরম হলে মাছ হালকা ভেজে তুলে নিন। মাছ ভাজা তেলের সঙ্গে অবশিষ্ট তেল দিয়ে গরম হলে পেঁয়াজ কুচি দিন। পেঁয়াজ নরম হলে আদা-রসুন বাটা দিয়ে কষিয়ে নিন। ,কষানো মসলায় আমড়া যোগ করে ৫ মিনিট ভেজে টমেটো টুকরা, হলুদ, মরিচ, ধনিয়া গুঁড়া ও লবণ দিয়ে আরও ৫ মিনিট কষান। ,এবার গরম পানি দিয়ে ঢেকে দিন। মাঝারি আঁচে রান্না করুন। ঝোল ফুটে উঠলে মাছ দিন। কাঁচামরিচ ও জিরা গুঁড়া দিন। মাখামাখা হলে ধনিয়াপাতা দিয়ে নামিয়ে নিন।,
রেসিপি দিয়েছেন- জিনাত রায়হান সুমি, আলোকচিত্রী মনির আহমেদ,"
