Blog Titles,Blog Content
করোনার চিকিৎসায় টিকাই শেষ ভরসা: বিশ্ব স্বাস্থ্য সংস্থা,"করোনাভাইরাস মোকাবেলায় টিকাই শেষ ভরসা বলে জানিয়েছেন বিশ্ব স্বাস্থ্য সংস্থা (ডব্লিউএইচও)।,সংস্থাটি বলছে, রোগটি সোয়াইন ফ্লুর চেয়ে ১০ গুণ শক্তিশালী। এই ভাইরাস অতিদ্রুত ছড়ালেও এর শক্তিক্ষয় হয় খুব ধীরে। ,সংস্থার প্রধান টেড্রস অ্যাডানম গেব্রিয়েসাস জানায়, প্রতিষেধক তথা টিকা ছাড়া নভেল করোনাভাইরাসকে পুরোপুরি রোখা যাবে না,কিন্তু কোথায় সেই প্রতিষেধক? আমেরিকা সম্ভাব্য প্রতিষেধক তৈরি করে সবে মানুষের ওপরে পরীক্ষা শুরু করেছে। দীর্ঘ পরীক্ষার পর্ব সফল হলে একে বাজারে আনতে দেড় বছর সময় লাগবে। ,সোমবার ডব্লিউএইচওর প্রধান বলেন, ‘প্রতি মুহূর্তে আমরা এই ভাইরাস সম্পর্কে নতুন কিছু শিখছি।’,চীনে করোনা সংক্রমণ ছড়ানোর পর বিশ্বকে ঠিকমতো সজাগ করতে তারা ব্যর্থ হয়েছে। মার্কিন প্রেসিডেন্ট ডোনাল্ড ট্রাম্প তো ক্ষিপ্ত হয়ে হুকে অর্থসাহায্য বন্ধেরও হুমকি দিয়েছেন। ,তবু এই সংস্থার প্রধান টেড্রস বলেন, আমেরিকা অর্থসাহায্য বন্ধ করবে না বলেই তার আশা। গত বছরও হুর বাজেটের ১৫ শতাংশ জুগিয়েছিল আমেরিকা।,তথ্যসূত্র: আনন্দবাজার পত্রিকা, ,"
যে কারণে করোনার সংক্রমণ সবার দেহে সমান প্রভাব ফেলে না,"সারাবিশ্বে প্রতিনিয়ত করোনাভাইরাসে সংক্রমিত হচ্ছেন হাজারও মানুষ। তবে এই ভাইরাস সবার দেহে সমান প্রভাব ফেলে না বলে জানিয়েছেন বিশেষজ্ঞ চিকিৎসকরা। ,যদিও আগে থেকেই চিকিৎসকরা বলে আসছেন, যাদের অন্য কোনো রোগ রয়েছে, তাদের এই ভাইরাসে মৃত্যুঝুঁকি বেশি। কিন্তু পরে দেখা গেছে, এমন মানুষ এই ভাইরাসে সংকটাপন্ন অবস্থায় পড়েছেন যাদের আগে থেকে কোনো স্বাস্থ্য সমস্যা ছিল না।,আবার যাদের দেহে করোনার সংক্রমণের কোনো লক্ষণই দেখা যায়নি, তাদের অনেকেরই শরীরে করোনা পাওয়া গেছে। ,অনেকের ক্ষেত্রে করোনাভাইরাস সংক্রমণের প্রতিক্রিয়া হয় মৃদু থেকে মাঝারি। আর প্রতি পাঁচজনের মধ্যে একজনের বেলায় দেখা দেয় গুরুতর অসুস্থতা এবং আক্রান্তদের আধা থেকে এক-শতাংশের মৃত্যু হয়ে থাকে।,এখন প্রশ্ন হলো– এর কারণ কী? কোথায় লুকানো আছে এর রহস্য?,এই রহস্য খুঁজে বের করতে লাখো মানুষের ডিএনএর ভাণ্ডার ব্যবহার করছেন বিজ্ঞানীরা। এর নাম ইউকে বায়োব্যাংক। যাতে ৫ লাখ স্বেচ্ছাসেবকের রক্ত, থুতু ও প্রস্রাবের নমুনা এবং স্বাস্থ্য সম্পর্কিত এক দশকব্যাপী সময়ের তথ্য সংরক্ষিত আছে। এতে এখন যোগ হচ্ছে কোভিড-১৯ সংক্রান্ত উপাত্ত।,এসব তথ্য আগে ক্যান্সার, স্ট্রোক বা স্মৃতিভ্রংশ সম্পর্কে জানার জন্য ব্যবহৃত হয়েছে। এবার তাতে যোগ হচ্ছে করোনাভাইরাস পজিটিভ টেস্ট সম্পর্কিত তথ্য এবং হাসপাতাল ও স্থানীয় ডাক্তারের দেয়া উপাত্ত।,এই তথ্যভাণ্ডারে ঢুকতে পারেন পৃথিবীর নানা দেশের ১৫ হাজারেরও বেশি বিজ্ঞানী।,এ প্রকল্পের প্রধান তদন্তকারী অধ্যাপক রোরি কলিনস বলছেন, ‘আমরা হয়তো খুব দ্রুত কিছু অত্যন্ত গুরুত্বপূর্ণ আবিষ্কার করে ফেলতে পারি’। 
তিনি বলেন, ‘এটি হতে পারে গবেষকদের জন্য এক স্বর্ণখনি।’,অধ্যাপক কলিনস বলছেন, করোনা সংক্রমিতদের মধ্যে পার্থক্যগুলো কী? তা জানার জন্য ইউকে বায়োব্যাংকের উপাত্ত পরীক্ষা করছি। তাদের জিনগত গঠনে কী পার্থক্য আছে? এ পার্থক্যের সঙ্গে কি তাদের রোগ প্রতিরোধী বা ইমিউনিটি ক্ষমতার সম্পর্ক আছে? তাদের পূর্ববর্তী স্বাস্থ্যগত অবস্থার মধ্যে কী কোনো ভিন্নতা আছে?,গবেষকরা একেকজনের পুরো জিনোমটাই তন্ন তন্ন করে পরীক্ষা করবেন– দেখবেন ডিএনএর মধ্যে কোথায় কোথায় অতিক্ষুদ্র সব পার্থক্য আছে।
বিশেষ করে তারা পরীক্ষা করে দেখবেন, এসিই-টু নামে একটি জিনকে. যা এক ধরনের রিসেপটর তৈরিতে সহায়তা করে। যার মাধ্যমে করোনাভাইরাস শ্বাসতন্ত্রে ঢুকে সেখানকার কোষগুলোকে সংক্রমিত করতে পারে।,যুক্তরাষ্ট্রের নিউইয়র্কের রকেফেলার বিশ্ববিদ্যালয়ের অধ্যাপক জঁ-লরেন্ট কাসানোভার নেতৃত্বে আরেকটি দল্ও এমন এক গবেষণা করছে।,অধ্যাপক কাসানোভা বলছেন, অতীত গবেষণায় দেখা গেছে– ‘কিছু লোকের ক্ষেত্রে যাদের ইমিউনিটির জন্মগত কোনো ত্রুটি আছে, তাদের ফ্ল বা হারপিসের মতো কিছু রোগ হলে তা গুরুতর চেহারা নিতে পারে। এমন হতে পারে যে এই জন্মগত ত্রুটি দশকের পর দশক দেহে সুপ্ত থাকতে পারে। যতদিন পর্যন্ত না তিনি ওই বিশেষ মাইক্রোবে সংক্রমিত হন, ততদিন এটি কেউ জানতেই পারে না।’,তিনি বলেন, ‘আমাদের কর্মসূচিতে এটিই দেখা হবে যে কোভিডের ক্ষেত্রে এমন কিছু ঘটে কিনা।’,তথ্যসূত্র: বিবিসি বাংলা,"
করোনার চিকিৎসায় যক্ষ্মার টিকা কতটা কার্যকর,"করোনাভাইরাসের স্বীকৃত চিকিৎসা পদ্ধতি আবিষ্কারের ঘোষণা বিশ্ব স্বাস্থ্য সংস্থার পক্ষ থেকে এখনও দেয়া হয়নি। আক্রান্ত ব্যক্তিদের নিয়ে নানা পরীক্ষা-নিরীক্ষা হচ্ছে। ,ম্যালেরিয়া-যক্ষ্মার টিকার নমুনা ব্যবহার করা হচ্ছে করোনা চিকিৎসায়। যক্ষ্মার টিকা অর্থাৎ বিসিজি টিকা করোনাভাইরাস দমিয়ে রাখতে কিছুটা হলেও কার্যকর বলে দাবি করেছেন নিউইয়র্ক ইনস্টিটিউট অব টেকনোলজির বায়োমেডিকেল সায়েন্সের গবেষকরা। ,এই গবেষণার নেতৃত্বে রয়েছেন সহকারী অধ্যাপক গঞ্জালু ওটাজু। তার দাবি, যারা যক্ষ্মার টিকা নিয়েছেন, তারা করোনায় আক্রান্ত হলে শ্বাসনালি ও ফুসফুস তুলনামূলকভাবে কম ক্ষতিগ্রস্ত হয়। আর যেসব দেশে বিসিজির টিকা দেয়া হয় না, সেখানে রোগ মারাত্মক আকার নেয় ও মৃত্যুহারও তুলনামূলকভাবে অনেক বেশি।,ইতালি, আমেরিকা, ইংল্যান্ড ও নেদারল্যান্ডস করোনাভাইরাসের সংক্রমণ এবং মৃত্যুর হার অনেক বেশি। তবে ভারত, নেপাল, শ্রীলংকা, কম্বোডিয়া, থাইল্যান্ড, ভিয়েতনাম ও জাপানে জানুয়ারি মাসে রোগের প্রকোপ শুরু হলেও এখনও খুব বেশি প্রভাব বিস্তার করতে পারেনি। 
বিজ্ঞানীদের দাবি, বিসিজি টিকা দেয়া থাকলে শ্বাসনালি ও ফুসফুস কিছুটা বাড়তি সুরক্ষা পায়।,বিশ্ব স্বাস্থ্য সংস্থার (ডব্লিউএইচও) ডিরেক্টর জেনারেল মেডিকেল জার্নাল পাব মেডকে জানিয়েছেন, এখনও পর্যন্ত এই ভাইরাসের গতিপ্রকৃতি দেখে অনুমান করা হচ্ছে, যক্ষ্মার জীবাণু ছাড়াও অন্যান্য শ্বাসনালির সংক্রমণকে কিছুটা প্রতিরোধ করতে পারে। ,তিনি আরও বলেন, যদিও করোনাভাইরাস ঘন ঘন চরিত্র বদল করতে পারে। কিন্তু এখনও পর্যন্ত দেখা যাচ্ছে, যেসব দেশে বিসিজি টিকা দেয়া বাধ্যতামূলক, সেসব দেশে এর আক্রমণের হার কম। 
 ,সম্প্রতি ‘জনস হপকিন্স ব্লুমবার্গ স্কুল অব পাবলিক হেলথ এক্সপার্ট কমিটি’র পক্ষ থেকে জানানো হয়েছে, তারা গবেষণা করে জানার চেষ্টা করছেন যে, বিসিজি টিকা নেয়া হলে ইনেট ইমিউনিটি অর্থাৎ  শরীরের নিজস্ব রোগ প্রতিরোধ ব্যবস্থা আদৌ বাড়ে কিনা। ইতিমধ্যে অস্ট্রেলিয়ায় ৪ হাজার স্বাস্থ্যকর্মীকে বিসিজির টিকা দেয়া হয়েছে।,বিসিজি নেয়া দেশ হিসেবে সত্যিই কি আমাদের দেশে  করোনাভাইরাস সেভাবে ছড়িয়ে পড়তে পারবে না? ইন্ডিয়ান অ্যাকাডেমি অব পেডিয়াট্রিক্সে’-এর সদস্য শিশু রোগ বিশেষজ্ঞ পল্লব চট্টোপাধ্যায় বলেন, এই ভাইরাসের চরিত্র সম্পর্কে এখনও অনেক কিছু জানা যায়নি। এখনও পর্যন্ত এই ভাইরাসের সংক্রমণ বয়স্কদের ক্ষেত্রে মারাত্মক। বিশেষ করে যারা আগে থেকেই অন্য কোনো রোগে ভুগছেন। ,তিনি বলেন, সামান্য অসুখ-বিসুখের জন্য টেলিফোনে চিকিৎসকের পরামর্শ নিন। একই সঙ্গে সাবান দিয়ে হাত ধোয়া, মুখে-নাকে হাত না দেয়ার মতো অভ্যাস গড়ে তুলুন। ,তথ্যসূত্র: আনন্দবাজার পত্রিকা,"
করোনা প্রতিরোধে নয়া এই পদ্ধতি কতটা কার্যকর?,"করোনাভাইরাস প্রতিরোধে ইতিমধ্যে চীন, ইংল্যান্ড এমনকি যুক্তরাষ্ট্রেও ‘ব্লাড ট্রান্সফিউশন’ পদ্ধতির প্রয়োগ চলছে। এটি অনেকাংশেই সাফল্য এনে দিয়েছে বলে দাবি চিকিৎসকদের। ,বিংশ শতাব্দীর গোড়ার দিকে যখন স্প্যানিশ ফ্লু হয়, তখন থেকে মহামারীর সময়ে রক্ত ট্রান্সফিউশনের পদ্ধতি প্রচলিত। ভারতেও স্প্যানিস ফ্লু থেকে শুরু করে টিটেনাস এমনকি বিড়াল-কুকুরে মারাত্মকভাবে কামড়ালেও এভাবে চিকিৎসা করা হয়ে থাকে। ,কী এই পদ্ধতি?
 ,কোনো রোগে কেউ আক্রান্ত হয়ে সুস্থ হয়ে উঠলে তার শরীরে সেই রোগের সঙ্গে যুদ্ধ করার জন্য প্রয়োজনীয় অ্যান্টিবডি তৈরি হয়ে যায়। তাই ভাইরাসে সংক্রমিত হওয়ার পর সেরে ওঠা কোনো ব্যক্তির রক্তের প্লাজমা প্রথমে সংগ্রহ করা হয়। সেই প্লাজমা থেকে নানা প্রক্রিয়ায় সেরাম আলাদা করা হয়। ওই সেরামেই অ্যান্টিবডি থাকে।,তা থেকে নানা রকম ভ্যাকসিন তৈরি করা হয়। সেই ভ্যাকসিন দেয়া হয় অসুস্থ মানুষের শরীরে। তখন সেই বাইরে থেকে প্রবেশ করানো অ্যান্টিবডির সাহায্যে আক্রান্ত লড়তে পারেন ভাইরাসের সঙ্গে। এ পদ্ধতিতেই করোনা আক্রান্তদের সারিয়ে তোলার পথে নামতে চাইছেন বিশেষজ্ঞরা। ,
ভারতের বিখ্যাত জনস্বাস্থ্য বিশেষজ্ঞ সুবর্ণ গোস্বামীর মতে, শরীরে যখন কোনো ভাইরাস আক্রান্ত করে, তখন রক্তের প্লাজমায় কিছু অ্যান্টিবডি তৈরি হয়। ওই অ্যান্টিবডিগুলোই ‘ফরেন বডি’ বা ভাইরাসটির সঙ্গে লড়তে সাহায্য করে। ,
তিনি বলেন, স্প্যানিশ ফ্লু থেকে শুরু করে টিটেনাস এমনকি মারাত্মকভাবে বিড়াল-কুকুরে কামড়ালেও এভাবে চিকিৎসা করা হতো। তবে করোনার বেলায় এখনও এ দেশে এই পদ্ধতি অবলম্বন করা হয়নি। হলে ফল ভালো হবে বলেই আশা করা যাচ্ছে।,
বিশেষজ্ঞদের মতে, কোভিড-১৯ থেকে সেরে ওঠার পর রক্ত দিলে কোনো সমস্যা হয় না।  ,এক ইউনিট রক্ত গড়ে ৫২৫ মিলি থেকে ২০০-২৫০ মিলি প্লাজমা পাওয়া যায়। একজন করোনাভাইরাস থেকে সেরে ওঠা মানুষের এক ইউনিট রক্ত থেকে দুই ইউনিট প্লাজমা পাওয়া যায়। এক ইউনিট প্লাজমায় সেরে উঠতে পারেন ২ জন করোনা আক্রান্ত রোগী।  ,তথ্যসূত্র: আনন্দবাজার পত্রিকা,"
করোনায় জরুরি সেবা পেতে যেসব নম্বরে ফোন করবেন,"মহামারী করোনাভাইরাসে নাকাল দেশবাসী। রোজ শয়ে শয়ে মানুষ আক্রান্ত হচ্ছেন। মৃত্যুর মিছিল দীর্ঘ হচ্ছে। এমতাবস্থায় সবার মধ্যে করোনাভীতি কাজ করছে। ,সর্দি-কাশি ও জ্বরে চিকিৎসকের পরামর্শটা এ মুহূর্তে জরুরি। এ কারণে জরুরি সাহায্য পেতে ফোন করতে পারেন নিচের নম্বরগুলোতে- ,জাতীয় রোগতত্ত্ব, রোগনিয়ন্ত্রণ ও গবেষণা ইনস্টিটিউটের (আইইডিসিআর) নম্বর: ১০৬৫৫ ও ০১৯৪৪৩৩৩২২২
ই–মেইল: iedcrcovid19@gmail.com,করোনাবিষয়ক তথ্য পেতে এবং সম্ভাব্য আক্রান্ত ব্যক্তি সম্পর্কে তথ্য দিতে ওয়েবসাইট: corona.gov.bd,স্বাস্থ্য অধিদফতরের হটলাইন নম্বর ১৬২৬৩,স্বাস্থ্য বাতায়নের হটলাইন নম্বর ৩৩৩,সশস্ত্র বাহিনীর সঙ্গে যোগাযোগের নম্বর: ০১৭৬৯০৪৫৭৩৯,মিথ্যা বা গুজব প্রচারের বিষয়টি নজরে এলে
৯৯৯ অথবা ৯৫১২২৬৪, ৯৫১৪৯৮৮,দাফন কার্যক্রমে সহায়তা পেতে,স্বাস্থ্য মন্ত্রণালয়ের দায়িত্বপ্রাপ্ত দুই যুগ্ম সচিবের
মুঠোফোন নম্বর: ০১৭১২০৮০৯৮৩ ও ০১৫৫২২০৪২০৮,করোনা পরিস্থিতিতে সহায়তার জন্য,নারী ও শিশু নির্যাতন প্রতিরোধে ন্যাশনাল হেল্পলাইন সেন্টারে ফোন বা এসএমএস করা যাবে, প্রতি দিন এবং যে কোনো সময়। টোল ফ্রি নম্বর: ১০৯,মনঃসামাজিক সহায়তা সেল,বাংলাদেশ রেড ক্রিসেন্ট সোসাইটি মানসিক স্বাস্থ্যসেবা নিশ্চিত করতে মনঃসামাজিক সহায়তা সেল চালু করেছে। ,রোববার থেকে বৃহস্পতিবার পর্যন্ত সকাল ৯টা থেকে বিকাল ৫টার মধ্যে ফোনকলের মাধ্যমে সেবা মিলবে।
ফোন:  ০১৮১১৪৫৮৫৪১ও০১৮১১৪৫৮৫৪২,মুঠোফোনে দন্ত রোগের চিকিৎসা,মুখ ও দাঁতের চিকিৎসা পেতে বাংলাদেশ ডেন্টাল সোসাইটির সদস্যদের মুঠোফোনে যোগাযোগ করে চিকিৎসা নেয়া যাবে।,নম্বর: ০১৭১১১৩৬৩৬২, ০১৭৪১৪৯০১৩৪, ০১৭১১৫৪০০৪৫, ০১৭১১৯৩৭৫৯০, ০১৭১১৮০০০৪৯, ০১৭১২৪৮৬৫৪৮ ০১৭১৫০৭৫৭৪০, ০১৭১৭২১১১০৫, ০১৮১৭৫৪১০০৫ ও ০১৮১৭০৯৪৩৩১,জরুরি ত্রাণ পেতে,ঢাকা জেলা প্রশাসনের হটলাইন: ০২৪৭১১০৮৯১, ০১৯৮৭৮৫২০০৮,ঢাকা দক্ষিণ সিটি কর্পোরেশন: ০১৭০৯৯০০৭০৩, ০১৭০৯৯০০৭০৪,ঢাকা উত্তর সিটি কর্পোরেশনের পরামর্শ সেবা,পাঁচটি অঞ্চলে করোনাভাইরাসসংক্রান্ত চিকিৎসা তথ্য ও পরামর্শ সেবা চালু।,মগবাজার: ৯৩৫৫২৭৭, মোহাম্মদপুর: ০১৩১১-৯৪৬৪৩২, মাজার রোড, মিরপুর: ০১৩০১-৫৯৬৮৩৯,,বর্ধিত পল্লবী, মিরপুর: ০১৭৭০-৭২২১৯৪ এবং উত্তরা: ০১৩১৪-৭৬৬৫৪৫,"
