Blog Titles,Blog Content
করোনা থেকে সুরক্ষিত থাকতে যা করবেন," ‘২০১৯ এনসিওভি’ নামের ভাইরাস থেকেই এই রোগ ছড়িয়ে পড়ছে। কয়েক দশক আগেও এই ভাইরাস এত মারাত্মক ছিল না। কিন্তু জিনগত মিউটেশনের ফলে কোনো কোনো ভাইরাস তার স্বভাব, আকার ও প্রকৃতি বদলে ফেলে। ,প্রাণঘাতী এই ভাইরাস এখন মহামারী রুপ নিয়েছে। তাই এই ভাইরাসের সঙ্গে লড়াই করা এখন কঠিন বিষয় হয়ে দাঁড়িয়েছে। ,চিকিৎসকদের মতে, করোনা নিয়ে আতঙ্কিত ও ভয় পাওয়ার কোনো কারণ নেই। ১০০ জনের মধ্যে মোটে দুজনের এই রোগে মৃত্যু হতে পারে। বাকি ৯৮ জনই কিন্তু শরীরের প্রতিরোধ ক্ষমতা দিয়ে এই অসুখ থেকে সুস্থ হতে পারবেন।  ,তবে কিছু নিয়ম মেনে চললে করোনা ঝুঁকি কমে। আসুন জেনে নিই করোনা থেকে সুরক্ষিত থাকতে যা করবেন-,
১. সাবান বা অ্যালকোহল বেসড হ্যান্ডওয়াশ দিয়ে হাত ভালোভাবে ধুয়ে নিন। ,২. প্রকাশ্যে কফ বা থুতু ফেলবেন না।,৩. সুস্থ মানুষের জন্য মাস্ক লাগবে না। তবে ঘরে কোনো আক্রান্ত মানুষ থাকলে বা বাইরে বের হলে মাস্ক ব্যবহার করুন। মাস্ক য়েখানে-সেখানে ফেলবেনও না।,৪. ঘরবাড়ি, অফিস পরিষ্কার রাখুন।,৫. জ্বরের সঙ্গে সর্দি-কাশি-শ্বাসকষ্ট ও নিম্ন রক্তচাপের সমস্যা থাকতে পারে। এসব লক্ষণ দেখা দিলে ওষুধ খাওয়া ১০ দিনের মধ্যেও যদি ভালো না হয়, তবে চিকিৎসকের পরামর্শ নিন।  ,৬. যদি কোভিড-১৯-এ আক্রান্ত হয়েও থাকেন। তবে নিয়ম মেনে চললে সারবে। অন্তত ১৪ দিন আলাদা থাকুন। 
৭. রোগ প্রতিরোধ ক্ষমতা বাড়ে এমন খাবার খান। এ ছাড়া  ডাক্তারের পরামর্শ নিয়ে ওষুধ সেবন করতে পারেন। ,তথ্যসূত্র: আনন্দবাজার পত্রিকা,"
রোগ প্রতিরোধ ক্ষমতা বাড়াবে ৬ খাবার,"শরীরে রোগ প্রতিরোধ ক্ষমতা বাড়ানো খুবই প্রয়োজন। কারণ কোনো মানুষের শরীরে রোগ প্রতিরোধ ক্ষমতা না থাকলে সে সহজে যে কোনো রোগে আক্রান্ত হতে পারে। ,তাই রোগ জীবাণু ও সংক্রমণ রোধে রোগ প্রতিরোধ ক্ষমতা শক্তিশালী করা প্রয়োজন। এ সময়ে ঠাণ্ডা-জ্বর, হাঁচি-কাশিতে আক্রান্ত হন অনেকেই। এসব রোগ দূরে রাখতে শরীরে রোগ প্রতিরোধ ক্ষমতা বাড়ানো প্রয়োজন। ,কিছু খাবার রয়েছে যা আপনার শরীরে রোগ প্রতিরোধ ক্ষমতা বাড়াবে। জীবনযাপনবিষয়ক একটি ওয়েবসাইটে প্রকাশিত প্রতিবেদন থেকে রোগ প্রতিরোধ ক্ষমতা বাড়ানো কিছু খাবার সম্পর্কে জানা গেছে। ,আসুন জেনে নিই এমন কিছু খাবার সম্পর্কে. যা শরীরে রোগ প্রতিরোধ ক্ষমতা বাড়ায়-,১. পুষ্টিতে ভরপুর আমলকী শরীরে রোগ প্রতিরোধ ক্ষমতা বাড়ায়। আধ চা-চামচ তাজা আমলকী পিষে এর সঙ্গে এক কোষ রসুন-বাটা মিশিয়ে খালি পেটে খেলে রোগ প্রতিরোধ ক্ষমতা বাড়ে।,২. খালি পেটে নিমপাতা-বাটা খেলে রক্ত পরিষ্কার হয়। এ ছাড়া ভাইরাস ও ব্যাক্টেরিয়া রোধী উপাদান যা রোগ প্রতিরোধ ক্ষমতা বাড়াতে সহায়তা করে।,৩. তুলসি পাতা, আদা কুচি ও গোলমরিচ মিশিয়ে গরম চা খেতে পারেন। এসব চা ব্যাক্টেরিয়ার কারণে হওয়া অসুখ দূর করতে ও রোগ প্রতিরোধ ক্ষমতা বাড়াতে সহায়তা করে। ,৪. খেতে পারেন কমলার রস ও মরিচ। এক গ্লাস কমলার রসের সঙ্গে এক চিমটি মরিচের গুঁড়া মিশিয়ে পান করতে পারেন প্রতিদিন। কমলা অ্যান্টিঅক্সিডেন্ট ও ভিটামিন সি সমৃদ্ধ, যা রোগ প্রতিরোধ ক্ষমতা বাড়ায়। ,৫. আদা রস করে কয়েকটা তুলসি পাতা ও এক চা-চামচ মধু মিশিয়ে প্রতিদিন খেতে পারেন। এই খাবার ঠাণ্ডা কাশি দূরে রাখবে।,৬. তুলসি পাতার সঙ্গে মধু ও গোলমরিচের গুঁড়া মিশিয়ে প্রতিদিন খেতে পারেন। পাঁচ-সাতটা তুলসি পাতার সঙ্গে দুটা গোলমরিচের দানা গুঁড়া করে দিন। সঙ্গে এক চা-চামচ মধু মেশান। মিশ্রণটি খালি পেটে খেলে উপকার পাবেন।,"
যেভাবে বুঝবেন করোনায় আক্রান্ত নাকি সাধারণ ফ্লু,"চীন থেকে ছড়িয়ে পড়া প্রাণঘাতী করোনাভাইরাসে আক্রান্তের সংখ্যা এক লাখ ছাড়িয়ে গেছে। বিশ্বের ৯০ দেশে ছড়িয়ে পড়া এ ভাইরাসে মারা গেছে অন্তত সাড়ে তিন হাজার। ,আর এই করোনা নিয়ে এখন মানুষের মধ্যে আতঙ্ক ছড়িয়ে পড়েছে। বেশিরভাগ মানুষ সাধারণ সর্দি-কাশির ভাইরাস ও করোনার মধ্যে পার্থক্য বুঝতে পারে না। এ জন্য সর্দি-কাশির সমস্যা হলে অনেকে চিন্তায় পড়ে যান। ,বর্তমানে ঋতু পরিবর্তনের ফলে প্রকোপ বেড়েছে জ্বর-সর্দি-কাশির; অনেকে ভুগছেন জ্বর-সর্দি-কাশির সমস্যায়। ,যে কোনো রোগ প্রতিরোধ ও আক্রান্ত হওয়ার পর সুস্থ হওয়ার জন্য অবশ্যই ওই রোগের কারণ ও প্রতিকার জানতে হবে। আর আপনি কি ধরনের রোগে আক্রান্ত হয়েছেন তা নিশ্চিত করা প্রয়োজন। ,‘২০১৯ এনসিওভি’ নাম নিয়ে আসা এই ভাইরাস ইতিমধ্যে ত্রাসের জন্ম দিয়েছে। এ ভাইরাস থেকে ছড়িয়ে পড়া রোগের নাম কোভিড-১৯। ,করোনা ও সাধারণ ফ্লু আক্রান্ত হলে কীভাবে বুঝবেন?
এ বিষয়ে জানাচ্ছেন বক্ষরোগ বিশেষজ্ঞ সুমিত সেনগুপ্ত ও বিশ্বনাথ চক্রবর্তী।,বিশ্বনাথ বাবুর মতে, জ্বর-সর্দি-হাঁচি-কাশি আমরা যা করি সাধারণত তাই করতে হবে। ঘরে থেকে বিশ্রাম নেয়া, হালকা খাবার ও কুসুম গরম পানি খেতে হবে।,তিনি বলেন, প্রয়োজন হলে প্যারাসিটামল, কাশির ওষুধও  খেতে পারেন। এ ছাড়া হাঁচি-কাশির সময় পরিষ্কার রুমাল ব্যবহার করবেন। শিশু, বয়ষ্ক, রুগ্ন ও গর্ভবতীদের থেকে দূরে থাকবেন। শরীরের রোগ প্রতিরোধ ক্ষমতার মাধ্যমেই যে ভাইরাসকে কাবু করা যাবে। তখন বুঝতে হবে এটি সাধারণ ফ্লুই ছিল। যদি ১০ দিনেও অসুখ না কমে, তবে অবশ্যই চিকিৎসার ব্যবস্থা করবেন।,সাধারণ ফ্লু সম্পর্কে তিনি বলেন, বক্ষরোগ বিশেষজ্ঞ সুমিত সেনগুপ্তের মতে, এই ভাইরাস যদি ১০০ জনকে সংক্রামিত করে তার মধ্যে ১০-১৫ কি ২০ জনের অবস্থা জটিল হয়। বিপদ হয় দু’-একজনের। বাকি ৮০-৮৫ শতাংশ মানুষের সাধারণ ভাইরাস সংক্রমণের মতো উপসর্গ হয়। শরীরে অ্যান্টিবডি তৈরি হলে তা নিজের নিয়মেই কমে যায়।,বিশ্বনাথ চক্রবর্তী জানিয়েছেন, যদি কিডনি-লিভারের অসুখ না থাকে, শরীরের নিজস্ব রোগ প্রতিরোধ ক্ষমতা কমে না যায় এবং বয়স খুব বেশি না হয় তা হলে চিন্তার কারণ নেই।  ,তিনি বলেন, এসব রোগের উপসর্গ দেখা দেয়ার পর ৭২ ঘণ্টা অপেক্ষা করা যেতে পারে। তার পর যদি দেখা যায় উপসর্গ কমার বদলে বাড়ছে, প্রবল জ্বর উঠছে বা শ্বাসকষ্ট হচ্ছে, রক্তচাপ কমে মাথা ঘুরছে, প্রলাপ বকতে শুরু করছে, তা কিন্তু বিপদের লক্ষণ। এসব লক্ষণ দেখা দিলে অবশ্যই ডাক্তার দেখাতে হবে। ,তথ্যসূত্র: আনন্দবাজার পত্রিকা,"
ফল থেকে হবে মোবাইল চার্জ!,"হঠাৎ যদি মোবাইলের চার্জ নষ্ট হয়ে যায়, তবে আপনাকে পড়তে হয় বিপাকে। কারণ চার্জ শেষ হওয়ার সঙ্গে সঙ্গে মোবাইল বন্ধ হয়ে যায়। ,তবে মোবাইলের চার্জ শেষ হলেও এখন আর চিন্তার কারণ নেই। মুহূর্তে ফল থেকে চার্জ দিতে পারবেন মোবাইল। শুনতে অবাক লাগলেও ঘটনা কিন্তু সত্যি। ,সিডনি বিশ্ববিদ্যালয়ের এক গবেষক এই ডিউরিয়ান ফ্রুট নামে এক ফলের বর্জ্যকে ‘সুপার ক্যাপাসিটর' বা তড়িতের ধারকে রূপান্তরিত করেছেন, যা থেকে সহজেই এনার্জি উৎপন্ন করা যাবে এবং তা থেকে স্মার্টফোন, ল্যাপটপ কিংবা প্রয়োজনীয় গ্যাজেটে চার্জ দেয়া যাবে। ,জার্নাল এনার্জি স্টোরেজে এ গবেষণা দলের একটি প্রতিবেদন প্রকাশিত হয়েছে। প্রতিবেদনে গবেষক দল জানায়, ফল থেকে তারা সুপার ক্যাপাসিটরে রূপান্তর করেছেন, যা থেকে মোবাইল ফোন চার্জ দেয়া যাবে। শুধু ডিউরিয়ান ফলই নয়, কাঁঠালের বর্জ্য থেকেও এটি করা সম্ভব।,সুপার-ক্যাপাসিটরগুলো সহজেই শক্তি সঞ্চয় ও নির্গমন করতে পারে, যা থেকে একটি ছোট ব্যাটারি আকারের ডিভাইসের মধ্যে প্রচুর পরিমাণে শক্তি সঞ্চয় করা যায়, যা থেকে কয়েক সেকেন্ডের মধ্যে মোবাইল ফোন, ট্যাবলেট এবং ল্যাপটপের মতো ডিভাইসে চার্জ করার জন্য শক্তি সরবরাহ করতে পারে।,এই গবেষণার প্রধান গবেষক অধ্যাপক ভিনসেন্ট গোমস জানান, কাঁঠাল ও ডিউরিয়ান ফলকে নিয়ে তারা গবেষণা করছেন। এই ফল থেকে প্রাপ্ত বর্জ্য দিয়ে স্থায়ী কার্বন এরোজেলে রূপান্তর করা হয়। আর এই কার্বন এরোজেল থেকে ইলেকট্রোড তৈরি করা হয়। ,তিনি বলেন, কার্বন এরোজেল থেকে ইলেকট্রোড তৈরি করা হয়। প্রাকৃতিকভাবে স্বাভাবিক সুপার-ক্যাপাসিটর থেকে উচ্চশক্তির এনার্জি স্টোরেজ ডিভাইস তৈরি করা প্রয়োজন। ,যেখানে জ্বালানির পরিমাণ কমছে সেখানে এই পদ্ধতিতে এনার্জি বাড়ালে একটা বিকল্প পথ তৈরি করা যাবে বলেও মনে করেন অধ্যাপক ভিনসেন্ট গোমস। ,সূত্র: হিন্দুস্তান টাইমস,"
ধর্ম বিষয়ক মন্ত্রণালয়ে নিয়ােগ,"ধর্ম বিষয়ক মন্ত্রণালয়ের রাজস্ব খাতভুক্ত পদে জনবল নিয়োগের বিজ্ঞপ্তি প্রকাশিত হয়েছে।,পদের নাম: অফিস সহায়ক
পদসংখ্যা: ৭টি
যােগ্যতা: মাধ্যমিক স্কুল সার্টিফিকেট (এসএসসি) বা সমমানের পরীক্ষায় উত্তীর্ণ।
বেতনস্কেল: ৮,২৫০-২০,০১০ টাকা,যে সকল জেলার প্রার্থীদের আবেদনের প্রয়ােজন নেই: নরসিংদী, ফরিদপুর, গােপালগঞ্জ, নেত্রকোনা, ব্রাহ্মণবাড়ীয়া, নােয়াখালী, রাঙ্গামাটি, রাজশাহী, সিরাজগঞ্জ, নওগাঁ, গাইবান্ধা, কুড়িগ্রাম, ঠাকুরগাঁও, যশাের, ঝিনাইদহ, সাতক্ষীরা, কুষ্টিয়া, বরগুনা ও সিলেট জেলা। তবে এতিমখানা নিবাসী ও শারীরিক প্রতিবন্ধী কোটায় সকল জেলার প্রার্থী আবেদন করতে পারবেন।,আবেদনের নিয়ম: অনলাইনে mora.teletalk.com.bd ওয়েবসাইটের মাধ্যমে আবেদন করতে হবে। আবেদন করা যাবে ১০ মার্চ সকাল ১০টা থেকে ৩১ মার্চ বিকাল ৫টা পর্যন্ত।,"
বিবর্ণ জীবনে রঙের ছোঁয়া,"একটা সময় তাদের জীবন অনেক রঙিন ছিল। এই সাদা-কালো শহরেই তারা প্রতিনিয়ত রঙিন স্বপ্ন বুনতো। এক সময় তাদের সংসার হবে, সন্তান হবে। সন্তান বড় হয়ে তাদেরকে স্বপ্নের আপন নিবাস বানিয়ে দেবে। সুখ-শান্তিতে তাদের জীবন ফুরিয়ে যাবে। কিন্তু মানুষের ভাবনা ও বাস্তবতার মধ্যে বিস্তর ফারাক রয়েছে। ,তাদের জীবনে বোধহয় তাই ঘটেছে। শেষ বয়সে এসে তারা ঠিকই একটি আপন নিবাসের সন্ধান পেয়েছেন, কিন্তু সেটি তাদের স্বপ্নের আপন নিবাসের চেয়ে যোজন-যোজন দূরে দাঁড়িয়ে। তবুও, তারা স্বপ্ন দেখেন তাদের ছোট্ট সন্তানদের নিয়ে একদিন আপন নিবাসের ছোট ঘরে একসাথে থাকার।  ,শেষ বয়সে ফ্ল্যাটের একটা ঘরের কোণে যেসব প্রবীণ সদস্যদের জায়গা হয়নি, তাদেরকেই জায়গা করে দিয়েছে আপন নিবাস বৃদ্ধাশ্রম। ছোট একটা বাড়ি কিন্তু এর বিশালতা যেন আকাশের সমান। আপন নিবাস পরমাত্মীয়ের মতো তাদেরকে আগলে রেখেছে। ,বারো-তেরো বছর বয়সী কিশোরী থেকে ১২০ বছর বয়সী মা এখানে এসে নতুন করে ‘সংসার’ শুরু করেছেন। আপন নিবাসের মানুষেরা তাদের সময় মতো খাবার-দাবার দিচ্ছে, গোসল করিয়ে ঘুম পাড়িয়ে দিচ্ছেন, গ্রীষ্মে দখিনা বাতাসের পরশ দিচ্ছে, বর্ষার ছাতা হচ্ছে আর হিমে চাদর হয়ে তাদেরকে ওম দিচ্ছে। ,বাস্তবে, আকাশের সমান বিশালতার এই নিবাসটিরও বেশ কিছু সমস্যা ছিল। যেমন: পর্যাপ্ত ব্যবস্থা না থাকায় বৃষ্টি এলে পানি চুইয়ে পড়া, বাড়ির ভেতরের করুণ দশা, এমনকি দেয়ালে রঙের লেশমাত্র ছিল না এই নিবাসে। ,এ কারণে আপন নিবাস বৃদ্ধাশ্রমে এতো ভালোবাসার পাওয়ার পরও এক সময় নিজের সংসারে দাপিয়ে বেড়ানো মানুষগুলোর রঙিন মুহূর্তগুলো কোথায় যেন জীর্ণ আর মলিন হয়ে ছিল। আর প্রবীণ এই সদস্যদের জীবনে একটু রঙ এনে দিতে বার্জার পেইন্টস বাংলাদেশ আপন নিবাসের ঘরগুলোকে রাঙিয়ে দেয়।,গত বছরের ১০ সেপ্টেম্বর আপন নিবাসটির খোঁজ পেয়ে বার্জার রেনোভেশন টিম সেখানে গিয়ে উপস্থিত হয়। তারা আপন নিবাসের অবকাঠামোগত সমস্যাগুলো চিহ্নিত করে। পরবর্তীতে, বার্জার ইনোভেশন ল্যাবের সদস্যরা বিভিন্ন কালার স্কিম থেকে আপন নিবাসের জন্য উপযোগী রঙটি বেছে নেয়। ,পরে, দক্ষ রঙ কর্মীদের তত্ত্বাবধানে আপন নিবাসের ঘরগুলোকে রাঙিয়ে তোলা হয়। এছাড়াও, বার্জার নতুন আসবাব ও প্রয়োজনীয় সরঞ্জাম দিয়ে আপন নিবাসের ঘরগুলো সাজিয়ে দেয় নতুন করে। নতুন ঘরে তারা যেন একটু স্বস্তির নিঃশ্বাস ফেলতে পারেন।,এ নিয়ে আপন নিবাস বৃদ্ধাশ্রমের শেলী নামের একজন বলেন, ‘অসহায় মানুষের পাশে দাঁড়িয়ে আমাদের এই জীর্ণ-শীর্ণ বাড়িটিকে রঙে রঙিন করে দিয়েছে বার্জার পেইন্টস বাংলাদেশ লিমিটেড। এজন্য আমাদের মায়েরা শেষ বয়সে এখানে এসে আনন্দের সাথে দিন কাটাতে পারবেন বলে আমি বিশ্বাস করি। এমন একটি সুন্দর উদ্যোগ নেয়ার জন্য প্রতিষ্ঠানটিকে ধন্যবাদ।’,সর্বোপরি, কিছু মানুষের সাদা-কালো জীবনে রঙ ছড়িয়ে দিতে প্রতিনিয়ত কাজ করছে কিছু ব্যক্তি ও প্রতিষ্ঠান। সবার সম্মিলিত প্রচেষ্টায় একটি সুন্দর সমাজ বিনির্মাণ সম্ভব। এই নশ্বর জীবনে সবার মাঝে রঙ ছড়িয়ে দিতে পারার মতো আনন্দ আর কি ইবা আছে। আমরা যদি রং (ভুল) বদলে জীবনকে রঙিন করে তুলতে পারি, তাহলেই সম্ভব সবাই মিলে একটি সুন্দর সমাজ গড়ে তোলা। ,,"
