Blog Titles,Blog Content
অহংকারের একুশ,"আমার ভাইয়ের রক্তে রাঙানো একুশে ফেব্রুয়ারি আমি কি ভুলিতে পারি...,না, আমরা ভুলতে পারি না। আমি না। আমরাও না। কোনো বাঙালিই ভুলতে পারে না। ভুলতে পারবে না কোনোদিন। কেন ভুলব? সেদিন রাজপথে রক্ত ঝরেছে আমার ভাইয়ের। মায়ের ভাষার জন্য লড়াই করেছেন তারা। প্রাণ দিয়েছেন অকাতরে। সালাম, বরকত, রফিক, জব্বার, শফিউর, আউয়াল, অহিউল্লাহ- বাংলা মায়ের অমর শহীদ ছেলে। বুকের রক্ত দিয়ে তারা লিখেছেন বাঙালির পালটে যাওয়ার নতুন ইতিহাস। সেদিনের বাংলাভাষার দাবি থেকেই আজকের বাংলাদেশ। নিজের ভাষায় কথা বলা। স্বাধীন দেশে পথচলা।,একুশ মানে এগিয়ে চলা। একুশ মানে মাথা নত না করা। একুশ আমাদের চেতনার শেকড়। একুশ আমাদের গর্ব। একুশ আমাদের অহঙ্কার। তাই প্রতি বছর আমরা একুশ পালন করি শোকের শক্তিকে শাণিত করতে। আমাদের মনে রাখতে হবে- শুধু আবেগে দিনটি পালন নয়।,দিনটিতে নয় কোনো আনন্দ উৎসব। এটি মহান শহীদ দিবস। এটা যেমন শোকের দিন, তেমনি শক্তি আর সাহসের অপরাজেয় বরাভয়। খালি পায়ে প্রভাতফেরির দিবস। শহীদ মিনারে ফুলের শ্রদ্ধা নিবেদনের দিন। বাঙালি চেতনায় অনড় শপথের দিন। শুধু একদিন নয়, প্রতিদিন যাপনে একুশকে ধারণের দিন। আর তাই জানতে হবে একুশের ইতিহাস।,অমর কেন একুশ? একুশে ফেব্রুয়ারি? এ দেশ ছিল আগে পাকিস্তানের শাসনে। পশ্চিমা শাসকরা তাদের উর্দু ভাষায় কথা বলাতে চেয়েছিল আমাদের। বাঙালির প্রাণের ভাষা বাংলার টুঁটি চেপে ধরতে চেয়েছিল তারা।,প্রতিবাদে বাঙালির ভাষা-বিক্ষোভ শুরু হয় ১৯৪৭ সালের নভেম্বর-ডিসেম্বরে। তারপর চরম প্রকাশ। সেদিন ১৯৫২ সাল। একুশে ফেব্রুয়ারি। সকালবেলা। ঢাকা বিশ্ববিদ্যালয়ের ছাত্ররা ১৪৪ ধারা ভেঙে ফেলে। আন্দোলনে নেমে পড়ে রাজপথে। পুলিশ গুলি চালায় তাদের ওপর। রক্তে রঞ্জিত হয় রাজপথ। নাম জানা-অজানা শহীদ হন অনেকেই। ক্ষুব্ধ ঢাকা। উত্তাল সারা দেশ। পরদিন আবার রাজপথে বিক্ষুব্ধ আন্দোলন। এবার ছাত্রদের পাশে নামেন সাধারণ মানুষ। শহীদদের জন্য অনুষ্ঠিত হয় গায়েবানা জানাজা।,২৩ ফেব্রুয়ারি ঢাকা মেডিকেল কলেজ হোস্টেল প্রাঙ্গণে একরাতেই গড়ে ওঠে স্মৃতিস্তম্ভ- শহীদ মিনার। ২৬ ফেব্রুয়ারি তা গুঁড়িয়ে দেয় সরকার। তারপরও ভাষা আন্দোলন আরও বেগবান হয়। অবশেষে ১৯৫৪ সালের ৭ মে গণপরিষদের অধিবেশনে এ দেশের অন্যতম রাষ্ট্রভাষার স্বীকৃতি পায় বাংলা। সেই থেকে একুশে ফেব্রুয়ারি জাতীয় শোক দিবস। এখন ঢাকা মেডিকেল কলেজের সামনে জাতীয় শহীদ মিনার সেই শোকের প্রতীক হয়ে দাঁড়িয়ে আছে।,বাঙালির মাতৃভাষাকে ভালোবাসার চেতনা আজ ছড়িয়ে পড়েছে সারা বিশ্বে। একুশ এখন আন্তর্জাতিক মাতৃভাষা দিবস। এ অর্জন বাঙালির। বাংলাদেশের। ১৯৯৮ সাল। জাতিসংঘের মহাসচিব কফি আনান। তার কাছে আবেদন করা হয় একুশকে আন্তর্জাতিক মাতৃভাষা দিবস হিসেবে ঘোষণা করার জন্য। এর প্রাথমিক উদ্যোক্তা কানাডা প্রবাসী দুই বাঙালি- রফিকুল ইসলাম ও আবদুস সালাম।,পরের বছর ১৭ নভেম্বর ইউনেস্কোর প্যারিসে অধিবেশনে সেই স্বীকৃতি মিলল। একুশে ফেব্রুয়ারিকে ঘোষণা করা হল আন্তর্জাতিক মাতৃভাষা দিবস হিসেবে। ২০০০ সাল থেকে দিবসটি জাতিসংঘের সদস্য দেশগুলোতে পালিত হচ্ছে।,একুশের চেতনা কী? আর তরুণরা সেই চেতনা ধারণ করে কিভাবে? শুধু তরুণ নয়, আমাদের সবাইকে প্রথমেই মনে রাখতে হবে- একুশ কোনো আনন্দ উৎসব নয়। শহীদ ভাইদের রক্তঝরা দিন। একুশের চেতনা মানে সেজেগুজে হাত ধরাধরি করে ঘুরে বেড়ানো নয়।,নেচে-গেয়ে মাতামাতি নয়। শহীদ মিনারে ফুল দিতে গিয়ে হইহুল্লোড় নয়। মজা করে পিঠা-পায়েস আর ফুচকা চটপটি খাওয়ার দিন নয়। বাংলা ইংরেজি হিন্দি মিলিয়ে জগাখিচুড়ি ভাষা নয়। একুশ মানে একদিন নয়। প্রতিদিন। শুদ্ধ বাংলা বলা। শুদ্ধ বাংলার চর্চা। সর্বস্তরে বাংলার প্রচলন। শহীদ দিবস যথাযথ পালন।,বাঙালি জাতির অহংকার এই একুশের চেতনা বুঝতে হলে সঠিক ইতিহাস জানতে হবে। পটভূমি বুঝতে হবে। একটি ভাষা আন্দোলন কিভাবে একটি দেশকে স্বাধীনতার পথ দেখাল তার মর্ম অনুভব করতে হবে। সব তরুণ সমান নয়। কারও কারও বুকে রয়েছে ভাষার জন্য দেশের জন্য তুমুল ভালোবাসা। আর এ তরুণরাই পারবে। সামনে অনেক সম্ভাবনা। আমাদের দেশের তরুণরা অনেক এগিয়েছে নানা ক্ষেত্রে।,লেখাপড়া, ব্যবসা-বাণিজ্য, খেলাধুলা, বিজ্ঞান, সাহিত্য-সংস্কৃতি, আইটি আরও কত জায়গায় তারা ভালো করছে। এই তো কদিন আগে বিশ্বকে নাড়িয়ে দিয়েছে আমাদের কয়েকজন তরুণ। ক্রিকেটে বিশ্বকাপ জিতেছে তারা।,আমাদের আগামী প্রজন্ম নিশ্চয় একুশের চেতনা সঠিকভাবে বুকে ধারণ করবে। আর সেই চেতনায় গেয়ে উঠবে- আমি বাংলায় গান গাই, আমি বাংলার গান গাই। আমি আমার আমিকে চিনি এই বাংলায়।,,লা রিভ,লা রিভ লঞ্চ করেছে নতুন ‘ফল-২৩ কালেকশন’। এ মৌসুমে পেইন্টারলি ও টোনাল ব্লক নামে দুটি প্রিন্টস্টোরি লঞ্চ করেছে লা রিভ। স্ট্রাইপ-প্যাটার্নে প্রেইরির বিস্তীর্ণ অঞ্চলে ফুটে থাকা ফুল ও পেইন্টারলি ফ্লোরাল মোটিফ দিয়ে সাজানো হয়েছে হায়ারলুম ফ্লোরাল প্রিন্টস্টোরিটি। নারী, পুরুষ ও শিশু; সবার পোশাকেই এ প্রিন্ট স্টোরিগুলো দেখা যাবে।,লা রিভ ফল কালেকশনে পাওয়া যাবে নারী ও কিশোরীদের লং ও মিড লেংথ টিউনিক, টপ, শ্রাগ-স্টাইল টিউনিক ও কামিজ, আবায়া টিউনিক, ক্লাসিক কামিজ, সালোয়ার-কামিজ, শার্ট ও টি-শার্ট। পুরুষ ও কিশোরদের সংগ্রহে দেখা যাবে ক্যাজুয়াল ও ফরমাল শার্ট, টি-শার্ট, পলো শার্ট, টুইন-ফিট পাঞ্জাবি, সঙ্গে পারফেক্ট ফিট বটমস। শিশুদের জন্য রয়েছে ফ্রক, টিউনিক, সালোয়ার-কামিজ, জাম্পস্যুট, টি-শার্ট, পলো শার্ট, পাঞ্জাবি ও ক্যাজুয়াল শার্টের কালেকশন।,বার্ডস আই,ফ্যাশন হাউজ বার্ডস আই বরাবরই নান্দনিক সব ধরনের পোশাক নিয়ে আসার চেষ্টা করে শোরুমগুলোতে। বিভিন্ন ডিজাইনের বাহারি সব পোশাক রয়েছে ফ্যাশন হাউজটিতে। বার্ডস আইয়ের সঞ্চালক মনে করে, পোশাক হচ্ছে আভিজাত্যের বহিঃপ্রকাশ। এবারের বিশেষ আয়োজন হিসাবে রয়েছে নানা রকম ডিজাইনের শার্ট। পাশাপাশি থাকছে টি-শার্ট, পলো শার্ট, টি-শার্ট, পাঞ্জাবি ইত্যাদি।,আজিজ সুপার মার্কেটের দ্বিতীয়তলায় বার্ডস আইয়ের দুটি মেগা শোরুমে রয়েছে পাইকারি ও খুচরা বিক্রয়ের ব্যবস্থা।,ভারতীয় ফ্রাঞ্চাইজি ফেমিনা ফ্লন্ট স্টুডিও সেলুন বিডির উদ্বোধন,সৌন্দর্যের মোহন ডালায় লাইফস্টাইল সেবার নতুন দিগন্ত খুলে দিতে এবার ঢাকা এলো উপমহাদেশে স্যালন পরিষেবা খাতের শীর্ষস্থানীয় নাম ফেমিনা ফ্লন্ট। ফেমিনা ফ্লন্ট স্টুডিও স্যালন বিডি নামের ফ্রাঞ্চাইজির জমকালো উদ্বোধন হয়ে গেল রাজধানীর গুলশানে। অভিজাত গুলশান-২ এর আর এম সেন্টার (২য় তলা), ১০১ গুলশান এভিনিউতে আয়োজিত এ অনুষ্ঠান উদ্বোধন করেন অভিনেতা নুসরাত ফারিয়া ও সিয়াম আহমেদ। ফেমিনাফ্লান্ট স্টুডি ও স্যালন বিডির ব্যবস্থাপনা পরিচালক মোহাম্মদ আক্তার এ সময় বলেন, ‘আমরা আমাদের প্রিয় শহরে এই সৌন্দর্য সেবাগুলো নিয়ে আসতে পেরে প্রকৃতই আনন্দিত।,উল্লেখ্য, ফেমিনাফ্লান্ট হচ্ছে বিখ্যাত ফেমিনা ম্যাগাজিন ব্র্যান্ডের একটি স্বতন্ত্র উদ্যোগ এবং টাইমস অব ইন্ডিয়া গ্রুপের অধীন ওয়ার্ল্ড ওয়াইড মিডিয়া প্রাইভেট লিমিটেডের একটি অঙ্গ প্রতিষ্ঠান।, ,,মিরসরাইয়ের পাহাড় রেঞ্জটি একটি ঝরনার ঝুরিবিশেষ। এই একটি এলাকায় যত ঝরনা আছে, চিন্তা করা কঠিন হয়ে যায় মাঝে মধ্যে। ঝরনার পাশাপাশি আছে ঝরনা ট্রেইল বা স্থানীয় ভাষায় ছড়া, আর শুদ্ধভাবে বলতে গেলে ঝিরিপথ। বর্ষা মৌসুমে পাহাড়ি ঝরনায় পানি বেশি থাকে, তাই পর্যটকরাও এ সময় এসে বেশ আনন্দ পান। ঝরনার পানিতে শরীর ভেজাতে পর্যটকরা দূরদূরান্ত থেকে ছুটে আসেন। আপনি চাইলে ঘুরে আসতে পারেন চট্টগ্রামের মিরসরাইয়ের এ সাত ঝরনায়। নিচে সেসব ঝরনার বর্ণনা দেওয়া হলো।,খৈয়াছড়া ঝরনা,মিরসরাইয়ের সবকটির মধ্যে সবচেয়ে জনপ্রিয় ঝরনা হলো খৈয়াছড়া। যার আছে আটটি স্তর। এরই মধ্যে এ ঝরনা দেশ-বিদেশে আলোচিত। দেশের বিভিন্ন অঞ্চল থেকে পর্যটকরা আসছেন এ নয়নাভিরাম ঝরনা দেখতে। এ ঝরনায় যাওয়ার জন্য প্রথমেই মিরসরাইয়ের বড়তাকিয়া বাজারের কাছে খৈয়াছড়া আইডিয়াল স্কুলের সামনে নামতে হবে। সেখান থেকে ১০০ টাকা সিএনজি অটোরিকশা ভাড়ায় খৈয়াছড়া ঝরনার ঝিরির কাছে আসতে পারবেন। আর যদি সম্পূর্ণ পথ ট্র্যাকিং করে যেতে চান, তবে স্থানীয় যে কাউকে জিজ্ঞেস করলে পথের সন্ধান পাবেন। ঢাকা-চট্টগ্রাম হাইওয়েতে নেমে পূর্বদিকে গ্রামের রাস্তা ধরে মিনিট দশেক হাঁটার পর রেললাইন পাবেন। রেললাইন পার হয়ে ১০ থেকে ১৫ মিনিট হাঁটলে ঝিরির দেখা পাবেন। জঙ্গলের ভেতর দিয়ে ঝিরিপথ ধরে প্রায় ঘণ্টা দেড়েক হাঁটলে খৈয়াছড়া ঝরনার কাছে পৌঁছে যাবেন। পথে আরও অসংখ্য পর্যটকের সন্ধান পাবেন, তাই পথ হারানোর ভয় নেই। বিশেষ প্রয়োজনে ঝিরি পথের শুরুর জায়গা থেকে গাইড নিতে পারবেন।,নাপিত্তাছড়া ঝরনা ও ট্রেইল,এখানে মূলত তিনটি ঝরনা রয়েছে। এগুলো হলো- কুপিকাটাকুম, মিঠাছড়ি এবং বান্দরকুম বা বান্দরিছড়া। ঝরনাগুলোতে যাওয়ার যে ঝিরিপথ রয়েছে, সেটিকে নাপিত্তাছড়া ট্রেইল বলে। এ ঝরনায় যেতে প্রথমে আপনাকে মিরসরাইয়ের নয়দুয়ারিবাজারে নামতে হবে। নয়দুয়ারি বাজারে নেমে সেখান থেকে স্থানীয় গাইড নিয়ে অথবা নিজেই নাপিত্তাছড়া ঝরনায় চলে যেতে পারেন। নয়দুয়ারি থেকে হেঁটে যেতে ৩০ থেকে ৪০ মিনিট সময় লাগবে।,মহামায়া লেক ও ঝরনা,মহামায়া লেক বাংলাদেশের অন্যতম কৃত্রিম হ্রদ। এ লেকের টলটলে পানি আর পাহাড়ের মিতালি ছাড়াও এখানে পাহাড়ি গুহা, রাবার ড্যাম ও অনিন্দ্য সুন্দর ঝরনা রয়েছে। বোটে চড়ে লেকে ঘোরাঘুরির পাশাপাশি চাইলে পাহাড়ের গা ঘেঁষে নেমে আসা ঝরনার শীতল পানিতে ভিজে শরীর ও মনকে অপার্থিব প্রশান্তি দিতে পারেন। মহামায়া লেকে আছে কায়াকিং করার সুবিধা এবং চাইলে তাঁবুতে রাতে ক্যাম্পিং করে থাকতে পারবেন। মহামায়া লেকে আসতে হলে প্রথমে আপনাকে মিরসরাইয়ের ঠাকুরদিঘি বাজারে নামতে হবে। ঠাকুরদিঘি থেকে জনপ্রতি ১৫ টাকা সিএনজি অটোরিকশা ভাড়ায় চলে যেতে পারবেন মহামায়া ইকোপার্কের মেইন গেটে অথবা সিএনজি অটোরিকশা রিজার্ভ করে (ভাড়া ৮০ থেকে ১২০ টাকা) চলে আসবেন মহামায়া ইকো পার্ক। এ ইকো পার্কের ভেতরেই মহামায়া লেকের অবস্থান।,বাওয়াছড়া লেক ও ঝরনা,বাওয়াছড়া লেকের চারপাশের প্রাকৃতিক সৌন্দর্য দেখে যে কেউ মনোমুগ্ধ হবেন; যেন শিল্পীর তুলিতে আঁকা কোনো নিখুঁত ছবি। ঝরনার পানি আছড়ে পড়ার শব্দ এখানে নূপুর ধ্বনির মতোই মধুর। দুপাশের উঁচু পাহাড় থেকে পানি অবিরাম লেকে গড়িয়ে পড়ার দৃশ্য অপূর্ব প্রশান্তি এনে দেবে। সেই সঙ্গে পাহাড়ি সবুজের ফাঁকে পাখির কলতান মন কেড়ে নেয়। ভরা পূর্ণিমা রাতে বাওয়াছড়া লেক ক্যাম্পিংয়ের জন্য আদর্শ জায়গা। এ লেকে যেতে হলে আপনাকে মিরসরাই উপজেলার ছোট কমলদহ বাজারে নামতে হবে। সেখান নেমে দেড় কিলোমিটার পূর্ব দিকে পাহাড়ের পাদদেশে অবস্থিত বাওয়াছড়া লেক।,বোয়ালিয়া ঝরনা ও ট্রেইল,ঝরনা ও ঝিরিপথ বোয়ালিয়া ট্রেইলকে করেছে বহুগুণ দর্শনীয়। এক রাস্তায় আপনি পাবেন তিনটি ঝরনার দেখা। বোয়ালিয়া ট্রেইলে আছে বোয়াইল্যা, বাউশ্যা, অমরমানিক্য ঝরনা। দুই দিকে উঁচু পাহাড় আর মাঝখানে গিরিপথ, পাথুরে দুর্গম ঝিরি-যার দুপাশে গহিন জঙ্গল বোয়ালিয়া ট্রেইলকে করেছে এডভোরাস। এ ট্রেইলে যেতে হলে প্রথমে আপনাকে মিরসরাই বাজারে নামতে হবে। সেখান থেকে সিএনজি আটোরিকশায় যেতে হবে ব্র্যাক পোলট্রি ফিডের কারখানায়। এরপর বামে গেলেই পাবেন ঝরনার পথ। এ ছাড়া স্থানীয় জনগণের সহযোগিতা নিতে পারেন যে কোনো সময়।,সোনাইছড়ি ঝরনা ও ট্রেইল,মিরসরাই এলাকায় সবচেয়ে সুন্দর ট্রেইল হচ্ছে সোনাইছড়ি। ঝরনার সঙ্গে ঝিরিপথের সঙ্গে ছোট ছোট গুহা আর খুম আপনাকে দেবে প্রকৃতির দারুণ সৌন্দর্য উপভোগের সুযোগ। এ ট্রেইলে যেতে হলে প্রথমে আপনাকে মিরসরাইয়ের হাদি ফকিরহাট বাজারে নামতে হবে। সেখান থেকে হাদি ফকিরহাট জামে মসজিদের গলি ধরে হেঁটে অথবা সিএনজি অটোরিকশায় বড়পাথর যেতে হবে। সেখান থেকে শুরু করবেন ট্রাকিং।,রূপসী ঝরনা ও ট্রেইল,রূপসী ট্রেইলে প্রথম ঝরনা দর্শনে আপনি মুগ্ধ হয়ে যাবেন। এ ঝরনার পথ ধরে এগোলেই ভেতরে পাবেন দুটি পথ। দুটো পথ যেমন গহিনে, তেমনি অসাধারণ; সেই সঙ্গে দুটো পথেই দেখা মিলবে চমৎকার দুটি ঝরনা। রূপসী ঝরনার অনিন্দ্য সুন্দর রূপের কারণে স্থানীয়রা একে রূপসী ঝরনা নাম দিয়েছে। আঁকাবাঁকা গ্রামীণ সবুজ-শ্যামল মেঠোপথ পার হয়ে পাহাড়ের পাদদেশে গেলেই শোনা যাবে ঝরনার পানি গড়িয়ে পড়ার অপরূপ নূপুর ধ্বনি। দুই পাশে সুউচ্চ পাহাড়। শাঁ শাঁ শব্দে উঁচু পাহাড় থেকে অবিরাম শীতল পানি গড়িয়ে যাচ্ছে ছড়া দিয়ে। এ ঝরনায় যেতে হলে প্রথমেই আপনাকে মিরসরাইয়ের বড়দারোগাহাট বাজারে নামতে হবে। এরপর সিএনজি অটোরিকশাযোগে বড়দারোগাহাট বাজারের উত্তর পাশের ব্রিকফিল্ড সড়ক দিয়ে পাহাড়ের পাদদেশ পর্যন্ত যেতে হবে। সেখান থেকেই ঝরনার উদ্দেশে হাঁটা শুরু করবেন।,সতর্কতা,ঝরনায় দুর্ঘটনা এড়াতে প্রশাসন পর্যটকদের জন্য যে নির্দেশনা দিয়েছে, তা অবশ্যই মানতে হবে। এ নির্দেশনা না মানলে যে কোনো সময় দুর্ঘটনারও ঝুঁকি আছে। এ ছাড়া ঝরনায় গোসল করতে গিয়ে ওপর থেকে লাফ দেওয়া, পানিতে বেশিক্ষণ না থাকাই শ্রেয়। বিশেষ করে লাফ দিয়ে দুর্ঘটনার শিকার অনেকেই হয়েছে। এ ছাড়া বর্ষার সময় পাহাড়ের চূড়া পিচ্ছিল থাকে। তাই পাহাড়ের চূড়া থেকে পড়েও দুর্ঘটনা ঘটতে পারে। ঝুঁকিপূর্ণ জায়গায় ওঠা থেকে বিরত থাকবেন।,থাকা-খাওয়া-যাতায়াত,ঝরনায় যাতায়াতের রাস্তা ওপরে বলা আছে, চট্টগ্রামের একে খান-অলংকার থেকে মিরসরাইয়ের বাস যে কোনো সময় পাবেন। আপনার পছন্দের ঝরনার স্থানে নেমে যাবেন। আর ঢাকা থেকে বাসে অথবা ট্রেনেও আসতে পারেন মিরসরাই। আপনার পছন্দের ঝরনার লোকেশনে বাসের সুপারভাইজারকে বললে নামিয়ে দেবে। একইভাবে দেশের যে কোনো স্থান থেকে আসতে পারবেন ভ্রমণপিপাসুরা। এ ছাড়া মিরসরাইয়ে থাকা-খাওয়ার জন্য ভালো মানের হোটেল-রেস্টুরেন্ট রয়েছে।,"
