Blog Titles,Blog Content
ঘরে বন্দি থেকেও যেভাবে সুন্দর সময় কাটাতে পারেন,"করোনাভাইরাসের সংক্রমণ প্রতিরোধে বেশিরভাগ মানুষ এখন ঘরবন্দি সময় কাটাচ্ছেন। যারা প্রতিদিন কমপক্ষে ৮-১০ ঘণ্টার মতো সময় বাইরে কাটান, তাদের ঘরে বন্দি থাকাটা সত্যি কষ্টদায়ক।,আর আমরা যখন উদ্বেগ-উৎকণ্ঠার মধ্যে থাকি, তখন কোনো কিছুতেই আনন্দ খুঁজে পাই না। একটুতে চোখ ভিজে আসে, মেজাজ খিটখিটে হয়ে যায়; নৈরাশ্যও ভর করে। বিষণ্ণতায় মন খারাপের মাত্রা অনেক তীব্র ও স্থায়িত্বও তুলনামূলক বেশি। ,তাই বিপর্যয়ের এই দিনগুলোতে অল্পমাত্রায় উদ্বেগ, উৎকণ্ঠা, দুশ্চিন্তা, মন খারাপ কিংবা বিষণ্ণতা অস্বাভাবিক নয়।
তবে করোনা থেকে নিজে ও পরিবারের সঙ্গে কাটানো এই সময়টাকেও আপনি উপভোগ করতে পারেন। এই সময়টি হতে পারে  আপনার পরিবারের সঙ্গে কাটানো সুন্দর একটি সময়। ,ঘরে বন্দি থেকেও কীভাবে সুন্দর সময় কাটাবেন-,১. শুধু আমিই নই, অনেকেই এই পরিস্থিতির শিকার। এটি মেনে নিতে পারলে মনের অস্থিরতা কমে যাবে। ,২. শ্বাস-প্রশ্বাসের ব্যায়াম করতে পারেন। সোজা হয়ে চেয়ার-টুল-মোড়ার ওপরে কিংবা মেঝেতে বসে খুব ধীরগতিতে দীর্ঘশ্বাস নেয়া, আর ধরে না-রেখে খুব ধীরে প্রশ্বাস ছাড়া। অস্থিরতা বা টেনশন অনুভব করলে কিছুক্ষণ দু’চোখ বন্ধ করতে পারলে উদ্বেগ-উৎকণ্ঠা কিছুটা কমবে।,৩. ফোন বা সোশ্যাল নেটওয়ার্কের মাধ্যমে প্রিয়জন বা বন্ধুর কাছে মনের কথা বলতে পারেন। তাতে জমে থাকা অনুভূতির তীব্রতা কিছুটা কমে ভার কিছুটা হলেও হালকা হয়।,৪. টিভি বা সোশ্যাল নেটওয়ার্কের সামনে দীর্ঘক্ষণ বসে করোনা সংক্রমণ নিয়ে খবর শুনতে বা দেখতে থাকলে মন খারাপ হতে পারে। বাড়তে পারে দুশ্চিন্তা-উদ্বেগ-উৎকণ্ঠা-ভয় ও আশঙ্কার মাত্রা। করোনাসংক্রান্ত খবর সম্পর্কে সচেতন থাকতে দিনে দুই থেকে তিন বার টিভি দেখলেই হয়।,৫. করোনাসংশ্লিষ্ট খবরের তথ্যসূত্র, তার বিশ্বাস যোগ্যতা যুক্তিবোধ দিয়ে যাচাই করে নেয়া দরকার। তাতে অযথা উদ্বেগ কমে। ,৬. করোনা হলেই মৃত্যু এ কথা কখনও ভাববেন না।  এই রোগে আক্রান্তদের সেরে যাওয়ার হার অনেক অনেক বেশি।,৭. ঘরে থাকার একঘেয়েমি কাটাতে বই পড়ুন। খুঁজে নেয়া যায় নিজের মধ্যকার সুপ্ত সৃজনশীল সত্তাকেও। ,৮. হাতে তুলে নিতে পারি রঙের তুলি। অখণ্ড অবসরে অনেক দিন কথা না-হওয়া বন্ধুকে ফোন করতে পারেন। খোঁজ নিতে পারেন দূরে থাকা সেই স্বজনদের, বহুদিন যার খোঁজ নেই।,১০. ঘরে একসঙ্গে সারা দিন থাকার ফলে বিভিন্ন কারণে পরিবারের কাছের মানুষের মধ্যে মতান্তর ঘটতে পারে। সে জন্য পারস্পরিক দোষারোপ নয়, অন্যের অনুভূতি, সমস্যা, পরিস্থিতিকে তার জায়গা থেকে একটু বোঝার চেষ্টা করতে হবে। তা হলেই ঘরবন্দি থাকা শত প্রতিকূলতার মধ্যেও মধুর হয়ে উঠতে পারে।,১১. মানসিক সমস্যা খুব বেশি হলে মনস্তাত্ত্বিক কাউন্সেলর, মনোবিদ বা মনোচিকিৎসকের সহায়তা নেয়া যেতে পারে।
স্বাস্থ্য বিশেষজ্ঞের পরামর্শ হচ্ছে, জরুরি কারণ ছাড়া বাইরে না যাওয়া, সুষম পুষ্টিগুণসম্পন্ন খাবার খাওয়া, অল্প অল্প করে বার বার পানি খাওয়া, ঠিক সময়ে ঘুমাতে যাওয়া, একটু ব্যায়াম করা ও বিশ্ব স্বাস্থ্য সংস্থার স্বাস্থ্যবিধি মেনে চলা।,তথ্যসূত্র: আনন্দবাজার পত্রিকা,"
সুস্থ থাকতে এড়িয়ে চলুন ৪ খাবার,"ফাস্টফুড কালচারে অভ্যস্ত হয়ে পড়া এবং অনিয়ন্ত্রিত জীবনযাপনের কারণে শরীরে জেঁকে বসছে রোগবালাই।তাই সুস্থ থাকতে হলে কিছু খাবার অবশ্যই এড়িয়ে চলতে হবে।,নতুন এক গবেষণা বলছে,শরীরে বেশি চর্বি থাকলে অনিয়মিত হৃদস্পন্দনের শিকার হয় মানুষ। অনিয়মিত বা দ্রুত হৃদ্স্পন্দন আরটিরিয়াল ফিব্রিলেশন নামে পরিচিত। যা স্ট্রোক, হার্ট ফেইলিওর এবং অন্যান্য জটিলতার সৃষ্টি করতে পারে। ,পেন স্টেট গবেষণাটি করে। যা আমেরিকান জার্নাল অফ কার্ডিওলজি প্রকাশক করেছে।,গবেষণার জন্য আট বছর ধরে অতিরিক্ত ও সাধারণ উভয় ওজনের কিছু মানুষকে পযবেক্ষণ করা হয়। পরীক্ষামূলক ভাবে দেখা গেছে যে, চর্বি যুক্ত মানুষদের সাধারণ মানুষদের থেকে  ৪০% বেশি আট্রিয়াল ফিব্রিলেশন হওয়ার সম্ভবনা থাকে। ,গবেষক অ্যান্ড্রু  ফয়ের মতে, যদিও আপনি স্থূলতার শিকার কিন্তু এই গবেষণা থেকে প্রমাণ করেছে ওজন কমানোর বিষয়টি একেবারেই সাধারণ।,খাদ্য নিয়ন্ত্রণ, ব্যায়াম এমনকি অস্ত্রোপচারের মাধ্যমে ওজন কমানো যায়। আট্রিয়াল ফিব্রিলেশনের মত দীর্ঘস্থায়ী শর্ত অবশ্যই আপনার জীবনের ঝুঁকি কমিয়ে দেবে।  ,তাই অতিরিক্ত ওজন কমাতে ৪ খাবার এড়িয়ে চলুন -,রীফাইনড কার্বোহাইড্রেটস
 ,প্রথমেই যা করতে হবে সেটি হলো, আপনার প্রতিদিনের ডায়েট থেকে রীফাইনড কার্বোহাইড্রেটস সরিয়ে ফেলে খোসা সমেত শস্যদানা খান। যেসব খাবারে যথেষ্ঠ পরিমাণে কার্বোহাইড্রেটস থাকে। এসব খাবার রক্তের শর্করার এবং উচ্চ রক্তচাপ পরিচালনার ক্ষেত্রেও গুরুত্বপূর্ণ।,রেড মিট 
 ,খাসির মাংস ও গরুর মাংস  ছেড়ে মুরগির মাংস বা হাঁসের মাংস খেতে পারেন। এসব খাবার আপনার অতিরিক্ত চর্বি কমাতে সাহায্য করবে। চর্বিহীন মাংস আপনার শরীরের ওজন কমানোর সঙ্গে সঙ্গে প্রোটিনের মাত্রাও বাড়ায়।,ট্রান্স ফ্যাট,চিপস, তেলেভাজা জাতীয় খাদ্যে লবণ ও ট্রান্স ফ্যাটের পরিমাণ  অনেক বেশি। তাই এই ধরনের খাবার না খাওয়াই ভালো। ফাস্ট ফুড , চীজ যুক্ত পাস্তা , নুডলস , বা যে কোনো রেডিমেড  খাবারেই ট্রান্স ফ্যাট প্রচুর পরিমানে থাকে।,রিফাইন চিনি ,শরীরে চর্বি জমার অন্যতম কারণ রীফাইনড চিনি। তাই অতিরিক্ত ওজনের মানুষেরা এসব খাবার থেকে দূরে থাকায় শ্রেয়।আর পরিমাণের অতিরিক্ত চিনি খা্ওয়া যাবে না।  ,জাঙ্ক ফুড,অতিরিক্ত চর্বির অন্যতম কারণ হলো জাঙ্ক ফুডের নেশা। সপ্তাহে একবার বার্গার বা ভাজাভুজি খাওয়া যেতেই পারে। তবে তা যেন আপনার প্রতিদিনের রুটিনে পরিণত না হয় । যে কোনো অতিরিক্ত ওজনের মানুষের উচিত এসমস্ত খাবার ত্যাগ করে তাজা ফল সবজি খাওয়া।,তথ্যসূত্র: এনডিটিভি, ,"
চট্টগ্রাম বন্দরে চাকরি আবেদনের সময়সীমা বাড়ল,"চট্টগ্রাম বন্দর কর্তৃপক্ষের কয়েক ক্যাটাগরির পদে অনলাইন আবেদনের সময়সীমা বাড়ানো হয়েছে। ,চট্টগ্রাম বন্দর কর্তৃপক্ষের পরিচালক (প্রশাসন) স্বাক্ষরিত এক বিজ্ঞপ্তিতে এ তথ্য জানানো হয়েছে। ,বিজ্ঞপ্তিতে বলা হয়েছে, ‘সহকারী গবেষণা কর্মকর্তা/সহকারী পরিসংখ্যান কর্মকর্তা পদের আবেদনের শেষ তারিখ আগামী ১২ এপ্রিল। ইঞ্জিনিয়ার (ক্রাফট) ও ইঞ্জিন চালক-২য় শ্রেণী পদে আবেদনের সময়সীমা ১৫ এপ্রিল শেষ হবে।,দেশের বর্তমান করোনা পরিস্থিতির কারণে সব ক্যাটাগরির পদের আবেদনের সময়সীমা বাড়ানো হবে বলে বিজ্ঞপ্তিতে জানানো হয়েছে।, ,"
সংক্রমণ থেকে বাঁচতে খেয়ে দেখুন ৩ ফলের মিশ্রণ,"করোনাভাইরাসসহ বিভিন্ন রোগে আক্রান্তের ভয় এখন অনেক বেশি তাড়া করছে। এসব ভাইরাসের সংক্রমণ থেকে বাঁচতে রোগ প্রতিরোধে ক্ষমতা বাড়ানোর বিকল্প নেই।,বেদানা, লেবু ও কমলা পুষ্টিগুণে ভরপুর। এই তিনটি ফলের রস একসঙ্গে নিংড়ে পানীয় বানিয়ে রোজ একগ্লাস করে খেতে পারলে আপনার শরীরে ভিটামিন আর অ্যান্টি অক্সিডেন্টের অভাব হবে না। এই ফলের জুসে রোগ প্রতিরোধ ক্ষমতা বাড়বে। ,এই শরবতে রয়েছে এমন তিনটি ফল যা শরীরকে চাঙা করে নিমিষে। এছাড়া হজমশক্তি বাড়াবে বেদানা, কমলা এবং মুসাম্বি লেবুর রস দিয়ে বানানো এই পানীয়। পাশাপাশি রক্ষা করে সংক্রমণ, সর্দি, কাশি এবং ফ্লুর ঝুঁকি। ,কারণ, তিনটি ফলেই আছে ভিটামিন সি এবং অ্যান্টি অক্সিডেন্ট যা শরীরের রোগ প্রতিরোধ ক্ষমতা বাড়ায়। জীবাণুমুক্ত হতে সাহায্য করে। ,কীভাবে তৈরি করবেন,একটি পাত্রে বেদানা, লেবু ও কমলা এই তিনটি ফলের খোসা ছাড়িয়ে রস একসঙ্গে নিংড়ে নিন। এই ফলগুলো মিষ্টি হওয়ার বাড়তি চিনি যোগ করার প্রয়োজন নেই। ঠাণ্ডা যাতে না লাগে তার জন্য আপাতত বরফ এড়িয়ে চলুন।এবার এই পানীয় গ্লাসে করে পরিবেশন করুন।,দেখুন ভিডিওতে-   ,,তথ্যসূত্র: এনডিটিভি, ,"
৫ ভেষজে বাড়ান রোগ প্রতিরোধ ক্ষমতা,"নিজে ও পরিবারের সুরক্ষায় ভাইরাসের এই সময়ে দেহের রোগ প্রতিরোধ ক্ষমতা বাড়ানো জরুরি। রান্নাঘরে থাকা কিছু ভেষজ নিয়মিত খেলে বাড়বে রোগ প্রতিরোধ ক্ষমতা। 
আপনার হাতের নাগালেই রয়েছে পাঁচটি ভেষজ যা যা খেলে আপনার রোগ প্রতিরোধ ক্ষমতা বাড়বে।,তুলসী পাতা,তুলসী গাছের পাতা, বীজ, বাকল ও শেকড় সবকিছুই অতি প্রয়োজনীয়। ওষুধিগুণের এই তুলসী বিভিন্ন রোগ সারাতে ও রোগ প্রতিরোধ ক্ষমতা বাড়াতে খুব ভালো কাজ করে।,ঠাণ্ডা-কাশি থেকে রক্ষা পেতে তুলসী পাতা ও আদার রসের সঙ্গে একটু মধু মিশিয়ে খেতে পারেন। এতে ঠাণ্ডা-কাশি ভালো হবে।,এছাড়া ফুসফুসের দূর্বলতা, কাশি, কুষ্ঠ, শ্বাসকষ্ট, সর্দিজ্বর, চর্মরোগ, বক্ষবেদনা ও হাঁপানি, হাম, বসন্ত, কৃমি, ঘামাচি, রক্তে চিনির পরিমাণ হ্রাস, কীটের দংশন, কানব্যথা, ব্রংকাইটিস, আমাশয় ও অজীর্ণে তুলসী দিয়ে তৈরি ওষুধ বিশেষভাবে কার্যকর।,রসুন
 ,জীবাণু ধ্বংস করতে রসুন খুবই কার্যকরি। এক কোয়া রসুন বেটে এক গ্লাস কুসুম গরম পানির সঙ্গে মিশিয়ে প্রতিদিন খেলে বাড়বে রোগ প্রতিরোধ ক্ষমতা।,হলুদ,প্রাচীনকাল থেকে বহু রোগ সারাতে হলুদের ব্যবহার হয়ে আসছে। যে কোনো রোগ থেকে দূরে থাকতে হলুদ মিশ্রিত চা পান করতে পারেন প্রতিদিন। আদা, হলুদ ও লেবু দিয়ে চা বানিয়ে নিন।,দারুচিনি
 ,ঠাণ্ডা-কাশি সারাতে দারুচিনি বেশ কার্যকর। এক গ্লাস পানিতে মধু ও দারুচিনির গুঁড়া মিশিয়ে পান করুন প্রতিদিন।  ,লবঙ্গ,চায়ের সঙ্গে কয়েকটি লবঙ্গ মিশিয়ে নিন। এটি যেমন আপনাকে চনমনে রাখবে, তেমনি কাছে ভিড়তে দেবে না রোগবালাই।,তথ্য: বোল্ডস্কাই, ,"
মস্তিষ্কের তরঙ্গ থেকে কথা বের করবেন বিজ্ঞানীরা,"যন্ত্রের মাধ্যমে মানুষের মস্তিষ্কের তরঙ্গ অনুবাদ করে তা থেকে কথা বের করা হবে বলে জানিয়েছেন মার্কিন গবেষকরা।
তারা দাবি করছেন, মেশিন লার্নিং (এমএল) ব্যবহার করে অনেকটাই এ পথে এগিয়েছেন।  ,বিবিসি অনলাইনের এক প্রতিবেদনে বলা হয়েছে, কথা বলার সময় কোনো ব্যক্তির মস্তিষ্কের তরঙ্গ দেখে তা ডিকোড করার ক্ষমতার একটি ধাপ অতিক্রম করেছেন বিজ্ঞানীরা। ,মার্কিন যুক্তরাষ্ট্রের ক্যালিফোর্নিয়া বিশ্ববিদ্যালয়, সান ফ্রান্সিসকোর (ইউসিএসএফ) গবেষকেরা অ্যালগরিদমকে এমনভাবে প্রশিক্ষণ দিয়েছেন, যা মস্তিষ্কের ধরণকে রিয়েল টাইমে বাক্যে পরিবর্তন করে ফেলতে পারে। এ সময় বাক্য গঠনে ভুলের হার মাত্র ৩ শতাংশ বলেও জানিয়েছেন তারা। একে বলা হয় ‘ব্রেন-মেশিন ইন্টারফেস’। 
এর আগে স্নায়বিক কার্যকলাপ ডিকোডিং বা কোড থেকে বাক্য রূপান্তর করতে সাফল্যের হার ছিল অনেক সীমিত।,‘নেচার নিউরোসায়েন্স’ সাময়িকীতে সম্প্রতি এই গবেষণাবিষয়ক নিবন্ধ প্রকাশিত হয়।,এর আগে গবেষকেরা কেবল কোনো শব্দের ক্ষুদ্র অংশ বা কোনো বাক্যের সামান্য কিছু অংশ ডিকোড করতে পারতেন। তবে মেশিন লার্নিং বিশেষজ্ঞ ড. জোসেপ মার্কিন ও তার সহকর্মীরা মস্তিষ্কের তরঙ্গ দেখে পুরো বাক্য পড়ে ফেলার কাজটি নিখুঁতভাবে করার চেষ্টা চালান। ,চারজন স্বেচ্ছাসেবক বাক্য জোরে পড়ে শোনানোর সময় ইলেকট্রোড তাদের মস্তিষ্কের কার্যকলাপ রেকর্ড করে রাখে। 
এরপর তা কম্পিউটিং সিস্টেমে দেয়া হয়। এরপর কম্পিউটার সিস্টেম সেখান থেকে তথ্য বিশ্লেষণ করে শব্দ গঠন ও পরে বাক্য গঠন করে।,তবে গবেষকেরা এখনও তাদের গবেষণার সীমাবদ্ধতার কথা স্বীকার করেছেন। ,গবেষণা নিবন্ধে গবেষকেরা লিখেছেন, তাদের ডিকোডারকে আরও বেশি শেখানো হবে। এছাড়া নিয়মিত ভাষা ব্যবহারের সুযোগ দেয়া হবে। এ ক্ষেত্রে কী পরিমাণ ডেটা বা তথ্য লাগবে, তা জানা প্রয়োজন। ,"
