Blog Titles,Blog Content
ই-পাসপোর্ট: জেনে নিন কোন রঙের পাসপোর্ট কাদের জন্য,"ইলেকট্রনিক পাসপোর্ট যুগে প্রবেশ করল বাংলাদেশ। দক্ষিণ এশিয়ার প্রথম দেশ হিসেবে আজ থেকে ই-পাসপোর্টে যাত্রা শুরু বাংলাদেশের।,ই-পাসপোর্টের আবেদন করতে হলে প্রথমে (www.epassport.gov.bd) এই ওয়েবসাইটে লগ ইন করতে হবে। ওয়েবসাইটে ঢুকে ডিরেক্টলি টু অনলাইন অ্যাপ্লিকেশনে (Directly to online application) ক্লিক করতে হবে।,বাংলাদেশে ২২ জানুয়ারি থেকে চালু হয়েছে ই-পাসপোর্ট বিতরণ কর্মসূটি। ই-পাসপোর্ট চালু হলেও বাংলাদেশের নাগরিকদের জন্য আগের মতোই তিন রঙের পাসপোর্ট চালু থাকবে।,আসুন জেনে নিই কোন রঙের পাসপোর্ট কাদের জন্য,পাসপোর্টের তিন রঙ,বাংলাদেশে মূলত তিন রঙের পাসপোর্ট চালু আছে। এই  তিনটি রঙ ভিন্ন ধরন ও ব্যবহার নির্দেশকারী প্রতীক হিসেবে ব্যবহার হয়ে আসছে।
বাংলাদেশ ইমিগ্রেশন ও পাসপোর্ট অধিদফতরের পরিচালক মোহাম্মদ আবু সাঈদ বলেন, প্রথমে পাসপোর্ট ছিল তিন ধরনের। অর্ডিনারি বা সাধারণ পাসপোর্ট, স্পেশাল বা বিশেষ পাসপোর্ট এবং ডিপ্লোম্যাটিক বা কূটনৈতিক পাসপোর্ট।
বিশেষ পাসপোর্ট কেবলমাত্র ভারতে যাবার জন্য ইস্যু করা হতো বলে সেটি ইন্ডিয়ান পাসপোর্ট নামেও পরিচিত ছিল।,২০১০ সাল পর্যন্ত বাংলাদেশি সাধারণ পাসপোর্টের রঙ ছিল সবুজ, আর কূটনৈতিক পাসপোর্ট ছিল লাল রঙের। এ ছাড়া ইন্ডিয়ান পাসপোর্টের রঙও ছিল লাল। তবে সেটি কূটনৈতিক পাসপোর্টের চেয়ে কিছুটা আলাদা রঙের। ২০১০ সালের আগ পর্যন্ত বাংলাদেশের সব পাসপোর্ট হাতে লেখা ছিল।
কিন্তু ২০১০ সালে ইন্টারন্যাশনাল সিভিল অ্যাভিয়েশন অর্গানাইজেশন আইকাওয়ের নির্দেশনা অনুযায়ী– মেশিন রিডেবল পাসপোর্ট বা এমআরপি চালু করা হয়।,কোন পাসপোর্ট কার জন্য?,বিশ্বের বিভিন্ন দেশের পাসপোর্টের রঙ ভিন্ন ভিন্ন হয়। কিন্তু যে দেশ যে রঙ এরই পাসপোর্ট দিক না কেন, সেটি অবশ্যই ইন্টারন্যাশনাল সিভিল অ্যাভিয়েশন অর্গানাইজেশন আইকাওর কাছ থেকে পাসপোর্ট এর রঙের আর নকশার ছাড়পত্র নিতে হয়।
তবে সাধারণভাবে পৃথিবীতে লাল, নীল, সবুজ ও কালো এই চারটি রং এর ভিন্ন ভিন্ন ডের হয়।
বাংলাদেশে সাধারণভাবে সকলের জন্য সবুজ রং এর পাসপোর্ট চালু থাকলেও, দেশে আরো দুটি রং অর্থাৎ নীল এবং লাল পাসপোর্ট চালু রয়েছে।
কাদের জন্য কোন রঙ এর পাসপোর্ট?
 ,সবুজ পাসপোর্ট,ইমিগ্রেশন ও পাসপোর্ট অধিদপ্তরের পরিচালক সাঈদ বলেন,  জন্ম ও বৈবাহিক উভয় সূত্রে বাংলাদেশের সব নাগরিকের জন্য সবুজ পাসপোর্ট। এই রঙের পাসপোর্টে বিদেশে গমনের জন্য সংশ্লিষ্ট দেশের ভিসার প্রয়োজন হয়।,নীল পাসপোর্ট,নীল রঙের পাসপোর্টকে বলা হয় অফিসিয়াল পাসপোর্ট। সরকারি কাজে কোনো কর্মকর্তা বা কর্মচারী দেশের বাইরে ভ্রমণ করতে হলে এই অফিসিয়াল পাসপোর্ট ব্যবহার করা হয়।
এ পাসপোর্ট করার জন্য সংশ্লিষ্ট সরকারি অফিসের অনুমোদন বা গভর্নমেন্ট অর্ডার (জিও) প্রয়োজন হয়। নীল পাসপোর্টধারী ব্যক্তিরা অন্তত ২৭ দেশে বিনাভিসায় ভ্রমণ করতে পারবেন।,লাল পাসপোর্ট,লাল পাসপোর্টকে বলা হয় ডিপ্লোম্যাটিক বা কূটনৈতিক পাসপোর্ট। এই পাসপোর্ট পাবেন রাষ্ট্রপ্রধান, প্রধানমন্ত্রী, মন্ত্রিসভার সদস্য, সংসদ সদস্য এবং তাদের স্পাউস অর্থাৎ স্বামী বা স্ত্রী।,এ ছাড়া উচ্চতর আদালতের বিচারপতি, পাবলিক বিশ্ববিদ্যালয়ের উপাচার্য, পাবলিক সার্ভিস কমিশনের প্রধান, মন্ত্রণালয়ের সচিব এবং বিদেশে বাংলাদেশি মিশনের কর্মকর্তারা লাল পাসপোর্ট পান।
লাল পাসপোর্ট যাদের আছে, তাদের বিদেশ ভ্রমণের জন্য কোনো ভিসা প্রয়োজন হয় না। তারা সংশ্লিষ্ট দেশে অবতরণের পর অন-অ্যারাইভাল ভিসা পান।,তথ্যসূত্র: বিবিসি বাংলা,"
কেমোথেরাপি ছাড়াই হবে ক্যান্সারের চিকিৎসা: গবেষণা,"ক্যান্সার একটি জটিল রোগ। এই রোগে প্রতিবছর অনেক মানুষ মারা যায়। এ ছাড়া ক্যান্সারের চিকিৎসা ব্যয়বহুল হওয়ায় অনেক মানুষের পক্ষে স্বাস্থ্যসেবা নেয়া কঠিন হয়ে যায়। ,প্রতিনিয়ত ক্যান্সার নিয়ে গবেষণা চালিয়ে আসছেন বিজ্ঞানীরা। ক্যান্সার প্রতিরোধে নেয়া হচ্ছে নানাবিধ উদ্যোগ। এবার ক্যান্সারের চিকিৎসায় সুসংবাদ দিলেন বিজ্ঞানীরা।  
বিজ্ঞানীরা এক ধরনের রোগ প্রতিরোধকারী কোষ (টি-সেল) আবিষ্কার করেছেন, যা ক্যান্সার আক্রান্ত কোষকে নিশানা করে তার আক্রমণ ক্ষমতা বা কার্যক্ষমতাকে ধ্বংস করতে সক্ষম। 
বিজ্ঞানীদের দাবি, টি-সেল ক্যান্সার থেরাপির সাহায্যে দীর্ঘমেয়াদি চিকিৎসা ছাড়াই একাধিক ধরনের ক্যান্সার কোষকেই ধ্বংস করতে সক্ষম।,টি সেল কী?,টি সেল হলো এক ধরনের শ্বেত রক্তকণিকা। এই শ্বেত রক্তকণিকা শরীরের রোগ প্রতিরোধ ক্ষমতা ও তার (ইমিউন সিস্টেম) কার্যকলাপের অন্যতম অঙ্গ। এই টি-সেল শরীরে প্রবেশ করা ভাইরাস, ব্যাক্টেরিয়া বা ছত্রাকের সংক্রমণকে প্রতিহত করে আমাদের সুস্থতা বজায় রাখে।,টি-সেল ক্যান্সার থেরাপি কী?,বিজ্ঞানীরা কৃত্তিম উপায়ে এ চিকিৎসা চালাবেন। এই রোগ প্রতিরোধকারী টি-সেল বা শ্বেত রক্তকণিকার সংখ্যা বাড়িয়ে সেগুলোকে ক্যান্সারের টিউমার বা ক্যান্সার কোষকে (ম্যালিগন্যান্ট টিউমার) ধ্বংসের উদ্দেশ্যে চালিত করছেন। ফলে কেমোথেরাপি ছাড়াই ক্যান্সার কোষকে ধ্বংস করা সম্ভব হবে।
বিজ্ঞানীরা নতুন ধরনের এই কোষগুলোর নাম দিয়েছেন এমআর-১ (MR1)। তবে এখন পর্যন্ত এই কোষের পরীক্ষা-নিরীক্ষা চলছে। এখনও পর্যন্ত পরীক্ষাগারেই ইঁদুর বা মানব কোষের ওপর প্রয়োগ করা হয়েছে এই বিশেষ টি-সেল (MR1)। পরীক্ষা সফলও হয়েছে। 
তবে সরাসরি মানবদেহে প্রয়োগের জন্য আরও কয়েক ধাপ পরীক্ষা-নিরীক্ষা প্রয়োজন বলেও জানিয়েছেন তারা। এর পরই আসতে পারে সুসংবাদ। ,তথ্যসূত্র: জি নিউজ,"
নিয়োগ দেবে রপ্তানি প্রক্রিয়াকরণ এলাকা কর্তৃপক্ষ,"বাংলাদেশ রপ্তানি প্রক্রিয়াকরণ এলাকা কর্তৃপক্ষ (বেপজা) কর্মকর্তা নিয়োগের বিজ্ঞপ্তি প্রকাশ করেছে।,পদের নাম: কাউন্সিলর কাম ইন্সপেক্টর (সােশ্যাল)
যােগ্যতা: যেকোন বিষয়ে কমপক্ষে সিজিপিএ ২.২৫ অথবা দ্বিতীয় শ্রেণির স্নাতকোত্তর বা চার বছরের স্নাতক (সম্মান) ডিগ্রি। তবে ইন্ডাস্ট্রিয়াল রিলেশনস অ্যান্ড লেবার স্টাডিজ, ভিক্টিমোলজি অ্যান্ড রিস্টোরেটিভ জাস্টিস বিষয়ে স্নাতকোত্তর, মানবসম্পদ কর্মী/ শিল্প ব্যবস্থাপনায় ডিপ্লোমা অথবা কোন সরকারি বা স্বায়ত্তশাসিত সংস্থায় বা কোন শিল্প প্রতিষ্ঠানে সংশ্লিষ্ট ক্ষেত্রে কাজের বাস্তব অভিজ্ঞতা অতিরিক্ত যােগ্যতা হিসেবে বিবেচিত হবে।
বেতনস্কেল: ২২,০০০-৫৩,০৬০ টাকা,
পদের নাম: কাউন্সিলর কাম ইন্সপেক্টর (এনভায়রনমেন্ট)
যােগ্যতা: এনভায়রনমেন্টাল সায়েন্স এনভায়রনমেন্টাল ম্যানেজমেন্ট এন্ড প্ল্যানিং/ ভূগোল ও পরিবেশ/ রসায়ন/ ফলিত রসায়ন/ কৃষি রসায়ন/ এনভায়রনমেন্টাল ইঞ্জিনিয়ারিং/ কেমিক্যাল ইঞ্জিনিয়ারিংয়ে ন্যূনতম সিজিপিএ ২.২৫ অথবা দ্বিতীয় শ্রেণির স্নাতকোত্তর বা ৪ বছরের স্নাতক (সম্মান) বা স্নাতকোত্তর ডিগ্রি। কোন সরকারি বা স্বায়ত্তশাসিত সংস্থায় বা কোন শিল্প প্রতিষ্ঠানে বা কোন শিল্প ইউনিটে সলিড ও লিকুইড বর্জ্য পরিবীক্ষণ, শনাক্তকরণ ও ব্যবস্থাপনা কাজের বাস্তব অভিজ্ঞতা অতিরিক্ত যােগ্যতা হিসেবে বিবেচিত হবে।
বেতনস্কেল: ২২,০০০-৫৩,০৬০ টাকা,আবেদনের ঠিকানা: সচিব, বাংলাদেশ রপ্তানী প্রক্রিয়াকরণ এলাকা কর্তৃপক্ষ, বেপজা কমপ্লেক্স, বাড়ি নং-১৯/ডি, রােড নং-০৬, ধানমন্ডি, ঢাকা-১২০৫।
আবেদনের শেষ তারিখ: ১৬ ফেব্রুয়ারি ২০২০।,"
১৭তম শিক্ষক নিবন্ধনের বিজ্ঞপ্তি প্রকাশ,"১৭তম শিক্ষক নিবন্ধন পরীক্ষা ২০২০'র বিজ্ঞপ্তি প্রকাশ করেছে বেসরকারি শিক্ষক নিবন্ধন ও প্রত্যয়ন কর্তৃপক্ষ (এনটিআরসিএ)।,আবেদনের যোগ্যতা,যেহেতু বিষয়ভিত্তিক শিক্ষক নিয়োগ দেয়া হয় তাই প্রত্যেক বিষয়ের জন্য আবেদনের যোগ্যতা ভিন্ন। যোগ্যতা অনুযায়ী একজন প্রার্থী স্কুল বা স্কুল-২ এবং কলেজ উভয় পর্যায়েই আবেদন করতে পারবেন। শিক্ষাগত যোগ্যতার সংশ্লিষ্ট পরীক্ষায় অবতীর্ণ (এপিয়ার্ড) প্রার্থীরা আবেদন করতে পারবেন না। তবে বিগত নিবন্ধন পরীক্ষাগুলোতে উত্তীর্ণরাও ১৭তম শিক্ষক নিবন্ধন পরীক্ষার জন্য আবেদন করতে পারবেন।,আবেদনের নিয়ম,আগ্রহী প্রার্থীরা অনলাইনে ntrca.teletalk.com.bd ওয়েবসাইটের মাধ্যমে আবেদন করতে পারবেন। অনলাইনে আবেদন প্রক্রিয়া শুরু হবে আগামী ২৩ জানুয়ারি বিকাল ৪টায়। আবেদন করা যাবে ৬ ফেব্রুয়ারি রাত ১২টা পর্যন্ত।,পরীক্ষার সময়সূচি,আগামী ১৫ মে আগস্ট শুক্রবার সকাল ৯টা থেকে ১০টা পর্যন্ত স্কুল ও স্কুল-২ পর্যায়ের প্রিলিমিনারি পরীক্ষা এবং বিকেল ৩টা থেকে ৪টা পর্যন্ত কলেজ পর্যায়ের প্রিলিমিনারি পরীক্ষা অনুষ্ঠিত হবে। প্রিলিমিনারিতে উত্তীর্ণ প্রার্থীদের আগামী ৭ ও ৮ আগস্ট লিখিত পরীক্ষা নেয়া হবে।,"
নারীর চেয়ে পুরুষের ক্যান্সারের ঝুঁকি বেশি: গবেষণা,"পুরুষের ক্যান্সারে আক্রান্ত হওয়ার ঝুঁকি নারীর চেয়ে বেশি। আর জিনগত পার্থক্যের কারণেই পুরুষদের ক্যান্সারের ঝুঁকি বেশি বলে জানিয়েছেন গবেষকরা। 
‘জার্নাল অব দ্য ন্যাশনাল ক্যান্সার ইনস্টিটিউট’য়ে গবেষণাটি প্রকাশিত হয়। ,গবেষণা বলছে, নারীদের চেয়ে পুরুষের ক্যান্সারে আক্রান্ত হওয়ার ঝুঁকি বেশি। কারণ নারী ও পুরুষের ‘ডিএনএ’য়ের পার্থক্য রয়েছে।  ,তারা বলছেন, লিঙ্গ নির্ধারক ‘ওয়াই-ক্রোমোজোম’, যা শুধুই পুরুষের থাকে, তার নির্দিষ্ট কিছু জিন তাদের কার্যক্ষমতা হারালে পুরুষের ক্যান্সারের ঝুঁকি বাড়ে।৯ হাজার ক্যান্সারে আক্রান্ত রোগীর জিনের কার্যক্ষমতা নিয়ে গবেষণা চলানো হয়। গবেষণায় দেখা যায়, বিভিন্ন ধরনের কোষে থাকা ‘ওয়াই,ক্রোমোজোম’য়ের ছয়টি গুরুত্বপূর্ণ জিন তাদের কার্যক্ষমতা হারানোর কারণে পুরুষের ক্যান্সারের ঝুঁকি বাড়ে।,গবেষণার লেখক, স্পেনের ‘বার্সেলোনা ইনস্টিটিউট ফর গ্লোবাল হেলথ’য়ের হুয়ান রামোন গঞ্জালেজ বলেন, ভ্রণের লিঙ্গ নির্ধারণের ক্ষেত্রে ‘ওয়াই ক্রোমোজোম’ খুবই গুরুত্বপূর্ণ একটি বিষয়। বয়স বাড়ার সঙ্গে কিছু পুরুষের কোষ থেকে এই ‘ওয়াই ক্রোমোজোম’ পুরোপুরি নিশ্চিহ্ন যায়। ফলে ক্যান্সারের ঝুঁকি বাড়ে। ,‘ওয়াই ক্রোমোজোম’য়ের ছয়টি জিন মূলত ‘সেল-সাইকেল রেগুলেশন’ নিয়ন্ত্রণ করে, যার অবর্তমানে তৈরি হয় ‘টিউমার’। গবেষণা মতে, নারী ও পুরুষের মধ্যকার জৈবিক পার্থক্য বোঝা ক্যান্সারের প্রতিরোধ ও প্রতিষেধনের উপায় বের করার জন্য অত্যন্ত গুরুত্বপূর্ণ।,গঞ্জালেজ বলেন, 'পুরুষের ক্যান্সারের ঝুঁকি নারীদের তুলনায় বেশি হওয়ার পাশাপাশি পুরুষের চিকিৎসা পদ্ধতিও তুলনামূলক বেশি যন্ত্রণাদায়ক।'
গবেষণার প্রধান আলাইহান্দ্রো কাসেরিস বলেন, পুরুষের কাজের ধরনের কারণে তাদের ক্যান্সার সৃষ্টিকারী উপাদানগুলোর সংস্পর্শে আসার সম্ভাবনা বেশি থাকে। আর ডাক্তারের পরামর্শ নিতে চান না। ,গবেষণায় আরও জানা যায়, জৈবিক বিভিন্ন বিষয়ের কারণেও পুরুষের ক্যান্সারের ঝুঁকি বেশি। জৈবিক দিক হলো ‘ওয়াই ক্রোমোজোম’, যার কারণেই একজন মানুষ পুরুষ হিসেবে জন্মায়। আর দূষিত উপাদানের প্রভাব, তামাক ও অন্যান্য মাদকদ্রব্য সেবনও ‘ওয়াই ক্রোমোজোম’য়ের ক্ষতির কারণ হতে পারে।,"
